cod_accidente,descripcion_del_hecho - Final,responsabilidad,fuzzy,no_hpx
am    ,ingresar porton entrada casa choca moto puerta trasera acompanante circulaba unamuno moto circulaba sola persona cae moto desprende luz delantera ,comprometida,ingresar porton entrada casa chocando moto puerta trasera acompanante circulaba unamuno moto circulaba sola personas caen moto desprende luz delante,ingresar porton entrada casa chocando moto puerta trasera acompanante circulaba moto circulaba sola personas caen moto desprende luz delante
am    ,vhlo asegurado detenido conesa esperando tomar gaspar campos contraria detiene vhlo da paso asegurado inicia giro hacia moto venia circulando avendia contrario alta velocidad embiste parte delantera motociclista cae piso ,comprometida,vhlo aseg detenido conesa esperando tomar gaspar campos contraria detiene vhlo trasladado paso aseg inicia giro habia moto venia circulando venia contrario alta velocidad embiste parte delante motociclista caen piso,vhlo aseg detenido conesa esperando tomar gaspar campos contraria detiene vhlo trasladado paso aseg inicia giro habia moto venia circulando venia contrario alta velocidad embiste parte delante motociclista caen piso
am    ,vhl asegurado encontraba circulando caseros llega interseccion alberti maniobra girar hacia ultima colisionado terceromoto circulaba detras embiste lateral izquierda trasero lateral derecha personas moto femenino masculino llevaban ambas caen pavimento masculino levanta propios medios femenino izquierda pavimento aguardando trasladada masculino trasladado ,comprometida,vhl aseg encontraba circulando caseros llegar interseccion alberti maniobra girar habia ultima colisionando terceromoto circulaba detras embiste lateral izquierda trasero lateral derecha personas moto femenino masculino llevaba ambos caen pavimento masculino levanta propios medios femenino izquierda pavimento aguardando trasladado masculino trasladado,vhl aseg encontraba circulando caseros llegar interseccion maniobra girar habia ultima colisionando terceromoto circulaba detras embiste lateral izquierda trasero lateral derecha personas moto femenino masculino llevaba ambos caen pavimento masculino levanta propios medios femenino izquierda pavimento aguardando trasladado masculino trasladado
aa    ,vehiculo asegurado circulaba pje fernandezsiendo embestido tercero derecha frente derecha lateral trasero derechaasegurado desplazado haciendo trompo embistiendo arbol parte traserasin mas involucradoslesionados tercero aseguradoun patrullero pasaba involucratrasladandose papa tercera hosp thompson san martintercero golpes codo derecha tenia operadaaseurado latigazo hombro izquierda asegurado,concurrente,vehiculo aseg circulaba pje fernandezsiendo embestido tercero derecha frente derecha lateral trasero aseg desplazado haciendo trompo embistio arbol parte trasera mas involucradoslesionados tercero aseg patrullero pasaba trasladado papa tercera hospital thompson san martintercero golpes codo derecha tenia asegurado latigazo hombro izquierda aseg,vehiculo aseg circulaba pje embestido tercero derecha frente derecha lateral trasero aseg desplazado haciendo embistio arbol parte trasera mas tercero aseg patrullero pasaba trasladado papa tercera hospital thompson san golpes codo derecha tenia asegurado latigazo hombro izquierda aseg
aa    ,asegurado circulando martin castro maniobra girar rivadavia colisionado lateral delantero izquierda lateral trasero derecha tercero circulaba rivadavia capital federal luego asegurado colisionado lateral izquierda parte delantera tercero circulaba rivadavia ,comprometida,aseg circulando martin castro maniobra girar rivadavia colisionando lateral delante izquierda lateral trasero derecha tercero circulaba rivadavia capital federal luego aseg colisionando lateral izquierda parte delante tercero circulaba rivadavia,aseg circulando martin castro maniobra girar rivadavia colisionando lateral delante izquierda lateral trasero derecha tercero circulaba rivadavia capital luego aseg colisionando lateral izquierda parte delante tercero circulaba rivadavia
am    ,asegurado circulando julio disponia girar luz giro castelli tercero moto circulaba julio contramano embiste lateral izquierda moto iba solo ocupante cae piso ,comprometida,aseg circulando julio disponia girar luz giro castelli tercero moto circulaba julio contramano embiste lateral izquierda moto iba solo ocupantes caen piso,aseg circulando julio disponia girar luz giro castelli tercero moto circulaba julio contramano embiste lateral izquierda moto iba solo ocupantes caen piso
am    ,sacando auto casa moto vena toda velocidad espero q incorporara paso chocando auto,comprometida,sacando auto casa moto venia toda velocidad espejo choque incorporara paso chocando auto,auto casa moto venia toda velocidad espejo choque paso chocando auto
am    ,mecanica hecho segun version asegurado venia san martin doble chorroarin doble habia moto intentar esquivarme suelo maniobra brusca puse guinada demasiado maniobra salio ileso salvo molestia manodsa mecanica hecho segun tercero denuncia venia paternal habia salido trabajar dia sabado iba domicilio izquierda jose c paz paso puente cruzar chorroarin auto vw up color dobla poner luz giro encierra haciendo caiga moto lado derecha,comprometida,mecanica hecho segun version aseg venia san martin doble chorroarin doble habia moto intentar esquivarme suelo maniobra brusca puse guinada demasiado maniobra salio ileso salvo molestia manodsa mecanica hecho segun tercero denuncia venia lateral habia salido trabajar dia sabado iba domicilio izquierda jose produce paz paso puente cruzar chorroarin auto vw ocupantes dolor dobla poner luz giro encierra haciendo caiga moto lado derecha,mecanica hecho segun version aseg venia san martin doble chorroarin doble habia moto intentar esquivarme suelo maniobra brusca puse maniobra salio molestia mecanica hecho segun tercero denuncia venia lateral habia salido trabajar dia iba domicilio izquierda jose produce paz paso puente cruzar chorroarin auto vw ocupantes dolor dobla poner luz giro encierra haciendo caiga moto lado derecha
aa    ,venia libertador veo habia auto detenido semaforo momento freno llovia auto patino siguio pude evitar embestir tercero parte trasera parte delanterael tercero iba solo bajo mareado acompane hospital san isidro,comprometida,venia libertador veo habia auto detenido semaforo momento frena llovia auto patino siguio pude evitar embestido tercero parte trasera parte delante tercero iba solo bajo mareado acompanante hospital san isidro,venia libertador veo habia auto detenido semaforo momento frena llovia auto patino siguio pude evitar embestido tercero parte trasera parte delante tercero iba solo bajo acompanante hospital san isidro
aa    ,asegurado circulaba balbin interseccion uriarte gira hacia semaforo tercero circulaba direccion contraria embiste parte delantera lateral derecha vehiculo asegurado desplaza subiendo vereda impactando parte trasera poste luz asegurado hijo ocupante tercero sufren lesiones trasladados hospital larcade ,concurrente,aseg circulaba balbin interseccion uriarte gira habia semaforo tercero circulaba direccion contraria embiste parte delante lateral derecha vehiculo aseg desplazamientos subiendo vereda impacta parte trasera poste luz aseg hijo ocupantes tercero sufren lesiones trasladado hospital larcade,aseg circulaba balbin interseccion uriarte gira habia semaforo tercero circulaba direccion contraria embiste parte delante lateral derecha vehiculo aseg desplazamientos subiendo vereda impacta parte trasera poste luz aseg hijo ocupantes tercero sufren lesiones trasladado hospital
aa    ,mecanica hecho segun version asegurado dirigia aquino norte sur llego olivera choco vehiculo delante mio parte trasera mecanica hecho segun tercero denuncia circulaba aquino freno llegar olivera transito embestido atras tercero frenod,comprometida,mecanica hecho segun version aseg dirigia aquino norte sur llego olivera choco vehiculo delante mio parte trasera mecanica hecho segun tercero denuncia circulaba aquino frena llegar olivera transito embestido atras tercero frenod,mecanica hecho segun version aseg dirigia aquino norte sur llego olivera choco vehiculo delante mio parte trasera mecanica hecho segun tercero denuncia circulaba aquino frena llegar olivera transito embestido atras tercero
am    ,asegurado circulando aeronautica argentina cruzar interseccion don bosco colisiona angulo delantero derecha tercero moto personas caen piso presentan golpes piernas brazos ,comprometida,aseg circulando aeronautica argentina cruzar interseccion don bosco colisionando angulo delante derecha tercero moto personas caen piso presentaba golpes personas brazos,aseg circulando argentina cruzar interseccion don bosco colisionando angulo delante derecha tercero moto personas caen piso presentaba golpes personas brazos
peaton,mecanica hecho segun version asegurado sali domicilio llegar esquina alte brown doblando veo peaton venia cruzando manera correcta choco cae asfalto enseguida ofrecio asistencia marido asegurado traslado policlinico lomas ocurrio medio intensa luego atiendan hable hijas informaron dieron calmantes tenia ninguna lesion,comprometida,mecanica hecho segun version aseg sali domicilio llegar esquina alte brown doblando veo peaton venia cruzando manera correcta choco caen asfalto enseguida ofrecio asistencia marido aseg lado policlinico lomas ocurrio medios intensa luego atiendan hable hijas informaron dieron calmantes tenia ninguna lesiones,mecanica hecho segun version aseg sali domicilio llegar esquina alte brown doblando veo peaton venia cruzando manera correcta choco caen asfalto enseguida ofrecio asistencia marido aseg lado lomas medios luego atiendan hijas informaron dieron tenia ninguna lesiones
aci   ,asegurado circulaba itiuzaingo pasando bocacalle bicicleta venia contramano pueyrredon asegurado puede evitar chocarla bicicleta iban ocupantes caen piso solo presentaba lastimaduras ,concurrente,aseg circulaba itiuzaingo san bocacalle bicicleta venia contramano pueyrredon aseg puede evitar choca bicicleta iba ocupantes caen piso solo presentaba lastimaduras,aseg circulaba san bocacalle bicicleta venia contramano pueyrredon aseg puede evitar choca bicicleta iba ocupantes caen piso solo presentaba
am    ,asegurado ciruclaba belgrano ingresar estacion servicio colisiona motociclista circulaba misma lateral izquierda costado derecha moto motociclista cae suelo levanta mismo ,comprometida,aseg circulaba belgrano ingresar estacion servicio colisionando motociclista circulaba mismo lateral izquierda costado derecha moto motociclista caen suelo levanta mismo,aseg circulaba belgrano ingresar estacion servicio colisionando motociclista circulaba mismo lateral izquierda costado derecha moto motociclista caen suelo levanta mismo
am    ,mecanica hecho segun version asegurado vehiculo asegurado circulando crisologo larralde interseccion canada juan ruiz tercero moto circulaba ultima mencionada hacia logra evitar colisionar lateral izquierda vehiculo asegurado integrante tenia cae pavimento habria saltado colisionar vehiculo asegurado ,comprometida,mecanica hecho segun version aseg vehiculo aseg circulando solo larralde interseccion canada juan ruiz tercero moto circulaba ultima mencionada habia logra evitar colisionando lateral izquierda vehiculo aseg integrante tenia caen pavimento habia saltado colisionando vehiculo aseg,mecanica hecho segun version aseg vehiculo aseg circulando solo larralde interseccion canada juan ruiz tercero moto circulaba ultima mencionada habia logra evitar colisionando lateral izquierda vehiculo aseg integrante tenia caen pavimento habia colisionando vehiculo aseg
am    ,aseg circulaba pte h yrigoyen realiza maniobra hacia llega doblar toma contacto tercero moto circulaba contacto aseg paragolpe trasero derecha parte delantera moto habia solo ocupante puesto cayo piso manifesto raspones codo derecha cadera ,comprometida,aseg circulaba pte marcha yrigoyen realiza maniobra habia llegar doblar tomar contacto tercero moto circulaba contacto aseg paragolpe trasero derecha parte delante moto habia solo ocupantes puesto cayo piso manifesto raspones codo derecha cadera,aseg circulaba pte marcha yrigoyen realiza maniobra habia llegar doblar tomar contacto tercero moto circulaba contacto aseg paragolpe trasero derecha parte delante moto habia solo ocupantes puesto cayo piso manifesto raspones codo derecha cadera
am    ,vhl aseg circulando scalabrini ortiz girar hacia lerma colisiona motocicleta circulaba scalabrini ortiz frenar choca parte delantera aseg motocicleta iba persona cayo piso propios medios ,comprometida,vhl aseg circulando scalabrini ortiz girar habia lerma colisionando motocicleta circulaba scalabrini ortiz frena chocando parte delante aseg motocicleta iba personas cayo piso propios medios,vhl aseg circulando scalabrini ortiz girar habia colisionando motocicleta circulaba scalabrini ortiz frena chocando parte delante aseg motocicleta iba personas cayo piso propios medios
aci   ,mecanica hecho segun version asegurado asegurado circulando pte h irigoyen intentar girar colisiona ciclista circulaba costado ciclista impacta vehiculo cae piso ,comprometida,mecanica hecho segun version aseg aseg circulando pte marcha irigoyen intentar girar colisionando ciclista circulaba costado ciclista impactada vehiculo caen piso,mecanica hecho segun version aseg aseg circulando pte marcha irigoyen intentar girar colisionando ciclista circulaba costado ciclista impactada vehiculo caen piso
peatã“n,redgreenlue vehiculo asegurado circulaba azcuenaga doblar viamonte produce colision parte delantera vehiculo asegurado peaton cruzaba manifiesta lesion izquierda rostro asegurado lleva htal rivadaviadfilisaslqj ,comprometida,redgreenlue vehiculo aseg circulaba azcuenaga doblar viamonte produce colisionando parte delante vehiculo aseg peaton cruzaba manifiesta lesiones izquierda rostro aseg llevaba htal rivadaviadfilisaslqj,redgreenlue vehiculo aseg circulaba azcuenaga doblar viamonte produce colisionando parte delante vehiculo aseg peaton cruzaba manifiesta lesiones izquierda rostro aseg llevaba htal
am    ,mecanica hecho segun version asegurado circulaba ruta panamericana maniobro freno cruzo vehiculo siendo embestido moto atras paragolpes baul lateral trasero izquierda motociclista cae levanta medios rengueandollevaba casco,concurrente,mecanica hecho segun version aseg circulaba ruta panamericana maniobro frena cruzo vehiculo siendo embestido moto atras paragolpes baul lateral trasero izquierda motociclista caen levanta medios llevaba casco,mecanica hecho segun version aseg circulaba ruta panamericana maniobro frena cruzo vehiculo siendo embestido moto atras paragolpes baul lateral trasero izquierda motociclista caen levanta medios llevaba casco
am    ,mecanica hecho segun version asegurado circulando santa maria gire hacia tomar venezuela moto circula misma direccion choca parte trasera automovil solo ocupante moto cayo piso tenia colocado ,comprometida,mecanica hecho segun version aseg circulando san maria gire habia tomar venezuela moto circulaba mismo direccion chocando parte trasera automovil solo ocupantes moto cayo piso tenia colocado,mecanica hecho segun version aseg circulando san maria gire habia tomar venezuela moto circulaba mismo direccion chocando parte trasera automovil solo ocupantes moto cayo piso tenia colocado
aci   ,mecanica hecho segun version asegurado asegurado maniobra salir lugar estacionado impacta bicicleta parte delantera parte delantera tercero bicicleta cea suelo recibe asistencia lugar,comprometida,mecanica hecho segun version aseg aseg maniobra salir lugar estacionado impactada bicicleta parte delante parte delante tercero bicicleta cea suelo recibe asistencia lugar,mecanica hecho segun version aseg aseg maniobra salir lugar estacionado impactada bicicleta parte delante parte delante tercero bicicleta suelo recibe asistencia lugar
aa    ,mecanica hecho segun version asegurado vehiculo asegurado circulando carril rapido aut panamericana altura campana trafico vehiculos van frenando tercero corolla circulaba pone guino cambiar carril termina ingresando delante vehiculo asegurado maniobra brusca delante tercero carril rapido tercero frena produce choque terceros asegurado trata esquivarlo embiste parte frontal parte trasera tercero corolla mete delante resultan lesionados acompanantes vehiculo asegurado lesion muneca dolor acompanante tercero corolla dolor ,comprometida,mecanica hecho segun version aseg vehiculo aseg circulando carril rapido aut panamericana altura campana trafico vehiculo levanta frena tercero corolla circulaba pone guino cambiar carril termina san delante vehiculo aseg maniobra brusca delante tercero carril rapido tercero frena produce choque terceros aseg trata esquivarlo embiste parte frontal parte trasera tercero corolla mete delante resultan lesionados acompanante vehiculo aseg lesiones muneca dolor acompanante tercero corolla dolor,mecanica hecho segun version aseg vehiculo aseg circulando carril rapido aut panamericana altura campana trafico vehiculo levanta frena tercero corolla circulaba pone guino cambiar carril termina san delante vehiculo aseg maniobra brusca delante tercero carril rapido tercero frena produce choque terceros aseg trata esquivarlo embiste parte frontal parte trasera tercero corolla delante resultan lesionados acompanante vehiculo aseg lesiones muneca dolor acompanante tercero corolla dolor
am    ,asegurado circulando tucuman cruzar gral pico moto circulaba ultima impacta lateral derecha cae piso intervencion tel,comprometida,aseg circulando tucuman cruzar gral pico moto circulaba ultima impactada lateral derecha caen piso intervencion tel,aseg circulando tucuman cruzar gral pico moto circulaba ultima impactada lateral derecha caen piso intervencion tel
aci   ,redgreenlue venia circulando iwanoski llegar interseccion mayo toco paragolpe bicicleta cayendo asfalto ,comprometida,redgreenlue venia circulando iwanoski llegar interseccion mayo toco paragolpe bicicleta cayendo asfalto,redgreenlue venia circulando llegar interseccion mayo toco paragolpe bicicleta cayendo asfalto
am    ,circulaba arenales doblar interseccin parana olvide poner giro imprudencia ocasion santiago vidal motociclista vena atras patente ajgq scooter marca honda realizar maniobra brusca evitar chocarme ocasion moto caiga suelo herida taln debido presencia policial same datos tercero santiago vidal honda scooter hond ajgq,comprometida,circulaba arenales doblar interseccin parana olvide poner giro imprudencia ocasion san vidal motociclista venia atras patente ajgq scooter marcha honda realizar maniobra brusca evitar choca ocasion moto caiga suelo herida taln debido presencia policial same datos tercero san vidal honda scooter hond ajgq,circulaba arenales doblar interseccin parana poner giro ocasion san vidal motociclista venia atras patente ajgq scooter marcha honda realizar maniobra brusca evitar choca ocasion moto caiga suelo herida debido presencia policial same datos tercero san vidal honda scooter ajgq
am    ,mecanica hecho segun version asegurado asegurado circulando colectora panamericana tercero circulando misma detras asegurado asegurado ingresa estacion servicio mientras girando tercero colisiona ase lateral izquierda trasero solo ocupante puesto cae pavimento,comprometida,mecanica hecho segun version aseg aseg circulando colectora panamericana tercero circulando mismo detras aseg aseg ingresar estacion servicio mientras girando tercero colisionando aseg lateral izquierda trasero solo ocupantes puesto caen pavimento,mecanica hecho segun version aseg aseg circulando colectora panamericana tercero circulando mismo detras aseg aseg ingresar estacion servicio mientras girando tercero colisionando aseg lateral izquierda trasero solo ocupantes puesto caen pavimento
am    ,siendo hora indicada coliciono moto deteniamos semaforoal momento frenar activa sensor abs dejando pedal arriba frena anouna vez colicionado procede ayuda tercero aguardando ambuancia mismo aducia dolor codo,comprometida,siendo hora indicada colisiono moto tenia semaforoal momento frena activa sensor abs dejando pedal iba frena anouna vez colisionado procede ayuda tercero aguardando ambuancia mismo aducia dolor codo,siendo hora indicada colisiono moto tenia momento frena dejando iba frena vez colisionado ayuda tercero aguardando mismo aducia dolor codo
am    ,mecanica hecho segun version asegurado circulando alfonsin interseccion pergamino dispongo doblar hacia pergamino tercero moto quiere sobrepasar embite parte trasera moto solo ocupante cae posee lesiones danos moto pasamos datos retira andando moto,comprometida,mecanica hecho segun version aseg circulando alfonsin interseccion pergamino dispongo doblar habia pergamino tercero moto quiere sobrepasar embiste parte trasera moto solo ocupantes caen posee lesiones datos moto pasamos datos retira andando moto,mecanica hecho segun version aseg circulando alfonsin interseccion pergamino dispongo doblar habia pergamino tercero moto quiere sobrepasar embiste parte trasera moto solo ocupantes caen posee lesiones datos moto pasamos datos retira andando moto
am    ,mecanica hecho s vs asegurado circulaba cespedes bocacalle giribone cruzando casi mitad aparece moto giribone embiste paragolpe delantero debido hecho moto cae junto ocupante suelo ocupante moto tenia lesiones tenia puesto solo vi raspon costilla ,comprometida,mecanica hecho asfalto vs aseg circulaba cespedes bocacalle giribone cruzando casi mitad aparece moto giribone embiste paragolpe delante debido hecho moto caen junto ocupantes suelo ocupantes moto tenia lesiones tenia puesto solo pavimento raspon costilla,mecanica hecho asfalto vs aseg circulaba bocacalle giribone cruzando casi mitad aparece moto giribone embiste paragolpe delante debido hecho moto caen junto ocupantes suelo ocupantes moto tenia lesiones tenia puesto solo pavimento raspon costilla
am    ,mecanica hecho segun version asegurado asegurado circulaba jujuy cruzar indart embestido lateral trasero derecha tercero moto venia ultima mencionada ocupante moto recuerda llevaba colocado cayo asfalto desplazamientos ,concurrente,mecanica hecho segun version aseg aseg circulaba jujuy cruzar indart embestido lateral trasero derecha tercero moto venia ultima mencionada ocupantes moto recuerda llevaba colocado cayo asfalto desplazamientos,mecanica hecho segun version aseg aseg circulaba jujuy cruzar indart embestido lateral trasero derecha tercero moto venia ultima mencionada ocupantes moto recuerda llevaba colocado cayo asfalto desplazamientos
am    ,circulando oliden dispongo ingresar estacion servicio ero moto sobrepasa embiste parte delantera ero desestabiliza cae pavimento ofresco ayuda llame same atendieron trasladaron hosptal llavallol lesiones dan alta,comprometida,circulando oliden dispongo ingresar estacion servicio trasero moto sobrepasa embiste parte delante trasero desestabiliza caen pavimento ofresco ayuda llame same atendieron trasladado hospital llavallol lesiones dan alta,circulando oliden dispongo ingresar estacion servicio trasero moto sobrepasa embiste parte delante trasero desestabiliza caen pavimento ofresco ayuda llame same trasladado hospital llavallol lesiones dan alta
am    ,parada esquina berlin sarmiento semaforo luz giro doblar cambia semaforoy voy doblar siento ungolpe parte auto moto habia sobrepasado pasando costado colectivo encontraba detras mio esperando cambie semaforod,comprometida,parada esquina berlin sarmiento semaforo luz giro doblar cambia semaforoy voy doblar siento ungolpe parte auto moto habia sobrepasado san costado colectivo encontraba detras mio esperando cambie semaforod,parada esquina berlin sarmiento semaforo luz giro doblar cambia voy doblar siento parte auto moto habia san costado colectivo encontraba detras mio esperando
aci   ,circulaba ruta paraguay patagones direccion paso rey ciclista iba pegado cordon pasando resbala cae abajo comion,comprometida,circulaba ruta paraguay patagones direccion paso rey ciclista iba pegado cordon san resbala caen abajo comion,circulaba ruta paraguay direccion paso rey ciclista iba pegado cordon san resbala caen abajo
aci   ,vehiculo asegurado encontraba estacionado tagle abrir puerta delantera colisiona misma tercero bicicleta persona circulaba misma persona cayo asfalto trasladada posteriormente asegurado domicilio desplazamientosno int tel,comprometida,vehiculo aseg encontraba estacionado tagle abrir puerta delante colisionando mismo tercero bicicleta personas circulaba mismo personas cayo asfalto trasladado posteriormente aseg domicilio desplazamientos int tel,vehiculo aseg encontraba estacionado tagle abrir puerta delante colisionando mismo tercero bicicleta personas circulaba mismo personas cayo asfalto trasladado posteriormente aseg domicilio desplazamientos int tel
am    ,venia circulando beiro quere doblar quevedo ciento implacto moto ocacionado danos em parte laterald mas terceros lesiones datos tercero portaneri guillermo marcelo moto dominar awxl atm,comprometida,venia circulando beiro quere doblar quevedo ciento impacto moto ocacionado datos embestido parte lateral mas terceros lesiones datos tercero portaneri guillermo marcelo moto dominar awxl atm,venia circulando doblar impacto moto ocacionado datos embestido parte lateral mas terceros lesiones datos tercero guillermo marcelo moto atm
