cod_accidente,descripcion_del_hecho - Final,responsabilidad,fuzzy,no_hpx
am    ,redgreenluecirc peron hacia capital motociclista acompanante freno semaforo alcance frenar colisione atras cayeron piso solo golpes ,comprometida,redgreenluecirc persona habia capital motociclista acompanante frena semaforo alcance frena colision atras cayeron piso solo golpes,persona habia capital motociclista acompanante frena semaforo frena colision atras cayeron piso solo golpes
am    ,aseg circulaba guardia nacional pone giro girar hacia jose enrique rodo impacta espejo retrovisor izquierda moto circulaba guardia nacional quiere sobrepasar aseg izquierda cae piso tenia presentaba lesiones aparentes intervinientes,comprometida,aseg circulaba guardia nacional pone giro girar habia jose enrique rodo impactada espejo retrovisor izquierda moto circulaba guardia nacional quiere sobrepasar aseg izquierda caen piso tenia presentaba lesiones aparentes intervinientes,aseg circulaba guardia nacional pone giro girar habia jose enrique rodo impactada espejo retrovisor izquierda moto circulaba guardia nacional quiere sobrepasar aseg izquierda caen piso tenia presentaba lesiones aparentes intervinientes
aa    ,circulando arribenos doble habia vehiculos estacionados ambas manos vehiuclo venia contraria da paso maniobro hacia impactado pareja persona iba caminando lateral delantero derecha retrovisor lesiones desplazamientos ,concurrente,circulando arribenos doble habia vehiculo estacionados ambos manos vehiculo venia contraria trasladado paso maniobro habia impactado pareja personas iba caminando lateral delante derecha retrovisor lesiones desplazamientos,circulando arribenos doble habia vehiculo estacionados ambos manos vehiculo venia contraria trasladado paso maniobro habia impactado pareja personas iba caminando lateral delante derecha retrovisor lesiones desplazamientos
am    ,circulando guarda vieja repente roce moto detenida parte delantera moto cayo piso levanto solo puesto moto andando intervencion,comprometida,circulando guarda vieja repente roce moto detenida parte delante moto cayo piso levanta solo puesto moto andando intervencion,circulando repente roce moto detenida parte delante moto cayo piso levanta solo puesto moto andando intervencion
am    ,circulaba mitre llegar interseccion comienzo doblar ahi siento gdd producido moto motociclista cae piso levanta propios medios intervencion policial same ofreci llamar same auxiliarlo quiso mas terceros involucrados lesionados datos tercero julian oviedo color oscuro atmasegurado ,comprometida,circulaba mitre llegar interseccion comienzo doblar ahi siento gdd producido moto motociclista caen piso levanta propios medios intervencion policial same ofreci llamar same auxiliarlo quiso mas terceros involucrados lesionados datos tercero julian oviedo dolor oscuro aseg,circulaba mitre llegar interseccion comienzo doblar ahi siento producido moto motociclista caen piso levanta propios medios intervencion policial same ofreci llamar same quiso mas terceros involucrados lesionados datos tercero julian dolor oscuro aseg
am    ,circulaba maipu interseccion rios moto circulaba maipu contrario gira giro luz habilitada circulacin consecuencia puedo evitar impactarla lateral derecha moto produce caida motociclista indica lesion incorpora propiosmedios ,discutida,circulaba maipu interseccion rios moto circulaba maipu contrario gira giro luz habilitada circulacin consecuencia puedo evitar impacta lateral derecha moto produce caida motociclista indica lesiones incorpora propios,circulaba maipu interseccion rios moto circulaba maipu contrario gira giro luz habilitada circulacin consecuencia puedo evitar impacta lateral derecha moto produce caida motociclista indica lesiones incorpora propios
am    ,asegurado circulando yrigoyen girar balcarce colisionado lateral derecha tercero moto personas caen asfalto levantan propios luego intercambiar datos retiran propios medios ,comprometida,aseg circulando yrigoyen girar balcarce colisionando lateral derecha tercero moto personas caen asfalto levanta propios luego intercambiar datos retira propios medios,aseg circulando yrigoyen girar colisionando lateral derecha tercero moto personas caen asfalto levanta propios luego intercambiar datos retira propios medios
am    ,asegurado circulando toldos impacta parte delantera lateral izquierda tercero moto circulaba don cristobal ocupantes cascos puesto producto mismo caen piso levantan medios intervencion policial,comprometida,aseg circulando toldos impactada parte delante lateral izquierda tercero moto circulaba don cristobal ocupantes cascos puesto produce mismo caen piso levanta medios intervencion policial,aseg circulando impactada parte delante lateral izquierda tercero moto circulaba don ocupantes cascos puesto produce mismo caen piso levanta medios intervencion policial
peatã“n,asegurado circulando buenaventura direccion hacia hipolito yrigoyen semaforo hacia lado lomas zamora entrando peaton misma tocado asegurado parte delantera peaton cae piso asegruado llama same provincia peaton atendido trasladado,comprometida,aseg circulando buenaventura direccion habia hipolito yrigoyen semaforo habia lado lomas zamora entrando peaton mismo tocado aseg parte delante peaton caen piso aseg llama same provincia peaton atendido trasladado,aseg circulando direccion habia hipolito yrigoyen semaforo habia lado lomas zamora entrando peaton mismo tocado aseg parte delante peaton caen piso aseg llama same provincia peaton atendido trasladado
am    ,circulaba mariano moreno coloco luz giro girar moto quiere sobrepasar realizar giro impacta lateral izquierda trasero motoquero sufre lesiones visibles cae alpiso retira medios datos tercero ballon ezequiel jose zanella azqb triunfo,comprometida,circulaba mariano moreno coloco luz giro girar moto quiere sobrepasar realizar giro impactada lateral izquierda trasero motoquero sufre lesiones visibles caen piso retira medios datos tercero ballon ezequiel jose zanella azqb triunfo,circulaba mariano moreno coloco luz giro girar moto quiere sobrepasar realizar giro impactada lateral izquierda trasero motoquero sufre lesiones visibles caen piso retira medios datos tercero ezequiel jose zanella triunfo
aa    ,aseg circulaba ardoino pasa paso nivel colisiona tercero superpone delante aseg contramano frena repente parte delantera aseg parte trasera luego tercero baja golpea aseg parte delantera lesiones desplazamientossin intervencion movil policial,comprometida,aseg circulaba ardoino pasa paso nivel colisionando tercero superpone delante aseg contramano frena repente parte delante aseg parte trasera luego tercero baja golpea aseg parte delante lesiones desplazamientos intervencion movil policial,aseg circulaba pasa paso nivel colisionando tercero delante aseg contramano frena repente parte delante aseg parte trasera luego tercero baja golpea aseg parte delante lesiones desplazamientos intervencion movil policial
am    ,asegurado maniobraba cmte luis piedrabuena doblar hacia cnel francisco uzal colisiona parte delantera parte lateral delantera moto circulaba ultima unico ocupante moto tenia cayo piso presentaba dolor clavicula muneca trasladado htal vicente lopez intervencion policiald,comprometida,aseg maniobra cmte luis piedrabuena doblar habia cnel francisco uzal colisionando parte delante parte lateral delante moto circulaba ultima unico ocupantes moto tenia cayo piso presentaba dolor clavicula muneca trasladado htal vicente lopez intervencion policiald,aseg maniobra luis doblar habia cnel francisco colisionando parte delante parte lateral delante moto circulaba ultima unico ocupantes moto tenia cayo piso presentaba dolor clavicula muneca trasladado htal vicente lopez intervencion policiald
am    ,asegurado maniobrando salir estacionado f m esquiu tercero moto circulaba misma impacta puertas izquierda aseg cae pavimento llevaba puesto patente intervencion policial retiro moto,comprometida,aseg maniobra salir estacionado asfalto tomar esquiu tercero moto circulaba mismo impactada puerta izquierda aseg caen pavimento llevaba puesto patente intervencion policial retiro moto,aseg maniobra salir estacionado asfalto tomar tercero moto circulaba mismo impactada puerta izquierda aseg caen pavimento llevaba puesto patente intervencion policial retiro moto
am    ,aseg detiene semaforo san martin cambia semaforo maniobra marcha atras sobrepasar detenido impacta levemente parte trasera ro moto detras desplazamientos lesionados moto cae ,comprometida,aseg detiene semaforo san martin cambia semaforo maniobra marcha atras sobrepasar detenido impactada levemente parte trasera maniobro moto detras desplazamientos lesionados moto caen,aseg detiene semaforo san martin cambia semaforo maniobra marcha atras sobrepasar detenido impactada levemente parte trasera maniobro moto detras desplazamientos lesionados moto caen
am    ,aseg circulaba puerto argentino llegar interseccion cuba aseg moto venia ultima colisiona lateral derecha frente moto moto tenia sufre lesiones ,concurrente,aseg circulaba puesto argentino llegar interseccion cuba aseg moto venia ultima colisionando lateral derecha frente moto moto tenia sufre lesiones,aseg circulaba puesto llegar interseccion cuba aseg moto venia ultima colisionando lateral derecha frente moto moto tenia sufre lesiones
am    ,vhc asegurado circulando juan b justo llegar interseccion argerich colisionado parte trasera rueda delantera tercero circulaba detras solo ocupante cae piso incorpora solo quejaba dolencia estomago ,discutida,vhc aseg circulando juan maniobro justo llegar interseccion argerich colisionando parte trasera rueda delante tercero circulaba detras solo ocupantes caen piso incorpora solo quejaba dolencia estomago,vhc aseg circulando juan maniobro justo llegar interseccion argerich colisionando parte trasera rueda delante tercero circulaba detras solo ocupantes caen piso incorpora solo quejaba dolencia
am    ,vhc asegurado circulando avda maria eva peron circunstancias incorporando senillosa colisionado parte delantera tercero moto circulaba ultima alta velocidad solo ocupante cae piso repuso momento deseo recibir atencion medica ,comprometida,vhc aseg circulando avda maria llevaba persona circunstancias incorporando senillosa colisionando parte delante tercero moto circulaba ultima alta velocidad solo ocupantes caen piso repuso momento deseo recibir atencion medica,vhc aseg circulando avda maria llevaba persona circunstancias colisionando parte delante tercero moto circulaba ultima alta velocidad solo ocupantes caen piso momento recibir atencion medica
am    ,circulando centenario uruguayo llegando julio camioneta polica bruscamente poner luz giro balizas subi vereda equina ingresar lavadero acciono frenos giro esquivo moto vena atras mo intent esquivarme inclinar moto pierde control cae costado sola persona tenia puesto retira propios medios,comprometida,circulando centenario uruguayo llegando julio camioneta polica bruscamente poner luz giro balizas subi vereda equina ingresar lavadero acciono frenos giro esquivo moto venia atras mismo intent esquivarme inclinar moto pierde control caen costado sola personas tenia puesto retira propios medios,circulando centenario uruguayo llegando julio camioneta polica bruscamente poner luz giro balizas subi vereda ingresar frenos giro esquivo moto venia atras mismo intent esquivarme moto pierde control caen costado sola personas tenia puesto retira propios medios
aa    ,asegurado circulaba mayo embisti frente parte trasera tercero detuvo delante cruce transversal lesiones desplazamientos,comprometida,aseg circulaba mayo embistio frente parte trasera tercero detuvo delante cruce transversal lesiones desplazamientos,aseg circulaba mayo embistio frente parte trasera tercero detuvo delante cruce lesiones desplazamientos
aa    ,circulaba flores cruzar defilippi tercero venia ultima colisona frente lateral derecha desplazamientos lesionados,concurrente,circulaba flores cruzar defilippi tercero venia ultima colisiona frente lateral derecha desplazamientos lesionados,circulaba flores cruzar tercero venia ultima colisiona frente lateral derecha desplazamientos lesionados
am    ,asegurado circulaba au buen ayre colisionado parte lateral moto circulaba misma unico ocupante moto tenia cayo piso presentaba lesiones retiro propiso medios intervencion medica policial comunicamos v asegurado manifest haber formalizado denuncia compania respecto hecho manifieseta bajaba salida buen ayre luego tena subir puente bajando puente moto clava frenos evitar impactarlo ah pierde control impacta puerta auto asegurado admite dobla subir puente prest colaboracin hacer croquis especificar dnde circulaba moto mecabnica relata parece claro rodado asegurado interpuo carril marcha motocicleta moto impact puerta rodado asgurado dice tener contacto tercero quedo informarlo participo tercero tendria lesiones leves,comprometida,aseg circulaba au buen ayre colisionando parte lateral moto circulaba mismo unico ocupantes moto tenia cayo piso presentaba lesiones retiro piso medios intervencion medica policial comunicamos llevaba aseg manifest haber formalizado denuncia compania respecto hecho manifieseta bajaba salida buen ayre luego tenia subir puente bajando puente moto clava frenos evitar impacta ah pierde control impactada puerta auto aseg admite dobla subir puente prest colaboracin hacer croquis especificar dnde circulaba moto mecanica relata parece claro rodado aseg interpuo carril marcha motocicleta moto impactada puerta rodado asegurado dice tener contacto tercero quedo informarlo participo tercero tenia lesiones leves,aseg circulaba au buen ayre colisionando parte lateral moto circulaba mismo unico ocupantes moto tenia cayo piso presentaba lesiones retiro piso medios intervencion medica policial comunicamos llevaba aseg manifest haber formalizado denuncia compania hecho bajaba salida buen ayre luego tenia subir puente bajando puente moto frenos evitar impacta ah pierde control impactada puerta auto aseg dobla subir puente hacer circulaba moto mecanica relata parece rodado aseg carril marcha motocicleta moto impactada puerta rodado asegurado dice tener contacto tercero quedo participo tercero tenia lesiones leves
am    ,asegurado circulando jose leon suarez giro colocado hacia tomar colorada realizar maniobra embestido parte trasera tercero circulaba mismo moto ocupante cae paviemento asiste asiste levanta propios medios desplazamientoste asegurada,comprometida,aseg circulando jose leon suarez giro colocado habia tomar colorada realizar maniobra embestido parte trasera tercero circulaba mismo moto ocupantes caen pavimento asiste asiste levanta propios medios desplazamientos aseg,aseg circulando jose suarez giro colocado habia tomar realizar maniobra embestido parte trasera tercero circulaba mismo moto ocupantes caen pavimento asiste asiste levanta propios medios desplazamientos aseg
peatã“n,an saliendom marcha atreas esstacionada playon municipal toco cuidador autos parte trasera derecha brazo izquierda cayendo piso parte levanto propios medios sion in tervencion,comprometida,maniobro saliendom marcha atras esstacionada playon municipal toco cuidador datos parte trasera derecha brazo izquierda cayendo piso parte levanta propios medios version ingresar tervencion,maniobro marcha atras playon municipal toco datos parte trasera derecha brazo izquierda cayendo piso parte levanta propios medios version ingresar tervencion
am    ,aseg maniobraba salir encontraba estacionado colisiona lateral delantero derecha moto circulaba motociclista utilizaba cay pavimento result lesionado intervinieron motociclista familiares llevaron hospital controlar,comprometida,aseg maniobra salir encontraba estacionado colisionando lateral delante derecha moto circulaba motociclista utilizaba cayo pavimento result colisionado intervinieron motociclista familiares llevaron hospital controlar,aseg maniobra salir encontraba estacionado colisionando lateral delante derecha moto circulaba motociclista utilizaba cayo pavimento result colisionado intervinieron motociclista familiares llevaron hospital
am    ,aseg circulaba au embestida lateral trasero derecha moto circulaba misma motociclista utilizaba cayo pavimento presentaba lesiones visibles trasladado centro medico interv policias,comprometida,aseg circulaba au embestido lateral trasero derecha moto circulaba mismo motociclista utilizaba cayo pavimento presentaba lesiones visibles trasladado centro medios interv policias,aseg circulaba au embestido lateral trasero derecha moto circulaba mismo motociclista utilizaba cayo pavimento presentaba lesiones visibles trasladado centro medios interv policias
am    ,encontraba circulando maipda bernal direccin hacia avellaneda llego zeballos dejo pasar varios autos comienzo cruzar zeballos moto gran velocidad pasa zevallos hacia dardo rocha toco parte delantera haciendo ambos muchachos cayeran dela moto costado parecan adoloridos decidieron irse cuenta,comprometida,encontraba circulando maipda bernal direccin habia avellaneda llego zeballos dejo pasar varios datos comienzo cruzar zeballos moto gran velocidad pasa zevallos habia dardo rocha toco parte delante haciendo ambos muchachos cayeran delante moto costado parecan dolor decidieron irse cuenta,encontraba circulando maipda bernal direccin habia avellaneda llego zeballos dejo pasar varios datos comienzo cruzar zeballos moto gran velocidad pasa habia dardo rocha toco parte delante haciendo ambos muchachos delante moto costado dolor cuenta
am    ,vehculo asegurado circulaba alvarez thomas llegar interseccin sucre impactado espejo izquierda moto circulaba alvarez thomas desplazamientos moto ocupante cay piso manifest dolencias trasladado htal tornu int cria c cel aseg,comprometida,vehiculo aseg circulaba alvarez thomas llegar interseccin sucre impactado espejo izquierda moto circulaba alvarez thomas desplazamientos moto ocupantes cayo piso manifest dolencias trasladado htal tornu int cria produce cel aseg,vehiculo aseg circulaba alvarez thomas llegar interseccin sucre impactado espejo izquierda moto circulaba alvarez thomas desplazamientos moto ocupantes cayo piso manifest dolencias trasladado htal int cria produce cel aseg
am    ,vhl asg circulando corrientes vhl tercero moto circulando almirante brown asegurado indica interseccion ambas llegando final bocacalle parte trasera parte terceroel tercero va acompanado menor ambos llevan cascocaen pisoel tercero ayudado levantarse manifiesta dolor brazo izquierda ,comprometida,vhl aseg circulando corrientes vhl tercero moto circulando almirante brown aseg indica interseccion ambos llegando final bocacalle parte trasera parte terceroel tercero llevaba acompanado menor ambos llevan caen piso tercero ayudado levanta manifiesta dolor brazo izquierda,vhl aseg circulando corrientes vhl tercero moto circulando almirante brown aseg indica interseccion ambos llegando final bocacalle parte trasera parte terceroel tercero llevaba acompanado menor ambos llevan caen piso tercero ayudado levanta manifiesta dolor brazo izquierda
am    ,asegurado frena esquina poder estacionar ve chica conducia moto toca desestabiliza desplaza auto estacionado cae venia sola trasladan hospital peron,comprometida,aseg frena esquina poder estacionar version choca conducia moto toca desestabiliza desplazamientos auto estacionado caen venia sola trasladado hospital persona,aseg frena esquina poder estacionar version choca conducia moto toca desestabiliza desplazamientos auto estacionado caen venia sola trasladado hospital persona
mm    ,circulaba moto pastorino decido doblar tomar roque saenz pena tome cuenta tenia moto doble peque rueda delantera rueda trasera cayo moto tambien,comprometida,circulaba moto pastorino decido doblar tomar roque saenz pena tome cuenta tenia moto doble peque rueda delante rueda trasera cayo moto tambien,circulaba moto doblar tomar saenz pena tome cuenta tenia moto doble rueda delante rueda trasera cayo moto tambien
am    ,asegurado circulando rodriguez esquivar tercero colisionado lateral izquierda tercero moto persona tercero retira propios medios,comprometida,aseg circulando rodriguez esquivar tercero colisionando lateral izquierda tercero moto personas tercero retira propios medios,aseg circulando rodriguez esquivar tercero colisionando lateral izquierda tercero moto personas tercero retira propios medios
aa    ,circulando rosario llegar interseccion plata giro senor intentaba cruzar detiene retomo marcha vuelve avanzar poder evitar impactarlo,comprometida,circulando rosario llegar interseccion plata giro senor intentaba cruzar detiene retomo marcha vuelve avanzar poder evitar impacta,circulando rosario llegar interseccion plata giro senor intentaba cruzar detiene marcha vuelve avanzar poder evitar impacta
am    ,circulando peron giro ingresar san antonio mitad cuadra freno moto venia detras colisiona parte trasera moto iban personas caen piso lesiones visibles ,comprometida,circulando persona giro ingresar san antonio mitad cuadra frena moto venia detras colisionando parte trasera moto iba personas caen piso lesiones visibles,circulando persona giro ingresar san antonio mitad cuadra frena moto venia detras colisionando parte trasera moto iba personas caen piso lesiones visibles
am    ,asegurado detenido semaforo mariano acosta moto tambien detenida pone semaforo arranco adelanta doblar hacia arranque embiste puerta delantera moto iba sola persona tenis cae suelo levanta propios medios ,comprometida,aseg detenido semaforo mariano acosta moto tambien detenida pone semaforo arranco delantera doblar habia arranque embiste puerta delante moto iba sola personas tenia caen suelo levanta propios medios,aseg detenido semaforo mariano acosta moto tambien detenida pone semaforo arranco delantera doblar habia arranque embiste puerta delante moto iba sola personas tenia caen suelo levanta propios medios
am    ,asegurado circulaba araujo interseccion artigas produce colision tercero moto personas cuales lleveban cascoproducto mismo asegurado sufre danos parte delantera derecha ,comprometida,aseg circulaba araujo interseccion artigas produce colisionando tercero moto personas cuales llevaba cascoproducto mismo aseg sufre datos parte delante derecha,aseg circulaba interseccion artigas produce colisionando tercero moto personas cuales llevaba mismo aseg sufre datos parte delante derecha
aa    ,redgreenlue asegurado circulando avda cramer colisionado lateral derecha tercero moto personas retiran propios medios,comprometida,redgreenlue aseg circulando avda cramer colisionando lateral derecha tercero moto personas retira propios medios,redgreenlue aseg circulando avda cramer colisionando lateral derecha tercero moto personas retira propios medios
am    ,vehculo asegurado circulaba carril central caba moto carril derecha vehculo sobrepasa asegurado encierra provocando asegurado efectdae maniobra termina colisin moto,comprometida,vehiculo aseg circulaba carril central caba moto carril derecha vehiculo sobrepasa aseg encierra provocando aseg efectdae maniobra termina colision moto,vehiculo aseg circulaba carril central caba moto carril derecha vehiculo sobrepasa aseg encierra provocando aseg maniobra termina colision moto
aa    ,vehculo asegurado cirulaba san martin impacta parte delantera parte trasera tercero circulaba adelante gir senalizar tomar tucuman desplazamientos vehculo tercero manifest dolor int medica int policial amplio aseguradocomenta ambos circulaban san martin quilmes hacia arco calzada iba bastante velocidad interseccion tercero ford focus dobla hacia tucuman pese frenar asegurado derrapa impacta tercero paragolpes trasero causa golpe doblaba cerrado tercero impacta frente poste ,comprometida,vehiculo aseg circulaba san martin impactada parte delante parte trasera tercero circulaba delante gir senalizar tomar tucuman desplazamientos vehiculo tercero manifest dolor int medica int policial amplio aseg ambos circulaba san martin quilmes habia arco calzada iba bastante velocidad interseccion tercero ford focus dobla habia tucuman pese frena aseg derrapa impactada tercero paragolpes trasero causa golpe doblaba cerrado tercero impactada frente poste,vehiculo aseg circulaba san martin impactada parte delante parte trasera tercero circulaba delante gir tomar tucuman desplazamientos vehiculo tercero manifest dolor int medica int policial amplio aseg ambos circulaba san martin quilmes habia calzada iba velocidad interseccion tercero ford focus dobla habia tucuman pese frena aseg derrapa impactada tercero paragolpes trasero causa golpe doblaba tercero impactada frente poste
am    ,vhc asegurado circulando triunvirato encandilado juego luces hacia vhc circulaba percata moto precedia detuvo delante vhc asegurado colisiona parte delantera solo ocupante traia cae piso lesiones evidentes ,comprometida,vhc aseg circulando triunvirato lado juego luces habia vhc circulaba percata moto precedia detuvo delante vhc aseg colisionando parte delante solo ocupantes traia caen piso lesiones evidentes,vhc aseg circulando triunvirato lado luces habia vhc circulaba moto precedia detuvo delante vhc aseg colisionando parte delante solo ocupantes caen piso lesiones evidentes
am    ,vena circulando mosconi aproximadamente manana pasando semaforo cambio color siento colisin motociclista vena circulando velocidad constante cuenca impact puerta atras adelante cayendo sufriendo traumatismos leves,concurrente,venia circulando mosconi aproximadamente manana san semaforo cambio dolor siento colision motociclista venia circulando velocidad constante cuenca impactada puerta atras delante cayendo sufriendo traumatismos leves,venia circulando mosconi aproximadamente san semaforo cambio dolor siento colision motociclista venia circulando velocidad cuenca impactada puerta atras delante cayendo leves
