cod_accidente,descripcion_del_hecho - Final,responsabilidad,fuzzy,no_hpx
am    ,vehiculo asegurado circulaba esmeralda girando embiste moto izquierda guardabarro delantero izquierda ocupantes motocicleta caen luego levantan medios llevaban ,comprometida,vehiculo aseg circulaba esmeralda girando embiste moto izquierda guardabarro delante izquierda ocupantes motocicleta caen luego levanta medios llevaba,vehiculo aseg circulaba esmeralda girando embiste moto izquierda guardabarro delante izquierda ocupantes motocicleta caen luego levanta medios llevaba
am    ,maniobraba marcha atras salir vereda hacia balbin vena moto circulabdo misma detengo impacta parte trasera moto iba solo ocupante tena mismo cae pavimento ,comprometida,maniobra marcha atras salir vereda habia balbin venia moto circulaba mismo detengo impactada parte trasera moto iba solo ocupantes tenia mismo caen pavimento,maniobra marcha atras salir vereda habia balbin venia moto circulaba mismo detengo impactada parte trasera moto iba solo ocupantes tenia mismo caen pavimento
aa    ,aseg circulaba bogota comenzando cruzar carrasco impactado parte delantera tercero circulaba parte frontal tercero lesionesel asegurado amplio escrito original dejado oficina v cia anticipado copia ,comprometida,aseg circulaba bogota comenzando cruzar carrasco impactado parte delante tercero circulaba parte frontal tercero lesiones aseg amplio escrito original dejado oficina llevaba cia anticipado copia,aseg circulaba bogota comenzando cruzar carrasco impactado parte delante tercero circulaba parte frontal tercero lesiones aseg amplio escrito oficina llevaba cia
am    ,circulaba pampa delante mo circulaba moto llegar otamendi frena bruscamente intento frenar vehculo patina producto choco rueda trasera callendo ocupantes piso presentar leciones simple vistacontactamos v asegurado amplio informacion siniestro datos terceros manifesto llama juan ramon diaz dni acompanante jose mariano mas datos accidente dia horas aprox pampa valentin alsina lanus moto honda xr patente hxu moto circulaba delante mio freno bruscamente freno auto patina debido fuerte q habia monento golpeo rueda atras celular moto participo intercambios datos lugar hecho,comprometida,circulaba pampa delante mismo circulaba moto llegar otamendi frena bruscamente intento frena vehiculo patina produce choco rueda trasera callendo ocupantes piso presentaba lesiones simple vistacontactamos llevaba aseg amplio informacion siniestro datos terceros manifesto llama juan ramon diaz dni acompanante jose mariano mas datos accidente dia horas aprox pampa valentin alsina lanus moto honda xr patente hxu moto circulaba delante mio frena bruscamente frena auto patina debido fuerte choque habia momento golpeo rueda atras celular moto participo intercambios datos lugar hecho,circulaba pampa delante mismo circulaba moto llegar frena bruscamente intento frena vehiculo patina produce choco rueda trasera ocupantes piso presentaba lesiones simple llevaba aseg amplio informacion siniestro datos terceros manifesto llama juan diaz dni acompanante jose mariano mas datos accidente dia horas aprox pampa valentin alsina lanus moto honda xr patente moto circulaba delante mio frena bruscamente frena auto patina debido fuerte choque habia momento golpeo rueda atras celular moto participo datos lugar hecho
am    ,redgreenlue asegurado circulando alvarado empieza doblar hacia goncalvez embestido parte delantera parte delantera moto circulaba detras alvarado motociclista tenia unico tripulante cayo piso heridas visibles intervencion retiraron ambos propios medios desplazamientos ,comprometida,redgreenlue aseg circulando alvarado empieza doblar habia goncalvez embestido parte delante parte delante moto circulaba detras alvarado motociclista tenia unico tripulante cayo piso heridas visibles intervencion retira ambos propios medios desplazamientos,redgreenlue aseg circulando alvarado empieza doblar habia embestido parte delante parte delante moto circulaba detras alvarado motociclista tenia unico tripulante cayo piso heridas visibles intervencion retira ambos propios medios desplazamientos
am    ,circulaba solis llegar interseccin intento doblar agarrar morenopor transito pude hacerlo detengoy apenas comenzando circular poder continuar solisaparece moto detras taxi embiste parte delantera parte delantera ocupantes ,comprometida,circulaba solis llegar interseccin intento doblar agarrar morenopor transito pude hacerlo detengoy apenas comenzando circulaba poder continuar solisaparece moto detras taxi embiste parte delante parte delante ocupantes,circulaba llegar interseccin intento doblar transito pude hacerlo apenas comenzando circulaba poder continuar moto detras taxi embiste parte delante parte delante ocupantes
peaton,aseg circulaba medina nino cruzaba corriendo metros esquina toca delantero izquierda asegurado nene cae vereda presentaba raspn trasladado colegio asegurada all llamaron policias necesario trasladarlo centro medico,concurrente,aseg circulaba medina nino cruzaba corriendo metros esquina toca delante izquierda aseg nene caen vereda presentaba raspn trasladado colegio aseg all llamaron policias necesario trasladado centro medios,aseg circulaba medina nino cruzaba corriendo metros esquina toca delante izquierda aseg caen vereda presentaba raspn trasladado colegio aseg all llamaron policias necesario trasladado centro medios
cicl  ,girando hacia laprida cruzando cruce ffcc llegar primera bocacalle bicicleta parecer buscando proposito colisionar alguno autos circulabamos golpea lateral izquierda levanta agresivamente comienza auto arrojando golpes puno persona ,comprometida,girando habia laprida cruzando cruce ffcc llegar primera bocacalle bicicleta parecer buscando proposito colisionando alguno datos circulaba golpea lateral izquierda levanta agresivamente comienza auto arrojando golpes puno personas,girando habia laprida cruzando cruce llegar primera bocacalle bicicleta parecer buscando colisionando alguno datos circulaba golpea lateral izquierda levanta comienza auto golpes puno personas
am    ,venia circulando ciudad paz cruzar garcia rio aparece moto daltima colisiona parte delantera autoacto seguido motociclista cae auto luego pisome detengo bajo auto preguntarle dice bien va andando moto rapido intervencion policial medica motociclista sexo masculino,comprometida,venia circulando velocidad paz cruzar garcia rio aparece moto daltima colisionando parte delante autoacto seguido motociclista caen auto luego piso detengo bajo auto preguntarle dice bien llevaba andando moto rapido intervencion policial medica motociclista sexo masculino,venia circulando velocidad paz cruzar garcia rio aparece moto daltima colisionando parte delante autoacto seguido motociclista caen auto luego piso detengo bajo auto dice bien llevaba andando moto rapido intervencion policial medica motociclista sexo masculino
am    ,aseg circulando detras moto frena aseg coliciono atras personas caen moto lesiones visibles mas vhsnos contactamos v asegurado efectos obtener mayores datos terceros mismo ratific meccnica hecho colisiono levemente moto preceda lleg frenar intercambiaron datos retiraron lugar propios medios ,comprometida,aseg circulando detras moto frena aseg colisiono atras personas caen moto lesiones visibles mas vhsnos contactamos llevaba aseg efectos obtener mayores datos terceros mismo ratific mecanica hecho colisiono levemente moto preceda llegar frena intercambiaron datos retira lugar propios medios,aseg circulando detras moto frena aseg colisiono atras personas caen moto lesiones visibles mas contactamos llevaba aseg obtener mayores datos terceros mismo ratific mecanica hecho colisiono levemente moto llegar frena intercambiaron datos retira lugar propios medios
am    ,vehiculo asegurado detenido semaforo comenzar marcha colisiona parte delantera parte trasera moto raiz golpe moto golpea vehiculo adelante moto cae piso ,comprometida,vehiculo aseg detenido semaforo comenzar marcha colisionando parte delante parte trasera moto raiz golpe moto golpea vehiculo delante moto caen piso,vehiculo aseg detenido semaforo comenzar marcha colisionando parte delante parte trasera moto raiz golpe moto golpea vehiculo delante moto caen piso
am    ,vehiculo asegurado circulaba brandsen cruzar pergamino moto cirdulaba ultima colisiona lateral derecha motociclista cae piso llevaba ,concurrente,vehiculo aseg circulaba brandsen cruzar pergamino moto circulaba ultima colisionando lateral derecha motociclista caen piso llevaba,vehiculo aseg circulaba brandsen cruzar pergamino moto circulaba ultima colisionando lateral derecha motociclista caen piso llevaba
am    ,circulaba roca auto viene encima volanteo hacia toque moto moto iban personas caen suelo levantan ,comprometida,circulaba roca auto viene encima volanteo habia toque moto moto iba personas caen suelo levanta,circulaba roca auto viene encima volanteo habia toque moto moto iba personas caen suelo levanta
am    ,redgreenlue asegurado circulando martin rodriguez colisionado frente izquierda moto circulaba encalada desplazamientos personas circulaban moto cascos cayeron piso ,concurrente,redgreenlue aseg circulando martin rodriguez colisionando frente izquierda moto circulaba encalada desplazamientos personas circulaba moto cascos cayeron piso,redgreenlue aseg circulando martin rodriguez colisionando frente izquierda moto circulaba encalada desplazamientos personas circulaba moto cascos cayeron piso
am    ,encontraba detenido carril derecha bicentenario semaforo habilita comienzo girar ingresar peru moto pasar colisiona lateral derecha desplazamientos ocupantes caen piso ,comprometida,encontraba detenido carril derecha bicentenario semaforo habilita comienzo girar ingresar peru moto pasar colisionando lateral derecha desplazamientos ocupantes caen piso,encontraba detenido carril derecha semaforo habilita comienzo girar ingresar peru moto pasar colisionando lateral derecha desplazamientos ocupantes caen piso
aa    ,aseg circulaba embiste parte delantera parte trasera tercero renault clio gris detuvo delante producto desplaza embistiendo renault clio azul detenido delante vehculo renault clio gris result lesionado,comprometida,aseg circulaba embiste parte delante parte trasera tercero renault clio gris detuvo delante produce desplazamientos embistio renault clio azul detenido delante vehiculo renault clio gris result colisionado,aseg circulaba embiste parte delante parte trasera tercero renault clio gris detuvo delante produce desplazamientos embistio renault clio azul detenido delante vehiculo renault clio gris result colisionado
cicl  ,aseg estacionado garzon marchas atras salir impacta parte trasera bicicleta circulaba ultimamujer bicicleta unico tripulante cae bicicleta lesiones visibles aseg ofrecer asistencia llevarla hospital ro niega intervencion policial interv retiro propios medios biciletano control alcoholemia,comprometida,aseg estacionado garzon marcha atras salir impactada parte trasera bicicleta circulaba ultima bicicleta unico tripulante caen bicicleta lesiones visibles aseg ofrecer asistencia llevaba hospital maniobro niega intervencion policial interv retiro propios medios biciletano control alcoholemia,aseg estacionado marcha atras salir impactada parte trasera bicicleta circulaba ultima bicicleta unico tripulante caen bicicleta lesiones visibles aseg ofrecer asistencia llevaba hospital maniobro niega intervencion policial interv retiro propios medios control alcoholemia
am    ,encontraba arrancando san martn interseccin avda huergo semaforo haba cambiado cruzando daltima doble manera imprevista moto vena daltima choca parte delantera vuela cae suelo ,concurrente,encontraba arrancando san martn interseccin avda huergo semaforo habia cambiado cruzando daltima doble manera imprevista moto venia daltima chocando parte delante vuela caen suelo,encontraba san martn interseccin avda semaforo habia cruzando daltima doble manera imprevista moto venia daltima chocando parte delante caen suelo
am    ,circulaba monteverde unica abrirme sobrepasar circulaba delante mio sale lateral moto embiste lateral izquierda moto cae piso llevaba casaco quiso ser asistido retir circulando moto,comprometida,circulaba monteverde unica abrirme sobrepasar circulaba delante mio sale lateral moto embiste lateral izquierda moto caen piso llevaba casaco quiso trasera asistido retiro circulando moto,circulaba abrirme sobrepasar circulaba delante mio sale lateral moto embiste lateral izquierda moto caen piso llevaba quiso trasera asistido retiro circulando moto
am    ,estacionado segui abro puerta delantera descender unidad embestido frente bicileta dicha puerta ocupante recuerdo tenia cae pavimento levanta propios medios manifestaba lesiones visibles retira circulando bicicleta dejar dato alguno desplazamientos ,comprometida,estacionado segun abro puerta delante descender unidad embestido frente bicileta dicha puerta ocupantes recuerdo tenia caen pavimento levanta propios medios manifestaba lesiones visibles retira circulando bicicleta dejar datos alguno desplazamientos,estacionado segun abro puerta delante descender unidad embestido frente bicileta dicha puerta ocupantes recuerdo tenia caen pavimento levanta propios medios manifestaba lesiones visibles retira circulando bicicleta dejar datos alguno desplazamientos
am    ,circulabamos cariboni pongo luz giro doblara triunvirato doblo tercero moto venia moto ambos caen piso levanta levanta llego intervencion policial,comprometida,circulaba cariboni pongo luz giro doblara triunvirato dolor tercero moto venia moto ambos caen piso levanta levanta llego intervencion policial,circulaba pongo luz giro triunvirato dolor tercero moto venia moto ambos caen piso levanta levanta llego intervencion policial
aci   ,circulaba ruta direccin gral hornos bicicleta venia delante mio voy pasando trato esquivar colisiona lateral derecha golpea parabrisas,comprometida,circulaba ruta direccin gral hornos bicicleta venia delante mio voy san trato esquivar colisionando lateral derecha golpea parabrisas,circulaba ruta direccin gral hornos bicicleta venia delante mio voy san trato esquivar colisionando lateral derecha golpea parabrisas
aa    ,vehiculo asegurado circulando gral paz cort losbulones rueda rueda salio desplazada impact und vehiculo,,vehiculo aseg circulando gral paz cort losbulones rueda rueda salio desplazada impactada und vehiculo,vehiculo aseg circulando gral paz rueda rueda salio impactada vehiculo
am    ,circulando gurruchaga freno interseccion mustoni venia nadie ultima cruzo venia moto alta velocidad vulvo frenar moto colisiona parte delantera lateral delantero izquierda moto cae intervencion policial same momento tenia datos seguro poseia licencia conducir tercero derivado hospital haedo datos tercero vega gonzalo alejandro motomel s kku,comprometida,circulando gurruchaga frena interseccion mustoni venia nadie ultima cruzo venia moto alta velocidad vulvo frena moto colisionando parte delante lateral delante izquierda moto caen intervencion policial same momento tenia datos asegurado poseia licencia conducir tercero derivado hospital haedo datos tercero vega gonzalo alejandro motomel asfalto kku,circulando gurruchaga frena interseccion venia nadie ultima cruzo venia moto alta velocidad frena moto colisionando parte delante lateral delante izquierda moto caen intervencion policial same momento tenia datos asegurado poseia conducir tercero derivado hospital haedo datos tercero vega gonzalo alejandro motomel asfalto
am    ,asegurado estacionado cordon derecha paris puerta delantera abierta buscando papeles sentado dentro unidad moto venia circulando misma embisti frente puerta abierta ocupante moto recuerda llevaba cay asfalto desplazamientos intervencion policial,comprometida,aseg estacionado cordon derecha paris puerta delante abierta buscando papeles sentado delantero unidad moto venia circulando mismo embistio frente puerta abierta ocupantes moto recuerda llevaba cayo asfalto desplazamientos intervencion policial,aseg estacionado cordon derecha puerta delante abierta buscando papeles sentado delantero unidad moto venia circulando mismo embistio frente puerta abierta ocupantes moto recuerda llevaba cayo asfalto desplazamientos intervencion policial
am    ,circulando ntra sra rosario llegar esquina carranza choco moto parte delan tera lateral izquierda moto sola persona cae piso presento sem b san martin motociclista trasladado atendido lugar lesiones aparente reirandonos lugar ser derivados comisaria hospital,comprometida,circulando ntra sra rosario llegar esquina carranza choco moto parte delante lateral lateral izquierda moto sola personas caen piso presento sem maniobro san martin motociclista trasladado atendido lugar lesiones aparente reirandonos lugar trasera derivados comisaria hospital,circulando sra rosario llegar esquina carranza choco moto parte delante lateral lateral izquierda moto sola personas caen piso presento maniobro san martin motociclista trasladado atendido lugar lesiones lugar trasera comisaria hospital
am    ,asegurado circulaba fray justo santa maria oro pasando bocacalle curapaligue moto venia luces edta ultima asegurado puede evitar chocarla frente motociclista llevaba cae capot luego piso levanto propios medios presentaba lesiones visibles ofrecimiento asegurado nego ir hospital llamar retiro andando moto,concurrente,aseg circulaba fray justo san maria oro san bocacalle curapaligue moto venia luces edta ultima aseg puede evitar choca frente motociclista llevaba caen capot luego piso levanta propios medios presentaba lesiones visibles ofrecimiento aseg nego retiro hospital llamar retiro andando moto,aseg circulaba fray justo san maria san bocacalle curapaligue moto venia luces ultima aseg puede evitar choca frente motociclista llevaba caen capot luego piso levanta propios medios presentaba lesiones visibles ofrecimiento aseg nego retiro hospital llamar retiro andando moto
aa    ,aseg saliendo reversa gge impacta parte trasera lateral izquierda tercero detenido arriba desplazamientosel tercero inform rasp,comprometida,aseg saliendo reversa gge impactada parte trasera lateral izquierda tercero detenido iba desplazamientos tercero inform rasp,aseg saliendo reversa gge impactada parte trasera lateral izquierda tercero detenido iba desplazamientos tercero
am    ,asegurado circculando baja velocidad lemos embestido moto sobrepasa ocup cae pavimento interv trasladado hosp malvinas dolor piernas,comprometida,aseg circculando baja velocidad lemos embestido moto sobrepasa ocupantes caen pavimento interv trasladado hospital malvinas dolor personas,aseg baja velocidad embestido moto sobrepasa ocupantes caen pavimento interv trasladado hospital malvinas dolor personas
am    ,redgreenlueredgreenlue asegurado circulaba h yrigoyen doblando moto intenta pasar choca asegurado guardabarros delantero derecha motociclista llevaba cae piso perdida conocimiento ,comprometida,redgreenlueredgreenlue aseg circulaba marcha yrigoyen doblando moto intenta pasar chocando aseg guardabarros delante derecha motociclista llevaba caen piso perdida conocimiento,redgreenlueredgreenlue aseg circulaba marcha yrigoyen doblando moto intenta pasar chocando aseg guardabarros delante derecha motociclista llevaba caen piso perdida conocimiento
aa    ,circulando casn juan llegar interseccion intenente alvear produce colision parte delantera parte lateral tercero desplazamientos tercero sufre lesiones personano ,comprometida,circulando casn juan llegar interseccion intenente alvear produce colisionando parte delante parte lateral tercero desplazamientos tercero sufre lesiones persona,circulando juan llegar interseccion alvear produce colisionando parte delante parte lateral tercero desplazamientos tercero sufre lesiones persona
am    ,asegurado circulando balizas rivadavia momento maniobrar ingresar garage misma produce colision tercero moto intent sobrepasar aseg termina impactando lateral derecha auto ocupantes moto caen piso levanta medios intervencion policial retiraron moto terc registro pedidos,comprometida,aseg circulando balizas rivadavia momento maniobra ingresar garage mismo produce colisionando tercero moto intent sobrepasar aseg termina impacta lateral derecha auto ocupantes moto caen piso levanta medios intervencion policial retira moto terc registro pedidos,aseg circulando balizas rivadavia momento maniobra ingresar garage mismo produce colisionando tercero moto intent sobrepasar aseg termina impacta lateral derecha auto ocupantes moto caen piso levanta medios intervencion policial retira moto terc registro
am    ,asegurado circulaba cnel juan terrada colisionado parte lateral delantera parte delantera moto circulaba bernardino rivadavia unico ocupante moto tenia cayo piso presentaba lesiones visibles trasladado centro medico moto asegurado secuestrados,comprometida,aseg circulaba cnel juan terrada colisionando parte lateral delante parte delante moto circulaba bernardino rivadavia unico ocupantes moto tenia cayo piso presentaba lesiones visibles trasladado centro medios moto aseg secuestrados,aseg circulaba cnel juan terrada colisionando parte lateral delante parte delante moto circulaba rivadavia unico ocupantes moto tenia cayo piso presentaba lesiones visibles trasladado centro medios moto aseg secuestrados
cicl  ,llegar direccion indicada estaciono abrir puerta descender produce colision bicicleta mitad misma,comprometida,llegar direccion indicada estaciono abrir puerta descender produce colisionando bicicleta mitad mismo,llegar direccion indicada estaciono abrir puerta descender produce colisionando bicicleta mitad mismo
am    ,asegurado circulaba munoz doblar izquierda charlone moto venia munoz embiste puerta delantera izquierdaueirda moto iba sola persona recuerdo tenia cae suelo moto cayo arriba aseg lllevo clinica sarmiento cel,comprometida,aseg circulaba munoz doblar izquierda charlone moto venia munoz embiste puerta delante izquierda moto iba sola personas recuerdo tenia caen suelo moto cayo iba aseg lllevo clinica sarmiento cel,aseg circulaba munoz doblar izquierda moto venia munoz embiste puerta delante izquierda moto iba sola personas recuerdo tenia caen suelo moto cayo iba aseg clinica sarmiento cel
aa    ,aseg detenido semaforo dorrego impactado parte trasera parte delantera tercero circulaba detras desplazamientos lesionados aseg sufrio latigazo amigo novia hacen atender hospital latigazo tambien intervinientes,discutida,aseg detenido semaforo dorrego impactado parte trasera parte delante tercero circulaba detras desplazamientos lesionados aseg sufrio latigazo amigo novia hacen atender hospital latigazo tambien intervinientes,aseg detenido semaforo dorrego impactado parte trasera parte delante tercero circulaba detras desplazamientos lesionados aseg sufrio latigazo amigo novia atender hospital latigazo tambien intervinientes
am    ,asegurado circulaba villegas dispone doblar moto venia detras adelanta roza espejo retrovisor auto asegurado habia auto golpeael asegurado ,comprometida,aseg circulaba villegas dispone doblar moto venia detras delantera roza espejo retrovisor auto aseg habia auto golpeael aseg,aseg circulaba villegas dispone doblar moto venia detras delantera roza espejo retrovisor auto aseg habia auto aseg
aa    ,aseg maniobra cambiar carril centenario colisiona lateral trasero derecha lateral trasero izquierda tercero detenido misma semaforo lesinoados desplazamientos,comprometida,aseg maniobra cambiar carril centenario colisionando lateral trasero derecha lateral trasero izquierda tercero detenido mismo semaforo lesinoados desplazamientos,aseg maniobra cambiar carril centenario colisionando lateral trasero derecha lateral trasero izquierda tercero detenido mismo semaforo desplazamientos
am    ,asegurado detenido semaforo impactado moto parte trasera parte frontal motosolo persona moto cae piso tenia prsento lesion asiste desconoce trasladan centro medico asegurado retira ,comprometida,aseg detenido semaforo impactado moto parte trasera parte frontal solo personas moto caen piso tenia prsento lesiones asiste desconoce trasladado centro medios aseg retira,aseg detenido semaforo impactado moto parte trasera parte frontal solo personas moto caen piso tenia lesiones asiste desconoce trasladado centro medios aseg retira
am    ,transitaba corrientes metros llgar acevedo observ oun lugar estacionado desplazo hacia vereda estacionar realizo maniobra alcanzo tener contacto moto encerrar moto moto opcion pegar lateral delant izquierda espejcabe aclarar danos gdi espejo pese contacto hizo vuelta asisti rapidamente moto verlo presetanba ningun tipo lesion visible solo tenia dolor piernas golpeo moto datos tercero costa julian eduardo honda cbr ajpl atm,comprometida,transitaba corrientes metros llegar acevedo observ oun lugar estacionado desplazo habia vereda estacionar realizo maniobra alcanzo tener contacto moto encerrar moto moto opcion pegar lateral delante izquierda espejcabe aclarar datos gdi espejo pese contacto hizo vuelta asisti rapidamente moto verlo presentaba ningun tipo lesiones visible solo tenia dolor personas golpeo moto datos tercero costado julian eduardo honda cbr ajpl atm,transitaba corrientes metros llegar acevedo lugar estacionado desplazo habia vereda estacionar realizo maniobra alcanzo tener contacto moto moto moto pegar lateral delante izquierda aclarar datos espejo pese contacto hizo vuelta asisti rapidamente moto verlo presentaba ningun tipo lesiones visible solo tenia dolor personas golpeo moto datos tercero costado julian eduardo honda atm
