cod_accidente,descripcion,responsabilidad
aa,estaba estacionadodel parte izquierda arranco me colisiona trasera otro,COMPROMETIDA
aa,circulaba paroissien llegar interseccion machain freno cuneta dejo pasar autos comienzo avenida veo viene machain suran negra alta velociday me colisiona rueda delantera presento policia same traslado pirovano todos yo sra velis su beba para constatar lesiones luego control nos dieron alta autos secuestrados actuacionesjudiciales cargo juzgado secretaria,COMPROMETIDA
aa,saliendo garaje marcha trasera colisiona parte trasera estaba estacionado,COMPROMETIDA
aa,asegurado estaba estacionado sale apenas toca tercero,COMPROMETIDA
aa,asegurado indica encontraba circulando calle billinghurst motocicleta cruza entre asegurado tercero colisiona tercero parte trasera tercero parte delantera asegurado intervino ambulancia policia,COMPROMETIDA
aa,cc asegurado indica encontraba conduciendo colectora panamericana tercero colisiona para colisiona delantera para colisiona trasera tercero hubo presencia policia ambulancia tercero conducia hija asegurado estaba acompanante asegurado momento siniestro presentaba dolores cabeza asegurado ofrecio llevarla hospital pero accedio luego comunico asegurado indico quele colocaron cuello ortopedico,COMPROMETIDA
aa,asegurado indica encontraba conduciendo calle miller llegar interseccion calle nahuel huapi colisiona otro venia conduciendo dicha calle debido ambulancia llegan frenar tercero colisiona para colisiona delantera izquierda para colisiona delantera derecha asegurado,COMPROMETIDA
aa,iba manejando rio janeiro transito pesado cual iba mas km x hora ademas estaba lloviendoen momento parados me distraje frene encima taxi tocandolo apenas sin mayores danos pinturasaltada mismo,COMPROMETIDA
aa,cc asegurado circulaba calle indicada delantera iba tercero asegurado querer sobrepasar tercero colisiona levemente para colisiona trasera izquierda sin lesiones,COMPROMETIDA
aa,circulando avenida general paz mu colisiona traficoavenida estaba delantera mio nolo hace colisiona su parte trasera levemente,COMPROMETIDA
aa,me encontra circulando padre varvello me encerro para pasar para evitar colisiona me tire asi vereda dio fuja vereda habia volquete lleno escombros fierros dese colisiona obra cual colisiona parte derecha colisiona frente fiat estaba estacionado parte delvolquete,COMPROMETIDA
aa,cc asegurado estaba saliendo donde estaciono estaba esquina podia estacionar tercero colisiona parte delantera izquierda,COMPROMETIDA
aa,cc asegurado informa encontraba saiendo posicion estacionamiento ese momento tercero pasa colisiona parte delantera izquierda,COMPROMETIDA
aa,asegurado declara encontraba retirando asegurado marcha trasera su garage ubicado calle arcos es colisiona tercero circulaba dicha calle para colisiona trasera hubo lesionados,COMPROMETIDA
aa,circulaba menos kmh avenida edison sentido oeste pocosmetros iniciar cuadra delantera forfocus patente eec quien circulaba enmismo sentido coloco luz giro hacia derecha colisiona freno para ingresar estacionamiento sin colocar baliza toparme esta maniobra frene toque punta su para colisiona trasera parte izquierda punta mi para colisiona delantera parte derecha,COMPROMETIDA
aa,circulaba calle ituzaingo hacia calle italia estoy cruzando interseccion esta ultima calle venia asegurado parte izquierda respeta prioridade paso invade mi carril marcha ocasiona siniestro cabe aclarar conductor tercero negaba darme datos seguro cual llame policia concurrio lugar obligando este conductor me entregue informacion documentacion,CONCURRENTE
aa,hijo asegurado encontraba circulando calle interna barrio privado camino real asegurado encontraba estacionado fuera domicilio conocido conductor realizar marcha trasera para maniobrar comenzar marcha produce colisiona sector trasera izquierda asegurado contra sector delantera derecha tercero encontraba alli estacionado sin pasajeros hubo intervencion policial ambulancia,COMPROMETIDA
aa,cruce ruta acceso norte ramal pilarme encuentro girando pequena rotonda desde asegurado parte derecha ingresa alta velocidaa rotonda yo volanteo hacia izquierda pensando me va colisiona esa maniobra percibo estaba pasandome izquierda resulta toque extremo izquierda mi para colisiona delantera su parte trasera derecha cual produce marca pequeno hundimiento panel parte trasera derecha pequeno roce marca mi para colisiona delantera parte delantera izquierda mi unidad,COMPROMETIDA
aa,yo colisiona mi tercero siniestro origino retrocediendo para salir posicion estacionamientomi tiene danos porque rueda auxilio trasera lleva modelo baul amortiguo misma fue abollo tercero frente hubo lesionados porque habia nadie dentro,COMPROMETIDA
aa,venia llegando esquina veo viene nadie empiezo cruzar ese momento aparece tercero colisiona parte izquierda,DISCUTIDA
aa,circulaba gaspar campos tercero frena bruscamente trafico locolisiona trasera,COMPROMETIDA
aa,estaba saliendo estacionamiento donde hay bici senda dicha mano miro primero para asegurado parte derecha para ver venia algun luego para izquierda venia alguien bici senda salgo colisiona taxi venia m t alvear habia visto vendria velocidaque me permitio verlo primera instancia parte trasera parte conductordado frene colisiona venia trasera mio saliendo tambien garage me raspo poco para colisiona trasera,COMPROMETIDA
aa,asegurado indica mientras circulaba ruta mencionada carril derecha mismo aparece colectivo plaza interno parado sin balizas asegurado intenta esquivarlo maniobrando hacia carril izquierda pero logro hacerlo exito e colisiona parte delantera parte derecha contra parte trasera parte izquierda micro hubo presencia policial micro estaba lleno pasajeros pero ninguno fue lesionado solo asegurado su acompanante,COMPROMETIDA
aa,me dirigia calle colombres es angosta doble mano venir autos mano contraria me veo obligada hacer maniobra para dar lugar podamos pasar pero es ahi donde me acerco sin querer estacionado parte derecha colisiona querer salir me queda otra opcion danar parte mi colisiona estacionado es forfocus style nafta patente jxd,COMPROMETIDA
aa,saliendo marcha trasera predio mi propiedacolisiono fiat uno estacionado mano enfrente cual observe,COMPROMETIDA
aa,circulaba calle callao joh circulaba delantera frena imprevisto ocasionando colisiona cadena pudiendo evitar colisiona mab circulaba trasera tercero,COMPROMETIDA
aa,madre asegurado circulaba calle indicada llegar interseccion avenida monte verde donde hay semaforos asegurado maniobra para doblar parte izquierda incorporaba transito tercero colisiona parte derecha delantera madre asegurado fue clinica ima adrogue ya colisiona provoco dolores cervicales policia intervino para tercero brinde datos,COMPROMETIDA
aa,cc hermano asegurado indica circulaba calle mencionada llegar interseccion comienza cruce tercero colisiona parte delantera contra parte delantera derecha asegurado causa este colisiona asegurado termina desplazandose subiendose ochaba esquina hubo presencia ambulancia policial,CONCURRENTE
aa,estacionar dar marcha trasera toque etios relacion mi tiene ningun dano eso tengo dudas etios tuviera algun problema segun titular cual di datos para evitar discusion,COMPROMETIDA
aa,estaba estacionado junto vereda cundo salgo avenida miro espejo retrovisor trafico clio mencionado detiene su marcha para dar paso otro colisiona sin provocar danos ninguno dos autos,COMPROMETIDA
aa,ponerse verde semaforo me encuentro distancia metros aproximadamente encuentra delantera poniendome marcha ese momento me percato delantera mio mueve colisiona parte delantera mismo rompiendo para colisiona doblando abollando tapa baul mismo,COMPROMETIDA
aa,yendo kmh me distraje buscando algo me fue para parte colisiona audi estacionado cola para afuera casa calle yacare colisiona farol derecha trasera,COMPROMETIDA
aa,cc asegurado informa circulaba calle pampa colisiona tercero frena delantera parte trasera,COMPROMETIDA
aa,circulaba avenida rolon direccien hacia avenida marquez ingresar rotonda roce ellado trasera derecha circulaba rotonda,COMPROMETIDA
aa,saliendo rotonda llavenida renault stepwey freno colisiona trate esquivarlo toque parte delantera izquierda,COMPROMETIDA
aa,asegurado encontraba circulando calle peron trasera tercero colisiona otro circulaba delantera intervino policia,COMPROMETIDA
aa,circulando avenida villegas siento ruido parte derecha veo rojo muy cercadel camion bajar veo falta espejo retrovisor izquierda doy mis datos dudas continuo recorrido er,COMPROMETIDA
aa,volviendo para mi casa mi perra esta bajo asiento trasera queriendose pasar hacia delantera me distraigo miro delantera veo goma estaba puesta delantera gomeria freno ultimo segundo colisiona contra llanta estaba debajo goma misma pega parte trasera contra peugeot estaba estacionadoadelante,COMPROMETIDA
aa,avenida semaforo coloca verde delantera frena colisiona aprieto freno instantaneamente pero ya estaba muy proximo ya estabamos avenida impacto,COMPROMETIDA
aa,estacionar cochera colisiona tercero encontraba estacionado alli,COMPROMETIDA
aa,yanina jakob mailtoyaninajakobcomnone enviado lunes agosto para ingresos rcc cc noelia ferrario asunto derecha buenos dias les paso derecha hoy saludos yanina jakob analista rcc motor direccion claims cerrito ciudade buenos aires cp telnone int grupo zurich yaninajakobcom mailtopatriciapachecocomnone httpwwwzurichcomarnone resumen caso responsabilidamecanica fecha colisiona ro terceros involucrados descripcien tercerofecha peritacion danos materiales danos materiales cotizados titulocedula verde firmado danos materiales reclamados datos tercerodenuncia siniestro roregistro conducir rocertificado cobertura ro copia carta franquicia rodeclaracion jurada seguro ro reclamo abogado ro causales exclusien pautas fraudecheck list fraude cesvisofia suspensien plazos resultado gestion movimiento diario,COMPROMETIDA
aa,estacionando forma correcta di marcha trasera mi para colisiona toque para colisiona tercero,COMPROMETIDA
aa,me encontra circulando carril derecha avenida tomas espora sentido desde adrogue hacia burzaco fila izquierda encontraba parada estoy pasando fila izquierda cruza mi carril colisiona parte izquierda,COMPROMETIDA
aa,cc asegurado indica mientras circulaba calle mencionada llegar interseccion su vision obstaculiza otra camioneta hacia su derecha cruzar colisiona otro circulaba calle febrero hacia rolon colisiona parte delantera tercero parte derecha asegurado,COMPROMETIDA
aa,estando parada san martin para doblar derecha tomar tradicion estaba delantera avenida tambien frena colisiona embisto,COMPROMETIDA
aa,asegurado circulaba avenida indicada llegar interseccion calle gutierrez dobla hacia derecha colisiona su parte derecha tercero encontraba estacionado dicha sin lesiones,COMPROMETIDA
aa,ingresaba estacionamiento edificio donde vivo maniobrar para colocar mi cochera roce estacionado cochera vecina produciendole rayon para colisiona delantera,COMPROMETIDA
aa,circulaba yatay calculo pise gasoil perdi control colisiona camioneta meriva moto ambulancia estacionadas danos todo parte izquierda para colisiona trasera delantera optica izquierda capot,COMPROMETIDA
aa,circula charcas iba cruzando guise es colisiona otro parte derecha,COMPROMETIDA
aa,cc esposa asegurado indica encontraba circulando calle andres lamas tercero colisiona parte trasera tercero parte delantera asegurado intervino ambulancia policia,COMPROMETIDA
aa,asegurado declara encontraba circulando calle laprida habia tercero colisiona parte trasera izquierda su para colisiona delantera derecha asegurado declara tercero queria estacionar lugar prohibido su vez puso luz giro hubo lesiones,CONCURRENTE
aa,asegurado informa encontraba circulando calle limay circulaba calle neochea cruza colisiona parte derecha asegurado,DISCUTIDA
aa,saliendo mi cochera marcha trasera colisiona estacionado calle enfrente mi domicilio,COMPROMETIDA
aa,ingresar puente acceso oeste colisiona parte otro,COMPROMETIDA
aa,cc hija asegurado informa encontraba circulando segundo carril juan b justo fue interceptada tercero conducia misma calle parte izquierda,DISCUTIDA
aa,circulaba venezuela bocacalle loria miro veo ningun cruzo me colisiona fiat siena parte delantera derecha me arrastra hacia esquinacontratria donde me hace colisiona estacionado,COMPROMETIDA
aa,asegurado informa circulaba avenida vergara aguardando semaforo pasarse parte derecha espero avenida colectivo querer cuzar mano colisiona tercero parte delantera izquierda,COMPROMETIDA
aa,cambio semaforo verde delantera mio aranca yo tambien delantera frena yo frene encima pavenida estaba muy humedo freno encima delantera mio yo tengo danos capot delantera,COMPROMETIDA
aa,estaba estacionada calle niceto vega cap fecuando sin darme cuenta di marcha trasera toque capot mi rueda auxilio,COMPROMETIDA
aa,lunes alrededor hs me subi debido tenia turno para grabado partes hs quintino bocayuva como costumbre mi mujer abrio porton garaje o cochera encendi balizasdel parte nuestra casa pasa bicisenda otro parte acera habia estacionados toda cuadra vez mi mujer abre reja exterior comienzo salir cochera marcha trasera menor velocidaposible tocando bocina par veces todo momento miro hacia ambulancia lados ademas mi mujer vigila ningun peaton o ciclista este riesgo seproduzca accidente ruedas trasera tocan acera freno para mi mujer pueda cerrar porton reja hasta ese momento obstruye circulacion quedando entre vereda bicisenda terminar mi mujer cerrar porton miro hacia ambulancia lados para ver vienen ciclistas o,COMPROMETIDA
aa,conductor asegurado encontraba circulando piedra buena dobla hacia pparte luz giro puesta e colisiona contra circulaba delantera dado este tercero coloca luz giro para doblar hacia pparte simulando continuar conduciendo piedra buena asegurado encontraban dos personas ambulancia viajaban parte trasera mencionaron dolores asistio ambulancia policia,COMPROMETIDA
aa,yo circulaba calle liverpool doblando para tomar calle londres me colisiona marca chevrolet classic ptas patente kwl parte derecha colisiona parte derecha trasera parte trasera delantera derecha conductor chevrolet alego patino freno porque estaba mojada calle,COMPROMETIDA
aa,cc hijo asegurado informa conducia calle belgranoal acercarse interseccion referencia hijo asegurado verifica crucen avenida es colisiona parte izquierda delantera tercero dominio phc asegurado presenta danos parte delantera opticas para colisiona delantera todo area parte delantera tercero conducia alta velociday visualizaron danos parte derecha trasera hijo asegurado emanuel tomas suarez dni,COMPROMETIDA
aa,cc asegurado declara habia dejado su estacionado calle pujol bajar logro ver colisiona su parte delantera izquierda parte derecha tercero hubo lesionados,COMPROMETIDA
aa,cc asegurado indica encontraba circulando calle zuviria llegar esquina san jose calasanz izquierda aparece otro colisiona parte delantera izquierda asegurado parte delantera derecha tercero hay semaforo intervino policia ambulancia tercero sufrio lesion mano izquierda derecha hospital duran,CONCURRENTE
aa,estaba entrando mi garaje hice marcha trasera vi taxi estaba parado asegurado parte delantera,COMPROMETIDA
aa,asegurado informa circulaba calle peron e iba doblar hacia calle pringles paralelamente asegurado habia tercero colisiona parte derecha,DISCUTIDA
aa,cc hija informa circulaba avenida inmigrantes colisiona,COMPROMETIDA
aa,circulando olavenida cedo paso circulaba calle belgrano doblo trasera este sin percatarme otro circulaba tambien calle belgrano apura marcha para tambien cruzar calle olavenida antes yo doble callebelgrano,COMPROMETIDA
aa,asegurado declara venia circulando febrero querer cambiar carril debido queria seguir febrero habia semaforo baja velocidadebido tercero encontraba delantera tambien baja velocidael asegurado mira espejo retrovisor distrae colisiona tercero encontraba delantera su para colisiona hubolesiones,COMPROMETIDA
aa,asegurado indica estaba circulando calle mencionada repentinamente corto cable direccion asegurado e colisiona parte delantera derecha contra parte trasera derecha tercero encontraba estacionado,COMPROMETIDA
aa,vengo mi trabajo paso avenida miro ambulancia lados parte venia nada delotro duna pero alejado tenia prioriday ir mas mitavenida duna detiene clavenida frenos siento colisiona parte derecha duna frenoy me choco,CONCURRENTE
aa,cc asegurado declara encontraba maniobrando hacia derecha para ingresar garage su domicilio balizas puestas tercero intento pasarla ocacionando colisiona zona derecha delantera asegurado zona trasera izquierda asegurado dice venir su mano manera correcta hubo lesiones,COMPROMETIDA
aa,circulaba avenida heras giro derecha sentido jeronimo salguero supuestamente me cierro demas segun taxista taxi estaba detenido puedo ser preciso trato salir engan colisiona parte derecha mi para colisiona delantera ocasionando algunos rayones aboyadura puertas mi suyo solo para colisiona delantera,COMPROMETIDA
aa,cc asegurado declara estaba estacionado calle rivero hacer marcha trasera para salir colisiona tercero encontraba estacionado esperando semaforo asegurado colisiona su zona derecha trasera tercero colisiona para colisiona derecha trasera hubo lesiones,COMPROMETIDA
aa,vengo avenida artigas llegnado interseccion pareja cruza otro frene llego tiempo ocurrio asegurado parte delantera,COMPROMETIDA
aa,estaba frenado semaforo gire derecha focus quiso pasar asegurado parte derecha me choco,COMPROMETIDA
aa,yo venia manejando mano derecha rio janeiro bastante mas adeantada me colisiona doble hacia izquierda endiaz velez muy abierta guino puesto hacia media cuadra otro me colisiona esa interseccion desen parte trasera me colisiona lapunta delantera creo izquierda su diagonal trasera izquierda mio o sea yo habia doblado porque solo me colisiona punta trasera me rompio poco para colisiona pero resto colisiona ahora te mando fotos mi otro mail cedula verde otro seguro mio es solo rotura para colisiona chica otro recuerdo habia quedado poco mas roto llama adrian me dejo su telefono,COMPROMETIDA
aa,circulaba iriart direccien ruta encontraba delantera miohace maniobra para salir ruta miro hacia asegurado parte izquierda para ver tenia paso yacelero sin darme cuenta circulaba delantera mio habia detenido locolisiona parte trasera,COMPROMETIDA
aa,asegurado circulaba maipu transito detiene alcanzo afrenar colisiona tercero parte trasera forfocus ocf,COMPROMETIDA
aa,venia conduciendo arce paso chenaut todo ocurre canitas crei autoshabian arrancado colisiona trasera muy fuerte arruine parte traserolevemente,COMPROMETIDA
aa,circulaba calle pe derecha detraas interceccion calle baldomero fernandez moreno nos deja pasar ambulancia autos circulaba esa calle pasa delantera paso trasera otro viene parte nos dejo pasar me colisiona parte derecha colisiona ambulancia puertas,COMPROMETIDA
aa,freno delantera llego frenar,COMPROMETIDA
aa,cc asegurado declara encontraba detenida semaforo interseccion ruta era tercera fila ponerse verde semaforo moto salia estacion servicio cruza delantera primer fila llega frenar su vez frena segundo pero asegurado llega frenar e colisiona tercero encontraba delantera parte delantera zona trasera tercero moto sufrio danos hubo lesiones,COMPROMETIDA
aa,estando detenida inteseccion avenida marquez segundo fernandez camion delantera cual permitia ver bien pasaba momento puede avenida corre camion veo agente transito indica avenida girando derecha o izquierda ya estaba cortada avenida marquez obras parada segundo carril derecha intento doblar hacia derecha es ahi ubicado asegurado parte derecha quiere doblar hacia izquierda ambulancia colisiona habia ninguna senalizacion indicara corte o desvio anticipaciondanos asegurado rayones parte delantera trasera izquierda rotura optica izquierda abolladura parte izquierda,CONCURRENTE
aa,cc asegurado indica mientras su marido encontraba realizando marcha trasera dentro estacionamiento centro comercialimpacta tercero colisiona parte trasera asegurado parte trasera tercero hubo lesionados,COMPROMETIDA
aa,estacionar colisiona para colisiona gol,COMPROMETIDA
aa,hice marcha trasera colisiona estacionado colisiona dane elguardabarro delantera derecha delantera datos colisiona son siguiente fortaunus l ano patente vel titular aranda juan domingoa mi dane para colisiona trasera,COMPROMETIDA
aa,iba conduciendo mi toyota corolla patente jgr x lima giro izquierda plazoleta vi otro era peugeot pfertas patente oru cual colisiona puertas parte izquierda mi paso nada,COMPROMETIDA
aa,cc asegurado informa encontraba circulando calle mencionada da cuenta habia pasado calle tenia doblar hace marcha trasera sin ver habia tercero colisiona parte trasera,COMPROMETIDA
aa,cc esposo asegurado indica estacionando dicha avenida para su mujer vaya banco colisiona tercero encontraba tambien estacionado trasera sector trasera contra delantera tercero hubo intervencion policial ambulancia,COMPROMETIDA
aa,cc hija asegurado informa estaba haciendo marcha trasera para salir estacionada parte izquierda ela calle colisiona enocntraba estacionado trasera asegurado,COMPROMETIDA
aa,conductora informa ciruculaba rodriguez pena calle doble mano autos estacionados ambulancia parte conducia mano contraria izquierda intenta sobrepasar camion para esquivarlo conductora hace maniobrapor intercepta estacionado parte derecha,COMPROMETIDA
aa,dia fecha septicolisiona venia circulando calle julio alrededor horas luego doblar calle virrey alviles hacia derecha venia circulando dicha calle me colisiona parte izquierda delantera dominio es mjs nombre maria carmen peroni conducia guillermo oscar peroni,COMPROMETIDA
aa,salgo marcha trasera advierto otro colisiono,COMPROMETIDA
aa,estaba descendiendo cual estaba parado balizas puestas mano derecha parte cordon para entrar tallermecanico aparece manera introspectiva me lleva parte suerte logre correrme hacia dentro sino me llevaba mitambien,CONCURRENTE
aa,transito estaba detenido subida colectora thames tercero detiene delantera asegurado mismo toca tercero trasera,COMPROMETIDA
aa,debido cantidade trafico veniamos acelerando frenando momento llegue frenar e colisiona contra tercero,COMPROMETIDA
aa,cc asegurado indica mientras circulaba calle mencionada delantera detiene causa semaforo asegurado logra frenar tiempo circulaban baja velocidaimpacta parte delantera asegurado parte trasera tercero,COMPROMETIDA
aa,conducia paseo colon volkswagen delantera frena llego frenar tiempo pudiendo evitar colision,COMPROMETIDA
aa,cc nieto asegurado indica estaba circulando calle mencionada llegar interseccion detiene deja cruzar peeaton comienza marcha nuevamente pero colisiona tercero venia derecha asegurado colisiona dio frente asegurado contra parte izquierda terecero,COMPROMETIDA
aa,me encontraba detenido calle cordoba esperando mi semaforo ponga verde para cruzar avenida bosco mi semaforo pone verdo arranco para cruzar mano derecha avenida don bosco cruza velocidaconsi derecha cual me dio tiempo reaccionar solo pisar freno colisiona cabe destacar semaforo funsionaba pero confusamente quedando luces prendidas momento debia detenerce mi semaforo funcionaba correctamente,COMPROMETIDA
aa,circulando calle tristan malbran doble sentido circulacion dos sentidos rozo colisiona parte trasera camion parte derecha camioneta s marca chevrolet ocasionandole danos su cubierta delantera izquierda er,COMPROMETIDA
aa,cc asegurado indica estaba circulando avenida mencionada llegar interseccion semaforo funcionaba comienza cruce mismo momento tercero circulaba interseccion decide cruzar tambien pero colisiona parte derecha delantera asegurado contra parte izquierda trasera tercero,COMPROMETIDA
aa,salia marcha trasera garage mi casa colisiona para colisiona estaba estacionado enfrente mano izquierda,COMPROMETIDA
aa,coche frena colisiona esquina semaforo nunca note habia tocado su parte izquierda ya circulaba muy lentamente baja conductora otro alegando habia colisiona tenia u pequeno roce dano pintura parte trasera izquierda marca negra podria ser mii camioneta u pequeno bollo mas delantera reconozco haberselo he colisiona ya mismo encontraba muy limpio tenia ningua marca para colisiona negro mi camioneta como pequeno raspon cerca mismo lugar,COMPROMETIDA
aa,circulaba avenida santa fe direccion oeste llegar interseccion calle castellanos forma imprevista cruza marca renault dominio afh cual circulaba esta ultima arteria direccion norte respetando mi prioridade paso encontrandose semaforo intermitente debido horarioluz amarilla producto colisiona tercero saledespedido hacia ochavenida noroeste colisiona este su frente inmueble halla dicha esquina causandole danos hubo lesionados ocupantes asegurado,CONCURRENTE
aa,me desplazaba calle int abel costamano unica interseccion calle general b mitre cual presenta baden donde circulaba tercero foreco sport mi mano izquierda mismo paso sin frenar baden colisiona su parte derecha ambulancia descendimos sin lesiones fisicas intercambiaron datos luego cual otro conductor seretiro conduciendo escena ambulancia habia acompanante,CONCURRENTE
aa,cc asegurado indica encontraba circulando colombres camioneta circulaba delantera mismo sentido frena intereseccion diaz velez produciendo asegurado colisiona misma sector delantera contra sector trasera cae suelo levanta sus propios medios hubo intervencion policial ambulancia,COMPROMETIDA
aa,es gol patente bmj paro semaforo yo llegue frenar colisiona trasera danando taragolpe,COMPROMETIDA
aa,delantera frene repentinamente porque cruze persona colisiona trasera,COMPROMETIDA
aa,circulado bonplanal llegar honduras estando semaforo rojo frene pero toque levemente taxi estaba detenido esperando cambio luz,COMPROMETIDA
