cod_accidente,descripcion,responsabilidad
aa,colisien menor ocurrida ponerse verde semaforo comenzar moverse autos porrep arabe siria para cruzar avenida heras yo me encontraba to lugar para avenida lacamioneta estaba delantera mio avenida pero debido autos estaban delantera misma detienen subitamente marcha esta ve obligada frenar yo colisiona elpara colisiona trasera danando levemente pintura centro mismo leve hundimiento tapa baul mi para colisiona raja parte superior central perforacien parte derecha dano pintura rotura dos soportes hubo lesionados intervencien policial ampliacion denuncia danico damnificado fue tercero,COMPROMETIDA
aa,tercero derecha colisiona indica circulando calle indicada llegar interseccion america desde su derecha venia cual pudo ver porque habia camion detenido justo ochavenida permitia ver ninguno dos llegar interseccion este tercero cruza manera muy rapida asegurado verlo pesar venia lento puede evitar colisiona enconsecuencia colisiona tercero desplaza da trompo asegurado explotan ambulancia airbags,COMPROMETIDA
aa,redaccion conductor estacionando marcha trasera producje nu colisiona delantera partio parrilla hubo intervencion policial,COMPROMETIDA
aa,cc asegurado indica estaba circulando calle bilbao es calle doble mano destino sur o kilometros repente siente colisiona zona delantera izquierda ya venia circulando calle bilbao mano contraria asegurado bajo para ver otro conductor encuentre bien hacerlo otro hombre indica estaba mareado habia entendido habia pasado asegurado llamo policia ambulancia atendieron tercero,COMPROMETIDA
aa,mi encontraba estacionado enfrente mi casa mano derecha estoy esperando semaforo ponga verde parapo derecha salir vez hayan avenida autos estaban fila detenidos vez autos avenida semaforo verdeespero avenida camioneta encontraba parada sin avenida distancia aprox metro trasera mi coche cuandoestoy maniobrando para salir espacio junto cordon me encontraba estacionado me asegurado camioneta estuvieraavenida me dispongo salir e ingresar calle para circular cruzar semaforo encontraba verde esteinstante camioneta avenida colisiona sin mirar colisiona parte delantera izquierda,COMPROMETIDA
aa,doblar delantera freno raspe parte izquierda,COMPROMETIDA
aa,ingresando cochera mi edificio parte trasera mi raye mi vecino,COMPROMETIDA
aa,denuncia asegurado indica conducia su esposa momento muerde banquina desinfla neumatico pierde control e colisiona manera parte delantera tercero,COMPROMETIDA
aa,saliendo mi garaje marcha trasera colisiona peugeot oscuro estacionado calle angosta altura mi salida cruzando lacalle,COMPROMETIDA
aa,conductora indica circulaba calle mecionada cruzar interseccion es colisiona tercero circulabapor esta utima su derecha,COMPROMETIDA
aa,agaramoncirculaba roosevelt sentido hacia cabildo fui imprevistamente colisiona parte derecha,COMPROMETIDA
aa,circulaba pehuajo hacia trasera tercero colisiona asegurado parte trasera derecha dando giros colisiona varias veces ampliacion asegurado pehuajo encontraba ya cruzando tercero sarrachaga muy alta velocidadesde derecha colisiona parte trasera asegurado da trompo parte rueda trasera tiene seguro contra todo riesgo descripcien tercerocirculaba calle sarachaga sentido este oeste interseccion calle pehuajo segundo circulaba sur norte esta arteria cruzo calle alta velociday produce colisiona nota producida colisiona quien conducia retira lugar amiga para buscar documentacion ya llevaba consigo momento siniestro,CONCURRENTE
aa,asegurado declara debido transito arrancaban detenian reiteradas oportunidades esas veces elasegurado llego frenar e colisiona tercero parte trasera su parte delantera hubo lesiones,COMPROMETIDA
aa,cc conductor indica estaba saliendo estacionamiento hacerlo colisiona encontraba parte su,COMPROMETIDA
aa,yo venia andalgala cruzando avenida sin semaforo siguiendo delantera quede mitade avenida veo mano derecha venia ningun quiero avenida desde esa misma fila habia generado asegurado parte izquierda honda fit quiere pasarme delantera justo yo estaba cruzar apenas toque e igual hicimos cambio datos mirar su solo tenia rayon para colisiona mi me salto pintura donde esta parrilla dia fecha mayo comunico conmigo dueno otro me comenta tiene rayon dejo funcionar luz giro,COMPROMETIDA
aa,estaba estacionada avenida estoy saliendo me encerro volantear colisiona camioneta estaba estacionada delantera mi,COMPROMETIDA
aa,desplazo hacia delantera colisiona detenido produciendo pequenodano para colisiona trasera tercero,COMPROMETIDA
aa,denuncia asegurado venia circulando circunvalacion hacia puente malvinas ya cruzando doblandoviene toda velociday me colisiona parte aclarado delantera venia mujer nena tomando pecho,COMPROMETIDA
aa,asegurado informa encontraba estacionado calle mencionada realizando marcha trasera colisiona tercero encontraba trasera mismo parte delantera izquierda parte trasera derecha asegurado,COMPROMETIDA
aa,agaramonel asegurado circulaba bernardo irigoyen capital fe derecha colisiona tercero,COMPROMETIDA
aa,asegurado encontraba estacionado entrada domicilioi calle prieto maniobra dando marcha trasera fin salir di colisiona domicilio ese momento colisiona estacionado acera enfrente colisiona parte izquierda di colisiona,COMPROMETIDA
aa,cc asegurado informa estaba conduciendo calle pichincha interseccion deheza peugeot colisiona parte delantera derecha tercero colisiona otro encontraba entrada garage,COMPROMETIDA
aa,dando marcha trasera colisiona su para colisiona delantera,COMPROMETIDA
aa,asegurado circulaba calle albarellos llegar interseccion falcon ve lejos viene realiza cruce ya distancias permitian sin darse cuenta ro venia gran velocidael cual nunca frena colisiona parte trasera parte derecha probocandole medio trompo colisiona baul columna,CONCURRENTE
aa,conductor circulaba calle mencionada moto desconocida cerro paso generando este realizara maniobrapara evitar colisiona causo colisiona contra renault megane patente fts este recibir colisiona tercer marca forka patente lie ambulancia encontraban estacionados sin ocupantes su interior eldueno primer hizo presente pero estaba propietario segundo hubo lesionadosel marca renault megane resulto danos faro para colisiona trasera parte derecha mientras marca fordka danos para colisiona trasera parte baulel asegurado todo frente danado,COMPROMETIDA
aa,yendo hacia san miguel ruta cruza moto carril e colisiona mi hay camara esquina debe tenergravenida he colisiona vino camioneta policia comando patrullas malvinas argentinas mayor panozo oficial peral llamaron auna ambulancia atendio moto suerte solo tenia raspon atendio luego fue dejandolo lugar hubosecuestro,COMPROMETIDA
aa,me detuve semaforo linea peatonal hice marcha para trasera para dar paso peatones sin ver habia trasera impacte,COMPROMETIDA
aa,frena para estacionar mismo momento frente frena colisiona me da tiempo frenar condistancia colisiona,COMPROMETIDA
aa,cc hijo asegurado informa venia circulando general paz carril derecha encontraba colectivo linea parado sin luces asegurado colisiona parte trasera parte delantera,COMPROMETIDA
aa,me encontraba circulando colectora llegar cruce esquina encontraban gol trendominio ccg peugeot partner dominio ldx esperando para cruzar puente frenar camien patine pavenida mojado colisiona dos su parte trasera,COMPROMETIDA
aa,estaba manejando semaforo cambio rojo sr antonio gutierrez otro afectado freno yo tambien frene pero elauto deslizo poco colisiona trasera,COMPROMETIDA
aa,me encontraba estacionada calle bme mitre lujan bs as subo mi para regresar mi casa pongo marcha enciendo laas luces pongo ra miro hacia trasera venia nadie avenida aparece nada fiat punto uno patente pjco mi termina colisiona hacia otro velocidaque conductor venia sin permitirme verlo habiendo mirado hacia trasera antes avanzar,COMPROMETIDA
aa,me encontraba circulando calle independencia mientras estaba cruzando calle ituzaingo sr jose luis frias dni tel asegurado patronal cliente poliza intento cruzar vez yo ya habia iniciado cruce para seguir circulando calle independencia esta forma colisiona mi generando dano parte inferior derecha mismo sin mas lesiones tome sus datos segui mi recorrido,COMPROMETIDA
aa,estaba detenida primer semaforo ubicado bajada parana calle debenedettimi movio para delantera esto hizo toque estaba parada delantera,COMPROMETIDA
aa,dia miercoles mayo hs manana conducia avenida hipolito yrigoyen cuanto interseccion calle french localidade banfiel colisiona volkswagen savenida patente mbl color rojo conducida marchesse matias sebastian,COMPROMETIDA
aa,me encontraba circulando calle r wernicke llego esquina procedo aincorporarme avenida mayo me detengo arranco camioneta dobla avenida demayo hacia wernicke arrancar frena imprevistamente colisiona su parte trasera izquierda,COMPROMETIDA
aa,asegurado informa estaba saliendo marcha trasera gomeria direccion indicada camion estaba esperando laasegurado saliera pero como apuraba decidio dejarlo pasar intentar hacer eso colisiona estaba estacionado lacalle vereda enfrente,COMPROMETIDA
aa,cortes incorpora calle desde estacionamiento sin mirar izquierda colisiona su parte izquierda contra derecha tercero,COMPROMETIDA
aa,llegado hora siniestro parte mi domicilio avenida garcia para ingresar mi garage medetengo tercer carril mano ascendente direccion avenida ocamotiva detencion este lugar primer carril citada arteria encuantran estacionados contenedores derecha segundo carril diariamente practicamente todo horario forman largas filas aguardan paraingresar cargar combustible estacion servicio ypf operada club argentino esquina martingarcia montes oca aca barracas me obliga aguardar despeje acceso mi garaje generalmenteesta obstruidola detencion esta senalizada balizas intermitentes pie freno indica claramente me estoy moviendocuando finalmente consigo espacio para acce derecha inicio maniobra conocida como estacionamiento b,COMPROMETIDA
aa,calle acassuso san isidro hay garaje dejo habitualmente dia accidente estaba adentro garaje maniobrando marcha trasera para estacionar accidentalmente realizo mala maniobra colisiona parte trasera mi coche parte trasera derecha estaba estacionado justo derecha mio colisiona su parte izquierda altura parte izquierda parte trasera parte izquierda,COMPROMETIDA
aa,cc asegurado informa mientras encontraba circulando calle mencionada finalizando cruzar interseccion calle general rivas tercero colisiona parte delantera tercero parte trasera derecha asegurado hubo lesionados,CONCURRENTE
aa,transitando jose ingenieros encontraba detenido balizas lugar permitido estacionar intentar superarlo inicio marcha rozando parte derecha mi,COMPROMETIDA
aa,siendo aprox calle bayle entre pte peron fray lamas villa sarmiento colisiona trasera chery qq jiy chery venia circulando muy lentamente bayle querer pasarlo freno bruscamente presencia lomo burro toque su para colisiona cayo partio dos,COMPROMETIDA
aa,cc esposo asegurado indica estaba detenido calle cal derecha barca seguir paso estaba frente asegurado freno colisiona asegurado coaliciono ecosport bajarse mujer conducia ecosport dijo asegurado habia frenado colisiona ya uno semaforos titilaba pero segun asegurado esto era asi,COMPROMETIDA
aa,saliendo estacionamiento colisiona marcha trasera otro salia otro lugar mano enfrente colisiona parte izquierda,CONCURRENTE
aa,estaba saliendo estacionamiento haciendo marcha trasera colisiona para colisiona trasera parte delantera derecha rayones ambulancia,COMPROMETIDA
aa,circulaba avenida mencionada carril izquierda frente contra mano vino encima ambulancia dio ala fuga intentar esquivar colisiona venia circulando asegurado parte derecha,COMPROMETIDA
aa,mi honda city manejado andrea villar cruce calles carlos tejedor ruben dario topa fiat siena venia circulando mano izquierda ningun momento me vio yo venia calle carlos tejedor llegar esquina nos tocamos fiat siena tiene raspon pintura mi tiene danado para colisiona delantera parte izquierda,CONCURRENTE
aa,yo circulaba calle levensohn es paralela vias tren renault estaba estacionado doble fila puse luz giro para estacionar cordon izquierda esta permitidoporque vereda frente hay paradas colectivos hombre arranco me colisiona parte izquierda trasera raspo parte delantera derecha su rompio farolito posicion su,COMPROMETIDA
aa,denuncia asegurado venia pinar rio incorpora armada arg cba alta gracia para tomar rotonda ucc para hacerretorno cba espera pone guino deja pasar camioneta avenida hacia rotonda comienza sentir frenos ve su izquierda hondahaciendo maniobras para esquivarla ningun momento asegurado ve honda hasta ahi honda hace maniobras hasta cruzar decarril quedando hacia alta gracia colisiona trasera camion cotreco intenta esquivarlo vuelve quedar cruzado canterodel medio asegurado sigue circulando estaciona entrada ucc va ver como esta sr policia toma datos viene yla grua lleva honda,COMPROMETIDA
aa,transitando ruta mencionada imprevistamente quien iba delantera mio frana para pasar lomo burro me dio tiempo frenar embisto,COMPROMETIDA
aa,cc asegurado indica circulaba izquierda tercero colisiona parte trasera primera instancia posteriormente querer pasar carril asegurado parte delantera mismo,CONCURRENTE
aa,circulando avenida san martin taxi va delantera mi frena yo logro hacerlo colisiona asegurado parte delantera su parte trasera,COMPROMETIDA
aa,asegurado informa mientras encontraba realizando maniobras marcha trasera para salir lugar donde estaba estacionado ladireccion mencionada logra visualizar tercero colisiona parte trasera asegurado parte delantera izquierda tercero,CONCURRENTE
aa,cc hijo asegurado indica circulaba progreso doblar hacia izquierda colisiona circulaba zuviria,COMPROMETIDA
aa,asegurado informa mientras encontraba circulando calle mencionada llegar interseccion calle calabriaprocedio cruzar repente aparece tercero colisiona parte delantera asegurado parte izquierda trasera,COMPROMETIDA
aa,colisiona taxi estaba parado semaforo lamentablemente fallaron frenos,COMPROMETIDA
aa,saliendo salida shopping devoto estando yo mitade calle forfiesta continuo avenida rozando para colisiona delantera parte izquierda,COMPROMETIDA
aa,querer pasar encontraba delantera veo espejo ejecutar maniobra colisiona taxi parte derecha,COMPROMETIDA
aa,automobil tercero freno colisiona toque su para colisiona trasera ha producido ningun dano mi,COMPROMETIDA
aa,aparece conductor izquierda me colisiona parte izquierda,CONCURRENTE
aa,cc asegurado informa estaba detenido semaforo calle alberti comienza doblar izquierda cachabamba tercero colisiona parte trasera izquierda,COMPROMETIDA
aa,estacionando frente numero indicado mu colisiona lugar retrocedo para acercar mi corden veo otro esta ingresando lugar vacio trasera mio colisiona mi para colisiona trasera parte delantera,COMPROMETIDA
aa,dar marcha trasera colisiona tercero estaba estacionado trasera,COMPROMETIDA
aa,saliendo rotonda iba delantera freno colisiona frenar pero toque para colisiona danos leves pintura,COMPROMETIDA
aa,estando estacionada estaba delantera estaba retirando arrancar ese momento me cayeron lentes quise arrancar ya otro ocupo lugar fue cuestion segundos colisiona leve colisiona para colisiona trasera,COMPROMETIDA
aa,larga fila transito muy pesado avenida delantera freno medio colisiona yo frene tiempo fue colisiona suavenida tuve danos mi,COMPROMETIDA
aa,venia french dicha altura esquibe perro me lleve delantera citroen c habia nadie deje papel mis datos para comunique,COMPROMETIDA
aa,estaba circulando jean jaures direccion bartolome mitre mi objetivo era girar derecha para avenida rivadavenida tanto me pase carril derecha dicha calle vi tenia parte mio toquda parte izquierda parte delantera derecha mi,COMPROMETIDA
aa,salia hacia medio calle bergamini porque clio estaba estacionado frente mio sin querer colisiona punta para colisiona derecha faro trasera izquierda rompiendo plastico di colisiona farol,COMPROMETIDA
aa,saliendo marcha trasera estacionamiento estacion servicio ypf mientras doblaba hacia derecha vi habia otro autoestacionado trasera colisiona parte izquierda delantera contra para colisiona trasera parte derecha otro,COMPROMETIDA
aa,me encontraba circulando calle santo tome llegar interseccion emilo lamarca iba delantera mi trataba citroebn modelo c dominio mbv conducido marcela lopez titular dni nro freno para dejar pasar otro rodado circulaba interseccion antes mencionada pese frene colisiona di colisiona rodado su parte trasera parte derecha,COMPROMETIDA
aa,asegurado circulaba calle rodriguez calle estaba bastante congestionada enun momento circulaba delantera frena colisiona ocasiona asegurado deba frenar colisiona loma burro ocasiona asegurado colisiona contra delantera,COMPROMETIDA
aa,circulando calle colisiona desde trasera,COMPROMETIDA
aa,estaba circulando avenida scalabrini ortiz direccion oeste avenida cordoba cierto punto distraccion colisiona frente mio,COMPROMETIDA
aa,sali reversa girar roce launion delas dos puertas parte conductor,COMPROMETIDA
aa,accidente produjo estando detenido espera libere lugar mencionado estacionamiento inicie marchapara doblar hacia derecha aparcar espacio libre ese instante estaba estacionado fila cuparte asegurado parte izquierda comenzo su marcha para trasera e colisiona parte delantera izquierda mi,SIN RESPONSABILIDAD
aa,yo estaba circulando avenida libertador hacia capital fe derecha normalmente llego esquina san martin colisiona gol p estaba detenido semaforo,COMPROMETIDA
aa,maniobrar hidrogrua estacionamiento peaje colisiona parte delantera izquierda suran generando su abolladura,COMPROMETIDA
aa,asegurado declara venia circulando avenida inmigrantes interseccion donde rige giro u pasar laesquina pedro zany fuerza aerea incorpora sin prioridade paso cruzandose donde venia asegurado elasegurado logro evitar colisiona su parte delantera parte delantera derecha tercero volco elconductor fue trasladado centro asistencial fuerza aerea,COMPROMETIDA
aa,asegurado indica circulando calle indicada cruzar interseccion ya casi terminaba cruzarla desde su derecha ve llega frenar colisiona parte trasera derecha,CONCURRENTE
aa,frente quinta presidencial freno quise esquivarla colisiona trasera parte volante,COMPROMETIDA
aa,estaba saliendo marcha trasera garage vi habia trasera mio dane para colisiona luego querer volver punto partida me lleve delantera contramarco parte garage cual colisiona rompi parte derecha mi er,COMPROMETIDA
aa,asegurado circulaba calle avenida tercero colisiona contra parte trasera terceroer,COMPROMETIDA
aa,circulando calle salta altura cruce calle monsenor marconrealizo cruce correcto camino calle juan florio velocidade km hora meencuentro circulaba velocidamedia calle monsenor marcon endireccien calle villegas me pasa delantera cual presiono freno pero impideque colisiona mismo consecuencia dicha colisiona ocasiona roturade parte su parte frente mi para colisiona frontalcapot parrilla parte delantera eptica parte derecha cromados mismo dado seencontraba hdamedo asfalto consecuencia clima,COMPROMETIDA
aa,bajada puente cruza via rawson me detuve trasera taxi cuestion esperando abra semaforo debido descuido me zafo pie freno colisiona encontraba delantera,COMPROMETIDA
aa,circulaba calle alfredo lorenzo palacios me detengo trafico advertir dos mas delantera mio disponia salir su condicion estacionado coloco balizas aguardo inmovil lugar donde me detuve hasta salga para ocupar lugar liberado anterior mencionado respetando distancia dos ves este libera lugar inicio maniobra estacionamiento desplazandome hacia delantera balizas colocadas hasta ponerme par estacionado delantera lugar libre para delantera ingresar marcha trasera espacio libre ese transcurso trasera mio avenida hacia delantera produciendo colisiona inevitable parte izquierda delantera asegurado parte delantera derecha trasera,COMPROMETIDA
aa,asegurado indica circulaba calle febrero direccion hacia rio interseccion calle colonimpacta su parte delantera parte trasera tercero gol tren circulaba calle colon izquierda derecha ambulancia ya pasajero tercero eencontraba lesionada cual indicaron encontraba estado deshock tenia lesiones graves,CONCURRENTE
aa,realizando maniobra estacionamiento pude evitar rozar seencontraba estacionado delantera mio,COMPROMETIDA
aa,ccasegurado indica conductora circulaba calle colisiona visualizodescripcien terceroestacionado mano izquierda calle otro colisiona desconoce motivo colisiona parte trasera derecha arrojandolo contra columnad,COMPROMETIDA
aa,taxi encontraba detenido semaforo asegurado frena pero logra evitar colisiona levemente taxi,COMPROMETIDA
aa,circulaba ruta hacia san miguel camien venia delantera freno yo vi pego volantaso efecto resbaladizo calle colisiona parte izquierda para colisiona trasera camien danando eptica capot parte astillando parabrisas,COMPROMETIDA
aa,cc asegurado indica encontraba circulando calle indicada encontraba detendio semaforo acelerar semaforo abre colisiona espejo retrovisor encontraba su derecha,COMPROMETIDA
aa,abierto pedido legales me,COMPROMETIDA
aa,circulando mitre hacia general san martin asegurado parte derecha aparece general san martin mano izquierda frenar es embesti,COMPROMETIDA
aa,reanudar transito encontraba detenido adverti me derecha encontraba otro reanudando su marcha cual colisiona para colisiona delantera su parte rosadando todo parte derecha mi,COMPROMETIDA
aa,iba yendo trelles llegar galicia me cruzo chevrolet spin colisiona parte delantera izquierda tambien su parte delantera izquierda,COMPROMETIDA
aa,circulaba calle galicia intereseccion hidalgo esa altura calle es mano contramano colisiona venia izquierda,COMPROMETIDA
aa,venian dos autos delantera mio calle cual venia velocidaa mas kmh cruce calle espana estaba primero avenida pasando esquina frena inesperadamente como consecuencia encontraba delantera mi tambien frena centimetro colisiona delantera suyo yo termino colisiona primer siguio su camino ya fue colisiona mas alla estar velocidaprudente distancia amago avenida frenar inesperadamente fue suficiente para evitar impacto,COMPROMETIDA
aa,circlaba mi avenida juan b alberdi sentido provincia implicado detuvo su marcha bruscamente haciendo colisiona trasera,COMPROMETIDA
aa,denuncia asegurado indica circulando calle rio negro ante frenada repentina transito colisiona sector trasera tenia delantera conductor acuso dia siguiente dolencia cuello,COMPROMETIDA
aa,me dirigia capital hacia provincia general paz hacia sur mano izquierda kmh cruzar puente noria curva chevrolet cruze blanco patente lgj cambia abruptamente carril realizando maniobra agresiva sin percatar tenia delantera estaba frenando esto ocasiona chevrolet frene subitamente obligando viajaba delantera mi polo azul patente ggi frene repentinamente genera colisiona severamente contra parte trasera chevrolet trasera viajaba yo fiat stilo azul patente gfz viendo sucedio autos antes mencionados atine frenar mi e intente correrme hacia izquierda para evitar colisiona cosa desafortunadamente pude concretar porque colisiona parte trasera izquierda he rozado contra guardrail parte izquierda mi,COMPROMETIDA
aa,siendo aproximandamente hs me diriji salir estacionamiento viendo habia duna color blanco patente cjiparado esperando semaforo estaba rojo comienzo marcha trasera sacar mi sin previo avenida duna retrocedioimpactando su para colisiona contra parte trasera izquierda mi produciendo rotura abolladura salida pintura sector seriala chapa esta parte arriba rueda para colisiona trasera persona conducia duna dice retrocedio sin mirarpor espejos porque podia ver semaforo claridad,CONCURRENTE
aa,circulando avenida uruguay sentido quimes en parte izquierda calle pedro elustondo cruzo colisiona asegurado parte parte rueda trasera parte izquierda,DISCUTIDA
aa,doble izquierda me choco,COMPROMETIDA
aa,circulaba formodeo carril externo rotonda encuentra corredor bancalari justo frente laguardia barrio privado santa barbara dirige hacia entrada barrio tambien circulaba rotonda carrilinterno colisiona provocando rayon parte trasera guarda barros trasera conductor otro tiene raspon elparte para colisiona acompanante,CONCURRENTE
aa,circulaba gismundi peugeot circulaba modarelli me colisiona parte izquierda raiz colisiona mi desplaze subie vereda colisiona contra arbol finalize estancado zanja dejo claro yo tenia derecha,DISCUTIDA
aa,yo asegurado conducia calle san lorenzo cruzar calle amancio alcorta colisiona chevrolet prisma celeste su parte trasera izquierda,COMPROMETIDA
aa,avenida camino bancalari mi llegar cruce ruta colisiona contra renault venia ruta asegurado parte izquierda,COMPROMETIDA
aa,conduciendo yo aprox kmh carril izquierda avenida derecha encontraba ocupado autos estacionados aunque deberia ya cordon es amarillo colectivo desplazaba practicamente medio ambulancia carriles inclina hacia izquierda citroen c gris teniendo espacio para seguir marcha asustapatente ixj cual fue sin querer dar datos frena colisiona proximo renault sedan patente vye ve obligado frenar cual ocurre accidente concurrente ese motivo yo freno pero tiempo fue suficiente ocurre colision,COMPROMETIDA
aa,circula sarcione llegar calle o colisiona veo todo inundado imposible atravenida me asuste dado zona desconocia doy marcha trasera e colisiona camioneta,COMPROMETIDA
aa,cc conductor indica circulando calle junin taxi delantera asegurado detiene baja velocidaya recien habia iniciado verde semaforo asegurado logra frenar colisiona sector trasera,COMPROMETIDA
