cod_accidente,descripcion,responsabilidad
aa,asegurado indica ciculaba calle indicada asegurado colisiona levemente tercero estaba delantera ya ponerse luz verde mismo acelero,COMPROMETIDA
aa,delantera frena bruscamente razon aparente ya habia transito conductora declara trabo caja freno colisiona cliente indica sufrio colisiona su cuerpo parecen gravenida pero esta observacion su colisiona asegurado circulando panamericana velocidanormal observa repente tercera frena asegurado llega frenar termina colisiona tercera momento tercera manifesto habia trabado caja cambio ello detuvodescripcien tercero luego ingresar acceso norte ramal tigre subida uruguay direccion hacia caba me detuvo accidentalmente ya estaba retomando marcha me colisiona parte trasera,COMPROMETIDA
aa,yendo sentido sur norte general urquiza parando semdoro estando trasera dos autos intersepsion calle cavenida habre semdoro verde moviendo autos delantera forma lenta me abro poquito para ver pasaba me colisiona violentamente parte izquierda delantera terminando otra persona vereda general urquiza parando metros esquina,COMPROMETIDA
aa,contacta asegurado e informa encontraba circulando calle piovano circulaba calle su derecha quiere ingresar paso nivel hay zona e colisiona asegurado parte derecha hubo lesionados,COMPROMETIDA
aa,asegurado indica encontraba cruzar bocacalle tercero colisiona parte trasera asegurado,SIN RESPONSABILIDAD
aa,conducia carril izquierda avenida cantilo direccion zona norte oportunidaen iba delantera mio volkswagen vento freno abruptamente llegue detener mi colisiona contra volkswagen generando colisiona para colisiona trasera ese para colisiona capot delantera mio suvez darse aquel colisiona volkwagen colisiona tenia delantera peugeot,COMPROMETIDA
aa,circulaba calle mexico direccicbn avenida julio circulaba delantera mio freno yo venia trasera alcance frenar colisiona levemente mi para colisiona delantera capot su rueda trasera exterior portcbn causandole muy leve dano,COMPROMETIDA
aa,yo circulaba guatemala otro venia humbolt colisiona mi para colisiona delantera guarbarro trasera izquierda,COMPROMETIDA
aa,version asegurado indica su marido estaba conduciendo encontraba su parte momento conduciendo avenida indicada colisiona otro encontraba su parte taxi asegurado recuerda quien encierra quien para provocar este roce ampliacion asegurado como dos corren mismo tiempo taxi venia su izquierda colectivo encontraba su derecha empezo encerrarla hacia izquierda tiro colectivo fureron moviendo hacia izquierda ahi produjo toque taxi venia pasjero fue penas raspon sin intervencion fuerzas seguridaddmt parte izquierda delantera puertadmt ro medio parte derecha,COMPROMETIDA
aa,me encontraba detenida semaforo intersecciben mencionada semdoro cambia verde comienzo marcha pero delantera mio comienza su marcha produce leve colisiona su parte trasera,COMPROMETIDA
aa,circulaba paraguay delantera frenbe e intentda esquivarlo e colisiona tenia derecha,COMPROMETIDA
aa,esposo asegurado informa doblar tenia perro asiento trasera cual quiso saltar ventana nuestro asegurado para evitar esto agarro perro esa maniobra colisiona tercero encontraba estacionado mano izquierda arriba vereda,COMPROMETIDA
aa,asegurado encontraba estacionado parte calle cuandopor algun motivo debido pendiente fue para trasera cruzando lacalle e colisiona chevrolet cruze pat ozen su parte para colisiona er,COMPROMETIDA
aa,asegurado quiere dejar asentado circulaba calle bolabos cruza calle salta es doble mano cruzar esta misma fiat palio circulaba calle salta colisiona asegurado su parte delantera ambulancia tuvieron danos parte delantera,COMPROMETIDA
aa,asegurado informa su hijo estaba frenado esquina calle mencionada hizo marcha trasera para dejar pasar pasaba esta maniobra colisiona tercero ubicaba trasera nuestro asegurado sin luces encendias descripcien tercero circulaba calle juncal esperando semaforo cambie verde circulaba delantera comienza realizar maniobra estacionamiento hacia trasera embiste,COMPROMETIDA
aa,dia estacionamiento azcuenaga marcelo t alvear roce forfiesta parte trasera este colisiona raspon parte trasera mi,COMPROMETIDA
aa,esposo asegurado circulaba ricardo balbin gira izquierda ingresando rotonda pone giro derecha para ingresar terraza tercero colisiona nuestro asegurado,COMPROMETIDA
aa,circulaba calle llego interseccion calle cruzo misma me colisiona parte trasera derecha,CONCURRENTE
aa,estabamos frenados semaforo dio verde empezo avenida fila autos hasta momento hizo maniobra brusca donde me obligo frenar tenia frente mi me fue pie colisiona ocurriendo ahi impacto,COMPROMETIDA
aa,estar parado subida querer colocar ra marcha vino trasera colisiona despacito coche trasera nuestro sufrio danos,COMPROMETIDA
aa,asegurado circulaba calle arenales esquivar camion sin darse cuenta colisiona tercero parte trasera izquierda este estaba parado,COMPROMETIDA
aa,version asegurado yo circulaba sarmiento hacia avenida libertador persona circulaba balcarce doblo curva abierta yo trate ir asegurado parte izquierda mas pude ampliacion asegurado tercera venia balcarce dobla hacia calle sarmiento dio radio giro muy amplio ahi es donde colisiona asegurado parte delantera derecha hacia delantera para colisiona incluido tercera colisiona ucirculaba calle balcarce llegar interseccion calle sarmiento tenia intencion doblar hacia calle sarmiento para ir hacia avenida libertador,CONCURRENTE
aa,asegurado indica dar marcha atr para otro estacione colisiona encontraba trasera,COMPROMETIDA
aa,nuestro colisiona volkswagen error calculo lugar disponible para pasar,COMPROMETIDA
aa,dice cruzo alguien freno colisiona recien habiamos arrancado porque habia mucha cola me dio tiempo nada frene pero igual colisiona danos parrilla capot optica para colisiona danos verificar,COMPROMETIDA
aa,salgo mi domicilio marcha trasera e colisiona estacionado su parte trasera derecha,COMPROMETIDA
aa,voy circulando alguien me cruza colisiona parte trasera derecha,CONCURRENTE
aa,yo iba circulando velocidareglamentaria calle laprida direccion sur llegar interseccion calle rueda produce colisiona entre mi rodado moto circulaba esta ultima arteria intentar frenar moto cae piso desliza hacia mi rodado colisiona para colisiona contactamos asegurado sr castellano ciarroca davenida formalizo su productor falcone entregandole toda documentacion fotos rodado reparte circulaba calle laprida norte sur llegar interseccion calle rueda aparece esta ultima moto este oeste asegurado pesar frenar termina colisiona aclara asegurado tercero tambien frena cae es asi como terminan colisiona tercero sufre colisiona fuerte costillas clavenida asegurado llamo policia ambulancia traslado tercero pero sabe donde asegurado fue trasladado comisaria hicieron ningun tipo analisis asegurado iba solo ha recibido llamado abogado alguno hasta fechadtx va reclamar,CONCURRENTE
aa,camino ruta ya venia siendo trafico llegar puente une panamericana general paz estaba unos metros mios decide cambiarse bruscamente carril esto ocasiona freno segundo estaba delantera mio consiguiente estaba frente mi persona tambidan frena bruscamente dando lugar quemi tiempo reaccion sea suficiente para evitar colisiona mismo dado colisiona mi sufre dano parte delantera tanto capot como vidrios luces,COMPROMETIDA
aa,circulando septicolisiona sentido lanus trasera otros autos pronto di colisiona otros conductores circulaba direccion contraria septicolisiona gira su izquierda contramano calle murature provocando frenada autos delantera mio sin darme tiempo reaccion me colisiona delantera mio,COMPROMETIDA
aa,asegurado indica conducia roca colisiona parte delantera trasera derecha tercero,COMPROMETIDA
aa,iba colectora panamericana alrededor salida fondo legua mientras veia tenia paso me solto pie freno como esta bajada apenas toque delantera frenamos para tomar datos verdaq apenas tuvo toquecuto q desencastro pieza,COMPROMETIDA
aa,version asegurado hijo asegurado indica saliendo trabajo desviandose poco carril colisiona encontraba delantera amplaicion denuncia siniestro fue polvorines sali dle trabajo encare para bella vista cuadno volvia para su domicilio granbourg ruta dobla derecha calle julio tercero iba julio sentido ruta pierde concentracion cambia carril sin querer eso tercero nlo habria observado e intenta esquivarlo igualmente asegurado raspa parte trasera izquierda hasta punta trasera tercero parte delantera izquierda hubo lesionesno conocen,COMPROMETIDA
aa,dia hs aproximadamente teniendo mi estacionado enel estacionamiento shoping alto avenida hice marcha trasera colisiona alauto cuyos datos constan presente paso muy cerca mio me dio tiempoa frenarmi sufrio roce para colisiona trasera mientras colisiona otroautomovil tuvo raspon para colisiona delantera parte derecha parte derecha,COMPROMETIDA
aa,asegurado indica realizaba maniobras para salir estacionamiento cual encontraba su tercero fiat paliot estaciono trasera donde estaba saliendo mientras trataba retirarse produce colisiona lesione,COMPROMETIDA
aa,asegurado encontraba detenido semaforo avenida libertador cambiar verde delantera asegurado comienzan avenida salvo tercero encontraba justo delantera asegurado avenida creyendo tercero iba arrancar hacerlo colisiona parte trasera,COMPROMETIDA
aa,habiendo salido estacionamiento mi casa zabala voy cruzar calle ciudade paz semdoro mi favenida luz verde taxi estaba mal estacionado ochavenida me colisiona delantera guarda barro parte izquierda conductor taxi indica me vio cruzar me colisiona su delantera danando para colisiona parte optica,SIN RESPONSABILIDAD
aa,estacionada calle calasanz mano derecha maniobrar para salir apurada porque venia colectivo calculo mal colisiona estaba delantera fiesta color gris estaba estacionado asi deje papel mis datos para me llame me llamaron pase mis datos su vez tome autodescripcien terceroal regresar mi hs encuentro danos para colisiona trasera externo izquierda ojo gato quebrado raspones otros danos verificar,COMPROMETIDA
aa,contacta hijo asegurado e informa encontraba realizando maniobra estacionamiento club san carlos realizar marcha trasera colisiona encontraba estacionado,COMPROMETIDA
aa,asegurado indica circulando calle mencionada bajo lluvia llegar semaforo presiona freno pero debido condiciones climaticas patina e colisiona tercero parte trasera,COMPROMETIDA
aa,finalizar remal tigre panamericana doblar para tomar avenida marquez rozo nissan sentra,COMPROMETIDA
aa,saliendo marcha trasera garage apenas colisiona asfalto veo venia rapido gol trenfrene mismo freno colisiona conmigo,COMPROMETIDA
aa,mi encontraba estacionado calle comenzar hacermaniobras para circular circulaba esta calle me colisiona parte izquierda su parte delantera derecha,COMPROMETIDA
aa,version asegurado indica circulaba calle mencionada cruza interseccion entre rios llega mitade cruce venia su mano derecha colisiona parte derecha segun reparte asegurado tercera indico resbalo comando llego frenar sin lesiones ampliacion asegurado confirma denuncia esta realizando reclamo fe derecha patronal seguros dmt parte delantera derecha,CONCURRENTE
aa,sali marcha trasera mi domicilio esperando me transito detenga para bajar calle pasa engancha parte trasera mi su parte delantera derecha,COMPROMETIDA
aa,lluvia circulando muy despacio transito muy tupido otro delantera mio estado tiempo llegue frenar,COMPROMETIDA
aa,version denuncia para colisiona delantera capot ambulancia parte frente ampliacion asegurado segundo fernandez avenida beccar lugar denuciado es domicilio asegurado dnicirculaba segundo fernandez desde int tomkinson hacia marquez repente tercero colisiona parte delantera derecha dos autos salieron funcionando luego cruzar datossin lesiones momento siniestro hubo intervencion ambulancia policia bomberosdmt para colisiona delantera capot ambulancia parte frente,SIN RESPONSABILIDAD
aa,efectuando maniobra estacionamiento marcha trasera observo presencia encontraba detenido paralelo mio colisiona su parte trasera,COMPROMETIDA
aa,circulaba cammado lentamente e ingreso acceso entrada saloda supermercado eco otra unidasalia super colisiona su parte izquierda,CONCURRENTE
aa,salia marcha trasera garaje mi domicilio efecto inclinacion rampa salida desliza hacia calle bajar cordon vereda colisiona parte delantera derecha venia circulando luis maria saavenida ocasionandole danos para colisiona optica parte delantera derecha afectando parte trasera porton baul mi,COMPROMETIDA
aa,estando detenido semaforoaguardando me habilite continuaryo detenido rn esquina derecha habilita semaforo verde para continuar arranco forpasa rojo colisiona mi am,CONCURRENTE
aa,asegurado circulaba general paz tercero encontraba delantera frena repentinamente asegurado llega frenar colisiona trasera,COMPROMETIDA
aa,version asegurado sale marcha trasera garage incorpora calzada ya incorporado inicia su marcha pocos metros es colisiona unidadel tercero circulaba calle ampliacion asegurado aclara luego perfilar su hacia sentido calle pone primera pone empezar circular calle ese momento exacto tercero esquiva esa maniobra colisiona su parte trasera izquierda,COMPROMETIDA
aa,luego dejar mi hija colegio cercano volver ingreso dar marcha trasera ya otro encontraba delantera siento colisiona contra algo bajar encontraba camioneta cual pude ver ya luneta mi encuentra astillada debido dias trasera encontre dadada cuestiones desconosco observe camioneta volkswagen savenida cual parecer encontraba capot danado para colisiona partido optica derecha danada igual observe rompe nieblas luego corri mi observe para colisiona trasera suelto pintura saltada,COMPROMETIDA
aa,esposo asegurado circulaba autopista mencionada carril izquierda como tenia ingresar bajada para ingresar tigre cambio carril hacia derecha para po derecha acce derecha este ultimo circulaba camioneta cargada ma derecha baja velocidaa asegurado intento frenar pero llego e colisiona su parte delantera parte trasera tercero,COMPROMETIDA
aa,circulando simbron esquina cruza cual colisiona parte trasera izquierda mismo descripcien tercero asegurado circulando avenida segurola llegar interseccion simbron asegurado cruza mismo tiempo tercero quecirculaba simbron colisiona parte trasera izquierda parte delantera tercero sin lesionados sin desplazamientos,COMPROMETIDA
aa,tercero ingresa rotonda colisiona parte trasera su,COMPROMETIDA
aa,asegurado circulando avenida c larralde ingresar rotonda ruta colisiona parte delantera parte trasera tercero frena repentinamente delantera sin lesiones,COMPROMETIDA
aa,circulando sto domingo repente interseccion v sarsfielviene esta bltima spin negro freno pero igualmente rozo asegurado parte delantera parte derecha trasera dase tercero circulaba velez sarfiely cruzar santo domingo es colisiona desde derecha parte trasera tercero circulaba esta ultimad,CONCURRENTE
aa,conductor manifiesta circular avenida corrientes altura shopping abasto encierra moto debido esto volantea colisiona tercero provocandole danos punta trasera derecha,COMPROMETIDA
aa,estacionamiento museo ferroviario retiro mi colisiona parte trasera otro,COMPROMETIDA
aa,asegurado estaba detenido calle heredia cambiar luz semaforo verde avenida para girar avenida yrygoyen hacia lanus par dos imprevistamente chevrolet corsa circulaba yrygoyen me colisiona asegurado parte delantera derecha,DISCUTIDA
aa,venia circulando billinghurst taxi venia delantera mio frencb colisiona asegurado parte delantera,COMPROMETIDA
aa,asegurado circulaba calle acuna figueroa tercero venia delantera frena colisiona alcanza frenar colisiona su parte trasera raiz esto atr colisiona asegurado parte trasera da fuga antes pueda solicitarle datos descripcien tercero me dirigia calle olaya direccion avenida diaz velez cruzar mas mitade interseccion calles olaya apolinario figueroa junto otros ya venian apolinario figueroa estaban detenidos honda mencionado anteriormente me colisiona,COMPROMETIDA
aa,asegurado encontraba estacionada calle mencionada comienza realizar marcha trasera previamente verificando trasera halle ningun obstaculo ya estaba retrocediendo taxi detiene directamentedetras produce colisiona entre ambulancia,COMPROMETIDA
aa,atento he colisiona ocurridos domingo madrugada am aproximadamente color negro marca alfa romeo modelo giulietta distinctive patente mxy avenida cabildo direcciben hacia general paz yo iba carril derecha prbeximamente doblar me pone par me tira encima maniobra brusca consiguiente colisiona me colisiona parte ocasionando dabos parte rayones ybollo parte,DISCUTIDA
aa,transitando avenida eva peron direccicbn gonzalez catun me dicuenta pesar semaforo estaba verde me encontraba carril para doblar izquierda pense estaba delantera mio iba avenida pero estaba esperando para cruzar asegurado parte delantera,COMPROMETIDA
aa,estaba estacionado u calle mencionada salgo marcha trasera colisiona taxi habia detenido trasera mio para dejar pasajero ocasionandole danos parte derecha,COMPROMETIDA
aa,circulando muy baja velocida kmh aproxpor asuncion llegar interseccion chivilcoy para iniciar cruceel otro taxique venia circulando chivilcoy en parte izquierda cruza delantera rozando parte delantera mi frenando aprox mts chivilcoy,CONCURRENTE
aa,version asegurado maniobra para colisiona frente colisiona estaba delantera derecha version tercero circulaba ruta dos cuadras general paz venia derecha porque iba girar derecha repente siente colisiona trasera,COMPROMETIDA
aa,esposo asegurado estaba estacionado derecha balizapuesta momento incorporarse calle taxi dobla derecha paraincorporarse calle ja cabrera produce colisiona asegurado,COMPROMETIDA
aa,asegurado estaba saliendo estaciben servicio dar marcha trasera colisiona tercero,COMPROMETIDA
aa,asegurado indica circulando calle mencionada tercero circulaba delantera detiene asegurado hace tiempo frenar colisiona parte trasera,COMPROMETIDA
aa,asegurado circulaba calle balvin cruza interseccion tronador tercero cruzaba su mano derecha donde hay semaforo procede colisiona asegurado parte derecha produciendo danos varios indicados siniestrosin lesiones intervino policia yo ambulancia ampliacion asegurado circulaba balbin parte puente llegando interseccion tronador inicia cruce repente aparece tercera esta ultima desde derecha asegurado tercera llega frenar colisiona p derecha para colisiona trasera asegurado calle tronador corta interseccion asegurado reclamando franquicia,DISCUTIDA
aa,estando detenida unos minutos calle heras atasco transito consuctor delantera decide parar justo arranca transito para su hija descienda como todos ponian movimiento arranque,COMPROMETIDA
aa,fue interseccion calles tarija castro barros yo venia tarija es decir derecha castro barros colisiona interseccion conductor venia rapido porque vi yo venia distraida,COMPROMETIDA
aa,version asegurado despues doblar derecha semaforo benito linch larralde soy colisiona forfiesta color rojo parte izquierda espejo retrovisor patente aa rw ampliacion asegurado indica doblaba hacia sentido centro pacheco informa doblaba luz verde trasera suyo venia seguia indica tercera paso rojono hubo lesionados bomberos ambulancia,CONCURRENTE
aa,version asegurado circulando calle rojas soy colisiona parte izquierda colisiona hacia derecha ampliacion asegurado conasegurado colisiona asegurado veni circulando calle rojas repente sr barral empeiza apretar hacia derecha empujamdolocolisiona ello colisiona estacionado margen derecha estacionado me mandara datos email junto fotos danos version tercero sr barral telefonico circulaban ambulancia calle rojas caba calle rojas tiene carriles carril derecha suelen haber estacionados tercero circulaba carril izquierda asi cosas circulaba delantera tercero frena pone balizas tener esta situacion tercero pone luz giro hacia su derecha para po derecha rodear di colisiona rodado proseguir su marcha mientras realizba misma aparecio asegurado tercero dice asegurado colisiona su punta izquierda delantera todo su parte derecha indica luego di colisiona asegurado colisiona otro encontraba estacionado derecha reclamo seguros sa su letradodmt dos puertas parte trasera derecha asegurado primero colisiona puertasotro tiene datos mas marca modelo suziki fun sin lesionados,DISCUTIDA
aa,asegurado indica encontraba estacionado calle indicada delantera tercero colisiona contra parte tercero,COMPROMETIDA
aa,asegurado indica estaba realizando maniobras para salir donde encontraba estacionada mientras tercero circulaba misma mano pasa calle mencionada asegurado toca parte trasera derecha sin lesiones descripcien tercero me encontraba circulando repente tercero sale estar estacionado me colisiona asegurado parte trasera derecha su parte delantera izquierda,COMPROMETIDA
aa,estando trdico frenado ramal tigre altura avenida hacia tigre arranco primera e colisiona estabadetenido delantera,COMPROMETIDA
aa,estaba estacionando colisiona estacionado parte derecha mail josegarciaschhotmailcom,COMPROMETIDA
aa,dul palio iba delantera mi frena yo tambien freno pero desliza causa pavenida estaba mojado produce asegurado parte delantera,COMPROMETIDA
aa,asegurado circulaba callao desde cordoba hacia paraguayocupado conductor acompanante tercero circulaba porcallao desde cordoba hacia paraguay delantera ocupado elconductor acompanante llegar esquina callao paraguay frena colisiona transito siendo colisiona huboambulancia intervencion policial,COMPROMETIDA
aa,venia avenida pueyrredon frene semaforo mitade cuadra arranco fila frenaron colisiona semaforo siguiente esquina colisiona camiben estaba delantera mio,COMPROMETIDA
aa,yo venia conduciendo despacio remedios escalada me vino encima entro artigas logre torcer volante hacia derecha logrando desviar mi evitando me colisiona medio asi me salve colisiona mu colisiona mas fuerte directo mi estaba cinturon puesto evite yo me fuera hacia delantera colisiona fue importante,COMPROMETIDA
aa,circunstancia transito di marcha trasera para evitar colisiona frente sin advertir otro citroen c lounge aann transitaba trasera muy cerca cual mi colisiona mismo su parte delantera forma leve observandose dabos carroceria para colisiona delantera solo ligero doblez chapa patente mi sufrio dabos menores para colisiona trasera escasa significacion intercambiamos info polizas entre ambulancia conductores,COMPROMETIDA
aa,version asegurado indica circulaba calle indicada moto hace mala maniobra encierra asegurado tanto para evitar ese colisiona volanteo su volco hacia derecha colisiona lleno estaba estacionado fuerza colisiona sale despedido hacia izquierda termina quedando parte izquierda calle mismo tuvo ser transladado grua taller confianza amplaicion asegurado fue manana venia casa novio venia manejando parte izquierda moto cruza delantera derecha izquierda volantea para derecha para esquivar moto colisiona estacionado luiego colisiona siente rompe algo perdio control eso lugo colisiona sale disparado fuera control hacia izquierda nunca volcodel parte izquierda colisiona ningun sube vereda frena antes colisiona inmuebleno hubo intervencion policia ambulancia bomberos aparecieron duenos nos intercambiamos datos pedimos grua llevaron asegurado ingirio alcohol,COMPROMETIDA
aa,sacando estacionamiento colisiona parte parte generando ruptura soporte parte,COMPROMETIDA
aa,iba calle uriarte carril estaba bloqueado otro estacionado asi esquive cambiando carril sin visualizar trasera mio venia mismo tuvo realizar frenada aludiendo ese momento coalisiono mi,COMPROMETIDA
aa,inicio marcha mi estacionado parte mi casa colisiona acerca velocidapor araujo parte delantera mi raspon pintura parte derecha otro raspon pintura,COMPROMETIDA
aa,saliendo cochera mi casa hice marcha trasera mi para colisiona tercero parte derecha trasera encontraba trasera mio ubicacion perpendicular,COMPROMETIDA
aa,suran patente nyn circula general rodriguez llegar interseccion f ameghino disminuye velocidaobserva dispone comenzar pasar repente cruza sin mirar sus costados alta velocidael gol patente pke ante esta situacion alcanza frenar colisiona su parte delantera su parte izquierda trasera conductor quedca muy nervioso preocuopado disculpca varias veces nuestro asegurado,COMPROMETIDA
aa,asegurado indica encontraba doblando hacia derecha otro venia en parte izquierda encerro ocasionando asegurado parte delantera,DISCUTIDA
aa,esposa segurado indica mientras circulaba calle charcas interseccion su mano izquierda aparece tercero julian serrano procede frenar para colisiona sin colisiona logra evitar colisiona parte trasera trataba realizaba tareas remis hubo lesiones intervino policia yo ambulancia,CONCURRENTE
aa,version denuncia prioridade paso descenso puente ampliaicon asegurado venia bajando puente hacia parte sur semaforo funcionaba amarillo titilante llega esquina colectora carril izquierda colectera me da paso porque queria subir puente doblar hacia izquierda carril derecha sigue su camino colisiona parte izquierda trasera altura rueda tercero seguia colectora asegurado ra legar segurossin lesiones sin intervencion policia ambulancia etc,COMPROMETIDA
aa,llegue frenar semaforo donde habian autos parados me lleve puesto delantera colisiona parte trasera delantera mi descripcien tercero detenida semaforo es colisiona su parte trasera parte delantera tercero frena desplaza colisiona otro circulaba delantera retira sin aportar datos,COMPROMETIDA
aa,terminaba estacionar bajar abrir parte colisiona misma,COMPROMETIDA
aa,asegurado indica circulando calle mencionada llegar interseccion colisiona tercero circulaba carlos pellegrini,COMPROMETIDA
aa,estaba saliendo colectora general paz antes llegar avenida san martin tenia dejar unas personas parada todos ocupantes nos corroboramos viniera ningun guno derecha me tiro hacia parada repente cruza venia alta velociday colisiona parte trasera parte izquierda,COMPROMETIDA
