cod_accidente,descripcion,responsabilidad
aci,asegurado circulando calle monroe llegar interseccion calle videla da paso avenida colisiona su parte delantera derecha rueda trasera tercero circulaba bici ocupante sin casco colocado caeno manifesto lesiones retiro sus propios medios sin intervencion ambulancia ni policia sin desplazamientos asegurado formalizo san justo bicicleta circulaba en parte izquierda asegurado no vio asegurado freno otro cede paso comienza cruzar termina colisiona bicicleta circulaba detrcs solo tiene pequeno rayon debajo optica parte derecha asegurado formalizo san justo biciclet acirculaba en parte izquierda asegurado no vio asegurado freno otro cede paso comienza cruzar termina colisiona bicicleta circulaba detrcs solo tiene pequeno rayon debajo optica parte derecha,CONCURRENTE
aci,asegurado iba circulando potosi llegar domicilio maniobra para trasera colisiona bicicleta menor anos ciclista cayo piso asegurado llevo centro atencion upa lanus para seguridale recomendaron llevar evita para sacar placa no intervino policia ni ambulancia asegurado formalizo lomas zamora dio marcha trasera menor estaba trasera asegurado es hombre muy mayor acompan menor su casa luego fueron hospital junto acompan tres lugares distintos porque no haba traumatlogo finalmente dej hospital evita fue supo no lleg ser fractura quedo pasarnos te madre menor,COMPROMETIDA
aci,mecanica hecho s vs asegurado estacionado mano izquierda tercerobicicleta circulando misma calle asegurado indica bicicleta esta pasando entre detenidos semaforoabre parte delantera derecha esposa colisiona bicicletaes persona conduce bicicletalleva cascocae pavenida codo dolor pierna derecha levanta interviene policia ambulancia same llevaban hospital duran asegurado formalizo cia ratifica mecanica hecho estaciono para su esposa baje abrir parte ciclista colisiona misma asegurado llamo ambulancia tercero no tena lesiones visibles dieron alta enseguida segdan supo dice policia pidi datos no traslano hicieron alcoholemia quedo pasar mayores datos tercero d,COMPROMETIDA
aci,asegurado detenido balizas avenida mayo bajar acompanante es colisiona parte delantera derecha bicicleta circulaba detrasun ocupante cae solo bicicleta ocupante no lastimo cara sin desplazamientos no intervino policia ni ambulancia lugar asegurado ofrece ayuda ciclista ampliamos v asegurado es quien abrio parte derecha movil estaban detenidos porque tena bajar estaban mas o menos medio metro cordn reconoce ese lugar no puede estacionar bicicleta paso entre cordn ah colisiona parte bicicleta fue hacia vereda tercero tena sangre cara esposa asegurado quiso acompanante clinica quedaba ah nomas donde ocurri hecho consulta pag asegurado pidi llamara madre buscarlo doctora dijo era corte leve era profundo para cocer como dijeron eso insisti viniera madre decidiera hacer no vio danos bicicleta llegaron padres guardaron bicicleta fueron otro hospital donde pudiera realizar sutura cirujano sabe dieron par puntos cara vacuna antitetcnicano participo policia ni ambulancia,COMPROMETIDA
aci,da alrededor pm asegurado conduca calle azcuenaga direccin calle querer doblar derecha encierra bicicleta circulaba azcuenaga misma direccin tercero cae bicicleta asegurado ofrece asistencia para sea revisado pero mismo rechaza atencin pasan datos vehculo retira lugard,COMPROMETIDA
aci,asegurado encontraba circulando general jose g artigas girar avenida dr juan bautista justo para ingresar estacion servicio bicicleta venia esta ultima colisiona contra mi asegurado presenta danos parte delantera derecha conductora bicicleta cae capot asegurado esta traslada centro medico tiene colisiona cabeza sin intervencion ambulancia policia,COMPROMETIDA
aci,asegurado estacionado abrir parte izquierda colisiona esta ante bicicleta circulaba alli sin desplazamientos ni lesionados bici persona sin casco levanta retira sus medios no interviene policia ni ambulancia contactamos asegurado ratific mecccani formalizo denuncia agencia san justo manifiesta tercero retir rapidamente lugar sus propios medios sabe colisiona pero no mucho mas manifestaba dolor pierna hombro quedo pasarnos mas datos para poder contactarlo no participo policia ni ambulancia,COMPROMETIDA
aci,asegurado circulando esquina calle vergara cruza bicicleta colisiona parte delantera rueda delantera tercero no presento lesiones aparentes manifesto dolencia pierna derecha sin intervencion ambulancia interv policia sin desplazamientos,COMPROMETIDA
aci,bajando mi vehculo parte abierta bicicleta colisiona mi parte delantera izquierda intervinieron polica ambulancia,COMPROMETIDA
aci,asegurado circulando uriarte girar izquierda loyola fue colisiona parte delantera tercero circulaba bicisenda en parte izquierda asegurado sentido contrario calle loyola bici no recuerda si tenia casco cayo capot luego suelo circulaba bicisenda loyola tercero fue trasladado same htal duran intervino tambulancia policia,COMPROMETIDA
aci,asegurado detenido semaforo avenida heras companero trabajo iba sentado ese parte abre parte trasera derecha para bajar es colisiona tercero bici circulaba misma bici ciclista cayeron piso no llevaba casco asegurado traslada ciclista htal fernandez no tenia lesiones aparentes,COMPROMETIDA
aci,detenido semaforo avenida h yrigoyen entre acevedo laprida momento acompanante asegurado abre parte momento bicicleta colisiona parte sola persona bicicleta cae pavenida lastima mano rodilla participa ambulancia policia lugar no quiso ser trasladado ambulancia,COMPROMETIDA
aci,circulaba mercedes direccion lascano llegar esquina reduzco velociday cruzar lascano colisiona ciclista venia lascano mano izquierda asegurado cual colisiona delantera izquierda provocando su caida siendo este trasladado hospital alvarez interviniendo comisaria ex ahora denominada comuna,COMPROMETIDA
aci,encontraba circulando calle avenida cruzando calle pampa dando paso ciclista ciclovia motociclista venia calle pampa verme frena repentinamente provocando vuelco deslizamiento scooter sin llegar colicionar mi conductor acompanante no tenan casco puesto acompanante no ten chaleco refractario obligatorio retiro same datos tercero kymco hlm,COMPROMETIDA
aci,venia circulando waith doblar cajaravenida habia s estacionados ambulancia lados sin querer roso bicicleta cual fue sus propios medios,COMPROMETIDA
aci,asegurado circulando calle mexico tercero colisiona espejo derecha tercero no llega caer piso va andando sin dar datos sin intervencion policia ni ambulancia sin lesiones visibles,COMPROMETIDA
aci,asegurado estaba detenido calle rucci maniobra para girar hacia calle atenas colisiona su parte delantera tercero circulaba calle rucci sin desplazamientos bicicleta iba solo ocupante sin casco cae piso presentaba dolor brazo pierna intervino policia isidro casanova fue trasladado hospital solis ambulancia causa hecho rompe parabrisas delantera,DISCUTIDA
aci,asegurado circulaba garcia rio cruzar cramer frena porque ve bicicleta esta termina colisiona parte delantera izquierda sin casco cae suelo tena corte cabeza lleva htal pirovano no interviene policia ni ambulancia,COMPROMETIDA
aci,asegurado estaba saliendo su posicion estacionado bicicleta circulaba misma calle colisiona asegurado parte derecha ciclista cae su bicicleta suelo no intervino policia ni ambulancia simple vista tenia nun raspon pierna rengueaba pero no quiso ser asistido intercambulancia datos nos retiramos,COMPROMETIDA
aci,mi estacionado motor apagado abro parte delantera izquierda bicicleta colisiona misma trasera esta otra bicicleta colisiona primer bicicleta ambulancia conductores biciclitas caen suelo sin casco sufren lesiones son traslados ambulancia same hospital pirovano no hubo mas involucrados cel formalizo casa central ampliamos asegurado cuanto mecanica manifiesta iban dos ciclistas par produce colisiona ellas abrir parte su rodado para poder bajar raiz ello cae otra ciclistas caen eran padre e hija hombre tenia herida cortante menton posible fractura dedo menique izquierda chica tenia roto diente colisiona varois asegurado es medico reviso momento para constatar no hubiera lesiones gravenida policia fue lugar hecho quedo retenido calle como dos horas hasta labraron acta intervino fiscalia avenida cabildo correspondiente comuna no hicieron alcoholemia terceros fueron trasladados ambulancia danos parte su rodado,COMPROMETIDA
aci,estacionado rivadavenida abro parte para subir bicicleta colisiona parte delantera izquierda asegurado ciclista cae piso sin perdida conocimiento intervino ambulancia policia,COMPROMETIDA
aci,circulando avenida corrientes freno mi senora venia acompanante abre parte delantera derecha momento cual pasaba bici misma colisiona parte unico ocupante bici cae pavenida levanta sus propios medios tenia raspones altura cuello rodilla no intervino policia ni ambulancia yo di mis datos pero no tome,COMPROMETIDA
aci,asegurado abrir parte delantera izquierda para descender teniendo estacionadoes colisiona parte ciclista pasabael ciclista caese levanta sus medios pudiendo caminar sin inconvenientes llama mismo su trabajo policia same siendo trasladado santoiani sin lesiones aparentes tercero no llevaba cascoasegurado tambulancia llamo same,COMPROMETIDA
aci,lugar ocurrencia valentin alsina farina montegrande circulando valentin alsina repente encierro bicicleta venia mi derecha rozo mi parte delantera derecha bicicleta iba sola persona casco cayo piso levanto sus propios medios no vino ambulancia ni policia te,COMPROMETIDA
aci,circulaba venezuela llegar esquina corta venezuela dobla virrey liniers derecha desde senda peatonal bici colisiona parte delantera derecha cae piso no levanta solo lleva same policia secuestro asegurado formalizo oficina nazca circulaba venezuela gira derecha para tomar virrey liniers bicicleta bicisenda desde derecha virrey liniers dano es parte derecha rodado asegurado delantera tercero fue trasladado ambulancia fue policia pero no hicieron alcoholemia no tiene cert actuaciones intervino comisaria fiscalia penal contravenida caba,COMPROMETIDA
aci,asegurado encontraba detenido dejando pasar venian cnel s carreras avenida cruza bicicleta venia sentido contrario pasa entre medio asegurado otro asegurado colisiona parte delantera parte bicicleta cae suelo sin lesiones visibles no manifestaba dolencias retiro sus propios medios pero sin andar bicicleta porque rueda estaba torcida producto colisiona sin intervencion ambulancia solo intervencion policia constato todo este bien,COMPROMETIDA
aci,asegurado circulaba calle vergara encierra asegurado colisiona parte izquierda espejo retrovisor bicicleta circulaba misma calle izquierda asegurado no cae piso ocupante no interviene policia asegurado traslada hospital evita pueblo dolor codo,COMPROMETIDA
aci,mecanica hecho segun version asegurado circulando calle no recuerda bicicleta sale repente parte izquierda colisiona asegurado proteccion cae piso solo observa colisiona pierna derecha debajo rodilla asegurado ofrece asistentencia llamar ambulancia ciclista niega porque estaba trabajando retira lugar sin mas,CONCURRENTE
aci,asegurado circulando eva peron para doblar pumacahua dos conteiner tapan vision conductor no ve habia tercero colisiona su parte delantera conductor tercero cae capot despues suelo es asistido ambulancia trasladan hospital,COMPROMETIDA
aci,asegurado circulaba zabala colisiona su parte delantera izquierda ante ro bicicleta circulaba eslovenia sin desplazamientos ni lesionados bici dos personas sin casco levantan sus medios interviene policia ambulancia fueron trasladados clinica modelo moron,COMPROMETIDA
aci,cruzando puente alvarez moto invade mi carril esquive hacer esto colisiona levemente ciclista venia mano enfrente ciclista no cay sin intervencin polica ni ambulancia march sus propios medios tras dejarme sus datos,COMPROMETIDA
aci,asegurado circulaba rep honduras trasera bicicleta par bicicleta encontraba taxi llegar juan b justo doblo sin dar avenida delantera bici este tuvo frenar colisiona asegurado colisiona su frente parte trasera bicime bajo asisto incorpora sus medios manifiesta dolor mano derecha ofrece asistencia medica lugar cual niega ofresco llevarlo hasta donde dirigia era su casa cargamos bici trayencto tercero manifiesta hicha mano llevo hasta hospital pirovano donde no fue atendido luego pide lleve hasta vicente lopez donde vive retiro lugar no intervino policia ni amb,COMPROMETIDA
aci,asegurado circulaba cochabambulancia maniobrar hacia es colisiona su parte delantera izquierda ro circulaba sin desplazamientos ni lesionados,COMPROMETIDA
aci,asegurado white llegar jose e rodo miro derecha como viene transito no vi ciclista venia bicicenda este venia oeste este colisiona mi delantera ciclista femenina tenia casco cae suelo no levanta sus propios medios viene ambulancia same trasladan pinero intervino policia tenia raspones brazos quejaba tobillo celular asegurado celular chica bici,COMPROMETIDA
aci,estaba parado esquina para doblar arranco colisiona bicicleta venia mi mano izquierda yo estaba mirando transito venia mi derecha,COMPROMETIDA
aci,asegurado estacionado abre parte delantera izquierda e colisiona bicicleta circulaba misma ciclista cae asfalto asegurado ayudo tercero levantarse asegurado llevo hospital thompson no hubo intervencion policial ni ambulancia no hubo desplazamientos,COMPROMETIDA
aci,asegurado circulaba avenida general jose san martin maniobrar derecha para estacionar colisiona levemente ciclista bicicleta cae pero ciclista queda pie intercambulancia datos va sin intervencin policia ni ambulancia,COMPROMETIDA
aci,circulando rivarola ciclista cruza produce siniestro conductor bicicleta venia solo cayo piso,CONCURRENTE
aci,iba circulando cno general belgrano bicicleta circulaba par esquiva pozo viniendo contra mi colisiona rueda trasera bicicleta iba sola persona sin casco cual cae levantandose sus medios manifestando dolores pierna izquierda ofrezco llevarlo centro medico o llamar ambulancia pero niega ya tenia ir trabajar sin intervension policial ni ambulancia sin desplazamientos nos comunicamos asegurado para ver si podia aportar mayores datos terceroel asegurado no tom te tercero mecanica dice bicicleta esquiv pozo tercero no quiso ir hospital no participo policia tercero momento no reconoci haba esquivao pozo cruzaron datos pero no te movil no tuvo danos como consecuencia hecho ya fue algo leve,COMPROMETIDA
aci,mecanica hecho segun version asegurado circulando payzandu cruzar atacama venia bicicleta mi izquierda no veo porque venia no permite ver esta colisiona parte izquierda delantera bicicleta iba sola persona no tenia casco cae suelo no levanta colisiona cabeza estaba conciente testigo llama ambulancia trasladaron hospital haedo intervino policia,COMPROMETIDA
aci,asegurado circulaba avenida estados unidos agacha para cambulancia radio colisiona tercero circulaba misma sin desplazamientos bicicleta solo ocupante sin casco cae piso preentaba dolor rodilla no intervino policia ni ambulancia retira sus propios medios,COMPROMETIDA
aci,mecanica hecho seguno version asegurado c irculando calle monteagudo ingresar avenida unidanacional toma colisiona tercero bicicleta cual circulaba unidanacional asegurado toma colisiona su parte delantera parte derecha esta bicicleta cual tenia solo ocupante sin proteccion no cayo piso manifesto dolencia rodilla no intervino movil policial ni ambulancia sin desplazamientosasegurado traslada tercero asegurado hasta domicilio mismo,COMPROMETIDA
aci,mecanica hecho segun version asegurado circulando calle pte h irigoyen intentar girar izquierda colisiona ciclista circulaba su parte ciclista colisiona otro cae piso no intervino ambulancia ni policia dsa ampliacion hablo asegurado informa gira encierra ciclista mismo cae otro estacionado cual no tiene datos ciclista ayudaron retirarse unas personas estaban luagarfd,COMPROMETIDA
aci,mecanica hecho segun version asegurado maniobra para salir lugar estacionado he colisiona bicicleta su parte delantera izquierda parte delantera tercero conductor bicicleta cea suelo no recibe asistencia lugar,COMPROMETIDA
aci,venia circulando calle iwanoski llegar interseccion mayo colisiona mi delantera bicicleta cayendo asfalto ampliacionvenia conduciendo calle iwanoski llegar cruce mayo no vi bicicleta venia mayo desde derecha toque rueda trasera cayo asfalto pare tome datos dijo tenia dolor fuerte mano para evitar colisiona cara apoyo su mano creo era derecha no recuerdo no hice denuncia porque dijeron no toman mas comisaria no realizaron prueba alcoholemia,COMPROMETIDA
aci,circulaba ruta entre paraguay patagones direccion paso rey ciclista iba derecha pegado cordon estoy pasando resbala cae abajo comionintervino policia ambulancia,COMPROMETIDA
aci,asegurado encontraba estacionado calle tagle abrir parte delantera izquierda colisiona misma tercero bicicleta persona sin casco circulaba misma persona cayo asfalto fue trasladada delantera asegurado hasta su domicilio sin desplazamientosno int policia ni ambulancia tel,COMPROMETIDA
aci,asegurado circulaba calle lavenida cruzar calle palpa colisiona ciclista ciruclaba esta ultima calle desde su derecha colisiona su parte delantera derecha ciclista cae suelo luego pegar cabeza contra parabrisas no interviene policia ni ambulancia asegurado ver tercero es vecino levanta traslada htal trauma pablo nogues sin desplazamientod,COMPROMETIDA
aci,vjh estaba circulando calle brown colisiona su parte derecha sujeto manejaba bicibcleta cual no usaba casco cayo piso bicicleta quedo buen estado su decir tiene solo raspones sin intervencion policial lesioando,COMPROMETIDA
aci,mecanica hecho segun version asegurado circulando colombres llegar interseccion italia freno miro hacia ambulancia lados vuelvo arrancar colisiona e tercero circulaba bicicleta italia cael piso manifestaba tener dolor sus rodillas intervino policia transito retira sus propios medios,COMPROMETIDA
aci,asegurado detenido semaforo berlin reanudar marcha maniobra para evitar mi parte delantera termina colisiona su parte delantera izquierda ante ro bici circulaba berlin mano contrariasin desplazamientos ni lesionados bicicleta persona sin casco sin intervencin policialno interviene ambulancia ya no llego teien dolor pierna luego flair retiro,COMPROMETIDA
aci,mecanica hecho segun version asegurado circulaba rivarola doblar para tomar jufre colisiona su parte delantera derecha ciclista circulaba rivarola ciclista cayo pavenida no presentaba lesiones visibles reincoporo retiro lugar sus propios medios sin intervencion policias ni ambulancias,COMPROMETIDA
aci,asegurado circulando calle canada juan ruiz colisiona parte delantera tercero circulaba mismo sentido bicicleta cruza para tomar tucuman solo ocupante sin casco cae pavenida asiste ambulancia policia sin,COMPROMETIDA
aci,venia circulando calle manuel quintana repente terminar cruzar cale rodolfo lopez no vi bicicleta colisiona e parte delantera derecha acto seguido ciclista cae suelo pregunte como estaba retiro sus propios medios no hubo intervencion policial ni medica datos tercero matias alarco marti,COMPROMETIDA
aci,circulando calle profesor vidal quise girar para ingresa calle junin soy colisiona bicicleta venia contramano junin mi parte delantera izquierda ciclista no cae paso sus datos ofreci ir hospital pero nego no hubo intervencion policial sin lesionados ni otros terceros involucrados datos tercero lujan lucas eduardo,CONCURRENTE
aci,bicicleta venia pegada cordon no vi ya estaba oscuro ampliacionamplia diciendo circulaba calle heras dirigi colectora banco itau esta cuadras su domiciliocuando va tomar colectora colisiona ciclista su derecha circulaba pegado cordon no llego ver ya estaba oscurono hubo intervencion policial ni ambulancia intercambulancia datos fueronmas tarde llamo tercero quien dijo estaba nosocomio porque dolica rodilla asegurado dirigio lugar constataron no habia lesion solo queria paguen bcicletala asegurado dio algo pparte no dijo cuanto tiene buscar datos tercero para pasarmelosya tengo documental ok,COMPROMETIDA
aci,asegurado estacionado avenida mitre abre parte izquierda pasa bicicleta tocando espejo persona bicicleta no llega caer piso pero dijo habia raspado dedo mano izquierda no participo ni policia ni ambulancia lugar pasan datos retira luagar,COMPROMETIDA
aci,comenzar girar para tomar avenida diaz velez freno debido hay gente cruzando senda peatonal soy colisiona parte trasera derecha ciclista rompiendo ptica trasera derecha hace presente polica lugar retira lugar ampliacion hablo asegurado celular dice circulaba calle rio janeiro gira hacia diaz velez detiene porque cruzan unos peatones es ciclista circulaba trasera colisiona parte traserarompe foco asegurado baja para asistirlo llama policiael tercero encontraba grupo motociclistas todos agredieron asegurado patearon rayaron su antes llegue policia retiraronno inicio sumario ni hubo alcoholemiano tiene ningun dato tercero pero si ve cree reconocerlodesconoce si alguno tomo foto su patente pero eso realizo denunciame pasa documental ok,CONCURRENTE
aci,asegurado circulaba calle banderas maniobra para ingresar rotonda colisiona su parte delantera izquierda tercero circulaba rotonda sin desplazamientos bicicleta solo ocupante sin casco cae piso presentaqba dolor pie no intervino ambulancia intervino policia tigre retira sus propios medios,COMPROMETIDA
aci,asegurado detenido teodoro garcia abre parte delantera izquierda habiendo verificado no venga nadie tercero bici circulaba misma colisiona su parte derecha manubrio cayendose pavenida parte izquierda manifestando danos rodilla intervino policia lugarel asegurado traslada conductora hospital tornu dejandola guardia sin desplazamientos,COMPROMETIDA
aci,asegurado encontraba detenido virrey liniers luego ahvanza cruza fray julian lagos bicicleta venia fray julian lagos colisiona parte delantera izquierda asegurado no interviene ambulancia ni policia asegurado lleva sala atencion primaria queda alli internado,COMPROMETIDA
aci,circula mi jufreciclista circula sluces serrano sentido contrario transito sbaja iluminacin pdablicacolisiona mi vehculo parte izquierda cae ese ladocirculando yo kmhllame same prevencinacusaba dolor pierna izqambulancia partes decidimos no hacer denuncialo llevo bazterricaacompano hasta guardia no presentaba fracturas ni fisuras,COMPROMETIDA
aci,asegurado maniobraba desde alvarez hacia saavenida colisiona su parte delantera izquierda ante ro bicicleta circulaba contramano saavenida sin desplazamientos ni lesionados bicicleta sin intervencion policial ni medica retiro sus medios,COMPROMETIDA
aci,iba manejando mi camioneta victor hugo doblar san blas no vi iba bicicleta bicisenda doble hacia san blas toque espejo camioneta muchacho perdio control bicicleta cayo frene ayudarloestaba poco rengole dije si queria llevase hospital velez sarsfielpero dijo podia seguir tome sus datos mios ampliacionocurrio sabado agosto manana tipo amyo dirigia x victor hugo doble izquierda calle san blas sin darme cuenta mi izquierda bicisenda chico bicicleta sin querer toque espejo mi camioneta dobleel muchacho llamado federico reyes dni cayo su bicicleta frene para ayudarlo pregunte si queria lleve hospital velez sarsfielque estaba ahi nomasle dolia pierna pero dijo nole pase mis datos x dudas suyosyo iba solo mi camioneta seguro mis datos poliza uds deben tenerlosfs,COMPROMETIDA
aci,asegurado circulando calle castro girar izquierda colisiona ciclista circulaba pro misma su izquierda sin desplazamientos ciclista cayo piso levanto fracturo pierna izquierda no intervino ambulancia ni policia,COMPROMETIDA
aci,arranque semaforo avenida jose maria moreno hacia norte llegar altura bicicleta circulaba mismo sentido pegada s estacionados doblo para izquierda sin previo avenida darme cuenta piso freno trato girar levemente izquierda pero venian s mano contraria senti colisiona estallido parabrisas,COMPROMETIDA
aci,asegurado circulanopor calle sn colisiona ciclista circulaba avenida carril sin desplazamientos ciclista cayo piso intervino ambulancia no policiad,COMPROMETIDA
aci,venia circulando calle roca estoy cruzando avenida maipu paso mi favenida ciclista cruza colisiona mi parte delantera rueda trasera acto seguido ciclista cae piso bajo acerco ayudarlo informa no presenta lesiones ofrezco llevarlo su casa pero dice no ciclista retira sus propios medios no hubo intervencin medica ni policial datos tercero colisiona ciclista cruzoel mismo pidio disculpas acompano bicicleteria sin intercambulancia datosdfili no hubo intervencion policial ni ambulancia asegurado tercero ciclista no habrian intercambulancia datos segun dice no tiene datos mismo formalizo aca central juan pablo ciancia tanto no quiso reenviarme documental mi,CONCURRENTE
aci,asegurado circulaba calle bonifacio maniobra para girar hacia calle martinez castro colisiona su parte delantera izquierda tercero bicicleta circulaba bicisenda calle bonifacio sin desplazamientos bicicleta solo ocupante casco no cae piso no poresentaba lesiones no intervino policia ni ambulancia retira acompanado titular hacia bicicleteria,COMPROMETIDA
aci,asegurado circulando donato alvarez dobla calle bynnon colisiona su parte delantera bici ocupante bici cae suelo es trasladado ambulancia,COMPROMETIDA
aci,asegurado circulaba avenida juan b justo girar hacia derecha para tomar avenida libertador fue colisiona su parte trasera derecha tercero bicicleta persona casco circulaba juan b justo persona no cayo asfalto no hubo asistencia medica ni intervencion policial sin desplazamientos ampliacionsl conductor asegurado circulaba solo avenida juan b justo comienza giro derecha para tomar avenida libertador detiene para dar paso peatones ciclistas cruzaban interseccion momento siente gran colisiona estallido su rodado penso trataba robo pero era ciclista circulaba su derecha no logro detenerse tiempo asegurado dio paso e colisiona contra parte trasera derecha rodado asegurado estallando vidriod,COMPROMETIDA
