cod_accidente,descripcion,responsabilidad
aci,asegurado detenido semaforo calle olleros su acompanante abre parte delantera derecha e colisiona esta bicicleta circulaba misma danico ocupante bicicleta no tenia casco cayo piso no presentaba lesiones visibles retiro propios medios hubo intervencin polica transito no hubo intervencin medica,COMPROMETIDA
aci,circulando v vertiz llegar cruce drago ceden paso para cruzar desde mano derecha aparecen dos bicicletas desde mano izquierda colisiona mi parte no interviene ambulancia o policia incorporan sus medios luego pueden retirarsed,COMPROMETIDA
aci,asegurado estacionado calle chacabuco estaba descendiendo su abre parte delantera izquierda ciclista venia circulando misma calle colisiona manurio bicicleta parte izquierda iba solo ocupante sexo femenino casco puesto cae calle fue asistida su momento titular tenia raspon codo manifestaba molestia hombro delantera esto llamo same control derecha argerich tt mismo dia estuvo colisiona novio tt dario confirmo habia salido todo bien no tenia ninguna lesion ya habian dado alta sin desplazamientos,COMPROMETIDA
aci,yo circulaba sb palermo iba doblar para libertador para doblar avenida libertador bicicleta venia mi izquierda libertador mucha velocidahizo maniobra colisiona parte trasera como si seria parte trasera parte izquierda generando danos chapa pintura,COMPROMETIDA
aci,estacionado abro parte delantera izquierda colisiona ciclista este cae bicileta no quiso llamar policia ni ambulancia retiro sus propios medios andando bicicleta asegurado asistio lugar pero no quiso recibir atencion medica datos tercero lilian parte bicicleta d,COMPROMETIDA
aci,asegurado circulando perete mano antes llegar cruce calle caba trasera terminal micros aparecen dos bicicletas circulando sentido contrario perete ellas pasar colisiona parte delantera derecha asegurado conde bicicleta sin casco cae piso lastimandose cabeza comenzo sangrar ver esta situacion asegurado consulta si no quiere lleve htal pero persona niega limpia herida sigue su camino asegurado manifiesta chico bicicleta es conocido suyo feria si bien no tiene datos necesitarlos pueden conseguir sin desplazamientos d,COMPROMETIDA
aci,colisiona entre mi girando ceretti hacia pampa bicicleta detenida pampa pretende doblar izquierda para tomar ceretti bicicleta colisiona su rueda delantera parte izquierda llama same labra acta circunstancial same verifica ausencia danosd,COMPROMETIDA
aci,denuncia asegurado informa encontraba ciruclando calle julio belia llegar interseccion calle balbastro secruzo ciclista quien colisiona su parte delantera izquierda ciclista cayo bici tuvo lesiones leves,CONCURRENTE
aci,oportunidade proceder detener lugar q permitiera descender acompanante mientras desplazaba muy baja velocidacomienzo apoyar hacia derecha muy lentamente para acercarme espacio entre dos s repentinamente siento colisiona trasera altura parte derecha trasera veo ciclista estaba pasando parte derecha pierde equilibrio caela persona no presenta ninguna lesion tampoco sufre danos su bicicleta esto constata porque para poder intercambulancia nuestros datos dicha persona sigue su durante cuadras media,COMPROMETIDA
aci,cc asegurado estaba estacionar delantera camion estaba doble fila fue colisiona ciclista circulaba trasera suyo parte derecha,COMPROMETIDA
aci,haciendo marcha trasera no advierto presencia bicibleta tipo playera estaba apoyada contra columna cual es presionada contra columna er,COMPROMETIDA
aci,cc asegurado estaba esperado semaforo momento arrancar bicicleta cruza parte derecha asegurado colisiona delantera derecha contra bicleta bicicleta tuerce rueda trasera no vio lesiones conducia bicicleta no hubo intervencion policial ni ambulancia,COMPROMETIDA
aci,cc asegurado informa iba transitando cayetano silva llegar interseccion dorrego asegurado dobla derecha unciclista transitaba derecha su dobla izquierda e colisiona parte trasera derecha conductor bicicleta secae misma,COMPROMETIDA
aci,denuncia asegurado circulaba calle paysandu norte sur interseccion avenida malvinas medetengo semaforo coloco guino para girar derecha coloca verdearranco siento colisiona frente derecha veo senor bicicleta esta apoyadoa mi este senor estaba contra mano aparantemente quiso pasar mi derecha novio semaforo cambulancia sali esquina estacione unos mts avenida malvinaspara ver senor estaba asustado nervioso hice sentar mi observe tenia raspones superficiales corte mas profundo talon derecha cm aprox limpie laherida pare hemorragiale ofreci llevarlo su casa estaba cuadras o laguardia pero no quiso biciletaampliacion asegurado lang forecosport asegurado circulaba paysandu sentido norte sur arribar interseccion avenida malvinas realiza unamaniobra giro hacia derecha promediar misma colisiona bicicleta conducida tercero circulaba margen izquierda avenida malvinas sentido oeste este raiz colisiona produce caida biciclo piso calzada junto su tripulanted,DISCUTIDA
aci,cc asegurado encontraba estacionado mano derecha asegurado intentar salir colisiona su parte delantera izquierda ciclista,COMPROMETIDA
aci,denuncia asegurado cc asegurado informa circulaba febrero llegar calle alonso colisiona bicicleta su parte delantera ciclista cae acude ambulancia policiaampliacion asegurado lang asegurado circulaba calle febrero sentido este oeste declara su conductora llegar interseccion calle solares esa circunstancia colisiona bicicleta conducida tercero provenia esta ultima arteria provocando caida su conductor rodado menor,COMPROMETIDA
aci,conducia mi forkuga patente aa tj calle alvear doblo derecha esquina calle brown siento ruido parte derecha chico dice encerre gire,COMPROMETIDA
aci,detenido semaforo rivadavenida balcarce bis practicamente pegado cordon derecha luz giro encendida iniciando giro hacia balcarce siento ruido altura parte trasera derecha bicicleta colisiona parte trasera mi pierde equilibrio luego estacionar asistir joven indica encuentra bien no necesita auxilio medico retira sin problemaspor sus propios medios,COMPROMETIDA
aci,denuncia asegurado cc asegurado estaba circulanado avenida tilliaraguarda interseccion campillo debido venian s derecha ciciclista estaba izquierda asegurado es colisiona parte izquierda ciclista cayo piso intervino policia consulto ciclista reiteradas oportunidades si necesitaba asistencia medica cual niega retiro lugar yse intercambulancia algunos datos asegurado,COMPROMETIDA
aci,estaba estacionado avenida san martin ciudade fray luis beltran abrir parte izquierda delantera fiat siena dominio can conducido angel carlos fabian para descender mismo bicicleta venia circulando dicha arteria colisiona contra parte bicicleta venian sra lobos natalia dni junto su hijo gomez bautista dni quienes tuvieron lesiones leves debido colisiona sra lobos su hijo gomez fueron llevados sr angel clinica centro medico dicicolisiona donde fueron atendidos ambulancia nino gomez luego llevaron sanatorio victor j vilela donde realizaron tomografia cual arrojo resultados positivos,COMPROMETIDA
aci,denuncia asegurado enrique berduc luego atravenida insterseccion asturias sin querer espejo retrovisor izquierda colisiona persona circulaba bicicleta cae suelo no quiso dar su numero teampliacion asegurado lang chevrolet agile asegurado circulaba calle enrique berduc sur norte declara su conductora transitar altura nba produjo colisiona entre espejo retrovisor izquierda su parte derecha bicicleta iba sola persona circulaba identico sentido su izquierda raiz colisiona bicicleta su conductora cayeron suelo,COMPROMETIDA
aci,circulaba calle julio llegar interseccion calle lavenida colisiona bicicleta venia circulando contra mano,CONCURRENTE
aci,cc asegurado indica venia circulando rincon llegar esquina frena deja pasar persona encontraba circulando bicicleta luego reanuda su marcha pasar loma burro colisiona ciclista aparece desde parte derecha asegurado circulando calle chile bicisenda ciclista cayo bicicleta no hubo presencia policia ni ambulancia asegurado ofrece llevar ciclista haga atender centro medico pero tercero indica encontraba bien no accede dirigirse hospital asegurado luego siniestro comunica telefono tercero mismo manifiesta seencontraba bien habia mandado arreglar bicicleta,DISCUTIDA
aci,cc asegurado indica su madre conducia mano derecha calle tucuman llegar interseccion paraguay luz giro puesta dobla hacia derecha asegurado es colisiona su parte derecha bicicleta conducia calle tucuman no previo fuera doblar siguio conduciendo ciclista no callo suelo solo raspo mano su propia bicicleta no hubo intervencion policial ni ambulancia,COMPROMETIDA
aci,circulando calle jose marti llegar esquina luis fanti freno para girar derecha retomar marcha colisiona sin querer ciclista,COMPROMETIDA
aci,encontraba estacionada calle avenida san martin casi esquina entre rios comenzar abrir parte para descender mi alcance abrir apenas motivos desconozco repente aparece bicicleta presumo esta gira calle entrerios hacia san martin ldblquote gira hacia derecha forma fuerte toque apenas parte brazo mujer venia bicicleta desestabiliza cae suelo comienza gritar dolia brazo derecha parte pierna izquierda cae suelo sentada no quiso levantaran suelo hasta vino policia es ahi levantan empieza decir estaba mareada,COMPROMETIDA
aci,circulaba calle llegar interseccion calle advierto no venian s dispongo cruzar dicha arteria mientras estoy haciendo bicicleta venia circulando contramano calle colisiona ampliacion vanoneampliacion erome dice circulaba bicicleta calle circulaba no ve estaba cruzando colisiona cae colisiona piernas su bicicleta queda debajo toda rota va hija trasladan hospital zonal dicen son solo colisiona recetan diclofenacal dia hoy continua dolor rodillas queda pasarme fotos bicicleta certificados medicosno poli ni ambulancia senalizacien,COMPROMETIDA
aci,denuncia asegurado circulando avenida arturo capdevila direccion hacia circunvalacion interseccion jacinto altolaguirre detengo elsemaforo esa avenida son dos carrilles para circulacion mano mi caso particular encuentro parte derecha mi izquierda nos da paso semaforo arrancamos conjunto tras tomar mi marcha muy baja velocidasin siquieratrasponer bocacalle siento colisiona parte izquierda mi maticamente freno percato ciclista cuyo nombrees federico beas viajando misma menor cuyo nombre es nicolas beas cruzan interseccion semaforo rojo colisiona mi parte izquierda mismo momento dado menor habia colisiona llama hacen presentes lugar trasladan menor solo control mismo hacia hospital infantil mayor queda lugar dado no presentaba lesiones solo raspon rodilla,CONCURRENTE
aci,cc esposo asegurado informa circulaba calle celaya llegar interseccion dobla hacia derecha sin visualizar ciclista circulaba esta ultima ciclista cayo asegurado,COMPROMETIDA
aci,esposa asegurado indica encontraba transitando calle parana tercero colisiona espejo retrovisor izquierda manillar derecha bicicleta mismo no cae bicicleta pero indico malestar su mano izquierda vaparana dm angosta paso parte ciclista rozan espejito retrae tercero no cae manifiesta dolor manoinst va para dinerointercambulancia telefonosno poli no ambulancia tercerocirculaba parana va toca manubrio cae colisiona muneca va hacer conocido tiene salita almirante brown porque tenia muneca hinchada rep bicicleta rompio vidrio tel no cuenta certificado medico ni ticket compra medicacion porque proporcionaron salitapor cierra,COMPROMETIDA
aci,denuncia asegurado circulaba espana hacia oeste llegar interseccion almafuerte otros s iban almafuerte hacia norte detienen su marcha para darme paso tal razon dispongo trasponer bocacalle ese momento hizo tambulancia ciclista detengo marcha para darle paso vez hubo pasado citado ciclista mi detenido menor otra bicicletaque iba trasera aludido ciclista colisiona mi unidaen rueda delantera izquierda cayendo pavenida luego accidente dispuse llamar emergencia pesar menor negaba hacerlo dado solo tenia dano leve mano ampliacion vanonecirculaba espana su sra llegando almafuerte cruza primero bici continuacion otra cual colisiona delantera vael ciclista menor eda anos cae suelo levanta manono tenia ninguna lesion gravenida pero todos modos decidieron intervenga poliintervino poli ambulancia alcoholemia ni extraccienhay causa oficiofiscalia dpto san nicolas formaliza veiga luis productor,COMPROMETIDA
aci,cc asegurado informa encontraba circulando calle beramugica cruzar segui bicileta rodado chico circulaba segui colisiona rueda delantera derecha,COMPROMETIDA
aci,circulaba calle tres febrero norte sur venado tuerto es doble mano sentido contrario venia senora enuna moto luz giro para girar izquierda yo detengo hago senas para esta senora su moto cruce delantera mihacia calle sarmiento estando detenido siento colisiona trasera mi era bicicleta colisiona altura faro derecha,DISCUTIDA
aci,denuncia asegurado salir cochera donde guarda cruzo nino bicicleta toque frente camioneta nino cayo inmediatamente acudimos madre estaba calle para ver como encontraba madre nino desidio trasladarlo instituto medico rio cuarto donde realizaron estudios hasta momento encontraba observacion siendo concurrimos nuevamente instituto medico para consultar como continuaba nino medica guardia nos informo no tenia noveday hasta momento ninguna complicacion encontrandose buen estado,COMPROMETIDA
aci,circulaba pavenida oeste este muy baja velocidahay cilcista detenida vereda plaza direccion ceballos misma quedo mirando transito comenzo cruzar colisiona levemente rueda delantera misma cae dice colisiona pierna ofresco para llevarla algun centro asistencia pero dice esta bien no quiere hacer denuncia dado esta paso casa amigo calle peru piso pto volvia cordoba donde recide calle bolivar lleve bicicleta hasta calle peru presenta amigo matias mirabelli dueno bicicleta celular,COMPROMETIDA
aci,denuncia asegurado cc asegurado informa encontraba esquina es doble mano mirar su derecha verifica no viene nadie avenida cruza ciciclista cual colisiona ciclista cayo moto acudio ambulancia policiaampliacion asegurado proximamente informe corresponsal,COMPROMETIDA
aci,colisiona ciclista ampliacion asegurado circulaba solo ruta dmano hacia pparte frente entrada ciudade san vicente carril derecha ve delantera suyo banquina ciclista mayor eda anos sobrepasarlo no sabe motivo toca tercero habia volanteado hacia derecha para eludir pianitos baquina colisiona optica delantera derecha asegurado para regresa corriendo lugar para asistir tercero donde percata estaba fallecido llama zurich policia su mujer ya estaba estado shock asegurado permanecio parte tercero hasta luego minutos llega ambulancia constanto victima habia fallecidoel asegurado fue invitado policia cria yo hospital para sacaron sangre asegurado no consume alcoholel asegurado envia docel asegurado nunca tuvo colisiona ningun fliar victima ni sabian bien quien era cria,COMPROMETIDA
aci,ya habiendo cruzado movil casi su totalidala bocacalle ciclista vine calle izquierda intenta doblar cambulancia arteria ser divisado ciclista frena cero ciclista cae no pudiendo determinar si es producto colisiona o perdida equilibrio este producto frenado,COMPROMETIDA
aci,cc asegurado indica su esposa encontraba circulando calle mendoza llegar interseccion calle rivadavenida no hay semaforos tercero ciclista conducia calle rivadavenida sentido derecha izquierda cruza delantera asegurado produciendose colisiona sector parte delantera contra rueda trasera bicicleta ciclista no cayo suelo no llevaba casco retiro lugar sus propios medios no hubo intervencion policial ni ambulancia,COMPROMETIDA
aci,cc hijo asegurado indica su padre encontraba manejando luego estacionar mano derecha calle bajan este impulso abrir parte surge colisiona esta bicicleta misma cae suelo momento siniestro conductora bicicleta no llevaba casco no hubo intervencion policial encuentran aguardando ambulancias,COMPROMETIDA
aci,cc conductor iba circulando calle mencionada frena interseccion bicicleta circulaba garibaldi frena forma repentina ciclista es despedido hacia asfalto colisiona frente no colisiona movil asegurado ciclista no llevaba casco es sordo mudo hubo participacion ambulancia policial comisaria ta san fernando ciclista fue trasladadoen ambulancia no sabe centro asistencial,COMPROMETIDA
aci,circulaba mi cargo calle mosconi direccion oeste encontraba cruzando interseccion avenida marcos paz no advierto presencia bicicleta circulaba esta ultima arteria sur pormas aplico frenos trato esquivarlo no logro evitar colisiona frente izquierda mi unidaen rueda trasera mismacabe aclarar ciclista cae calzada levanta niega recibir asistecia medica manifestando estar bien retira lugar sus propios medios,COMPROMETIDA
aci,cc asegurado informa encontraba conduciendo giguero zona muy transitada sin senalizacion donde hay circular precaucion asegurado encontraba detenida observando para arrancar marcha persona encontraba conduciendo bicicleta transportando mercaderia mano contraria espera cruzar arranca marcha par asegurado cual intenta esquivarla frenando pero conductora bicicleta sigue curso provocando mercaderia transportaba caiga asegurado provoquen danos bicicleta no poseia casco no cayo bicicleta acudio policia,COMPROMETIDA
aci,encontraba estacionado correctamente paralelo cordon abrir parte mi miro hacia trasera aguardo ya venia bicicleta descender pensado bicileta ya habia visto siento colisiona fijo bicileta negra marca andes habia colisiona ayendose ofrezco llamar asistencia dice no estaba bien no habia pasado nada sin pedirme ningun dato alegando estaba bien retira sus propios medios dudas dejo mi telefono pido sus datos cabe destacar mi unidano presenta dano alguno dia fecha comunica conmigo abogada dejandome este telefono colisiona maria fernanda belizampliacion asegurado reparte encontraba estacionado calle tres febrero entre crespo vera mujica antes descender mira espejo retrovisor ve aproximaba bicicleta abre lentamente parte creyendo ciclista habia advertido bajaba decide descender esta cerrar parte siente colisiona ve ciclista habia colisiona parte habia caido,COMPROMETIDA
aci,denuncia asegurado cc conductor asegurado encontraba circulando oeste este calle carmelo ibarra intercepto ciclista encontraba parte derecha cual colisiona espejo derecha no llevaba casco no asistio ambulancia ni policia conductor desconoce si cayo bicicleta o noampliacion asegurado lang asegurado circulaba calle carmelo ibarra oeste este llegar altura nb su conductor no advirtio pasaba muy cerca tercero ciclista circulaba esta arteria mismo sentido rozandolo espejo derecha rodado asegurado tercero no perdio verticald,COMPROMETIDA
aci,cc asegurado informa encontraba bajando su parte derecha calle abrir parte aparece ciclista colisiona misma ciciclista no llevaba casco cayo bicicleta acudio ambulancia,COMPROMETIDA
aci,denuncia asegurado cc asegurado indica encontraba circulando calle mencionada llegar interseccion dispuso doblar direccion avenida pero no vio ciclista colisiona parte delantera ciclista no llevaba casco callo piso no accedio llamar ambulancia porque encontraba bien fue trasladado hacia su casa asegurado debido bicicleta quedo destrozadaampliacion asegurado lang asegurado circulaba oeste este calle chile declaro su conductor esa circunstancia llegar interseccion avenida hipolito yrigoyen senal luminica correspondiente encendida inicio giro su derecha para tomar esta ultima hacia sur momento colisiona sector parte delantera izquierda su bicicleta conducida tercero desplazaba norte sur esta ultima arteria raiz colisiona ciclista cayo suelo calzada,COMPROMETIDA
aci,yo circulaba lisandro torre hacia urquiza llegar interseccion freno porque decido doblar trasera venia senorita bicicleta quien colisiona su rodado cayendose calle dimos intevencion policia vino ambulancia constato no teniialesiones visibles llevaron su domicilio sin viera ese momento medico policial iniciaron actuaciones caraturaladas como lesiones leves culposas accidente transito conocimiento ministerio publico acusacion da circunscripcion sede casilda ninguno rodados sufrio danos,COMPROMETIDA
aci,circulaba calle italia llegando nacion bicicleta iba delantera intentadoblar izquierda colisiona ocasionando caida senora bicicleta,COMPROMETIDA
aci,denuncia asegurado circulaba calle sipe sur norte interseccien gulian aguirresoycolisiona mi parte izquierda ciclistael cual llevaba cuadro bicicleta su hija menor edadmi estaba detenidoa pesar esto colisiona asegurado lang fiat fiorino asegurado circulaba calle sipe hacia sur norte declara su conductor efectuar cruce calle julian aguirre fue colisiona parte delantera izquierda su bicicleta conducida tercero desplazaba esta ultima arteria sentido oeste este raiz colisiona conductor bicicleta su hijo viajaba como transportado cayeron suelo calzada,CONCURRENTE
aci,circulaba calle santa cruz sentido nortesur llegar interseccion callerosario disminuyo velocidapara tomar misma sentido oeste este venia grupo dechicos bicicletay siento colisiona parte delantera mi conducidodetengo el observo habia chico su bicicleta cinta asfalticame habiacolisiona parte delantera mi lo auxiliollega ambulancia llevan hospital escuela eva peronlo acompano para ser asisitido guardia,COMPROMETIDA
aci,denuncia asegurado cc asegurado informa vez estacionado calle mencionada abre parte delantera izquierda para descender pero misma toca manubrio ciclista justo estaba pasando lugar mujer cayo piso hubo presencia ambulancia policialampliacion asegurado prontamente informe valtier gareca,COMPROMETIDA
aci,cc asegurado indica regresar su domicilio calle mencionada norte sur llegar interseccion derecha detiene para dar paso circulaba derecha bicicleta circulaba calle derecha este oeste direccion contramano colisiona impacta parte delantera izquierda asegurado ciclista no llevaba casco bicicleta no teniafrenos ciclista colisiona cae bicicleta hubo presencia policial ambulancia retira lugar circulando bicicleta,COMPROMETIDA
aci,avenida mi calle riobambulancia sentido este oeste deteniendome ante cartel parey no observar aproximaba ningun procedo avenida interseccion bicicleta contramano aparece forma intempestiva atravenida mi camino produciendose colisiona como resultado ciclista cae capo recibiendo heridas menores,CONCURRENTE
aci,cc asegurado encontraba estacionando calle indicada ciclista venia alta velociday llevo puesto espejo delantera izquierda asegurado esta persona cayo asistio policia ya habia evento cercano ciclista tenia corte ceja derecha pero no quiso asistencia medica,COMPROMETIDA
aci,cc asegurado indica circulaba san nicolas dobla nueve julio e intercepto ciclista encontraba mano izquierda asegurado doblar mismo cayo capot luego suelo calle no llevaba casco no intervino ambulancia ni policia no fue trasladado retiro sus propios medios no presentaba lesiones vista,COMPROMETIDA
aci,denuncia asegurado venia circulando avenida rafael nunez direccion centro colocado carril derecha camioneta marca toyota negra cupula no alcance divisar chapa patente interpone mi marcha forma abrupta cruzandose medio encerrandome yo tuve frenar colisiona para no colisiona como asfalto estaba resbaladizo porque estaba lloviznando alfrenar colisiona cruzo mi razon ello colisiona bicicleta venia circulando misma mano haciendo caer conductor dicha bicicleta colisiona contra asfaltampliacion asegurado trowdtrgaphtrlefttrbrdrtrdrsrdrw trbrdrlrdrsrdrw trbrdrbrdrsrdrw trbrdrrrdrsrdrw clbrdrtrdrwrdrsclbrdrlrdrwrdrsclbrdrbrdrwrdrsclbrdrrrdrwrdrs cellxdntbllang asegurado circulaba noroeste sudeste hemicalzada sur avenida rafael nunez declara su conductor esa circunstancia transitar altura aproximada nb realizo maniobra cambulancia carril derecha para evitar ser colisiona movill encerro esa circunstancia colisiona sectro parte delantera derecha su bicicleta conducida tercero desplazaba identico sentido raiz colisiona ciclista cayo suelocellrowd,COMPROMETIDA
aci,desplazo calle alberdi sentido calle norte sur esquina freno observo tengo pase ese momento colisiona bicicleta circulaba calle rivadavenida este oeste contramano manipulando celularampliacion asegurado reparte circulaba calle alberdi norte sur llegar interseccion calle rivadavenida aparece contra mano esta ultima bicicleta llega tocar provocando unica ocupante menor edagolpee contra frente chica sufre colisiona piernas llamo policia ambulancia traslado misma hospital asegurado fue trasladado comisaria donde pidieron muestra orinad,COMPROMETIDA
aci,denuncia asegurado cc asegurado informa encontraba detenida semaforo calle illia su acompanante procede abrir su parte colisiona motociclista mismo cae suelo pero no necesito asistencia medicaampliacion asegurado prontamente informe corresponsal,COMPROMETIDA
aci,transitando avenida circunvalacion altura salida valle pte peron pongo mi guino para girar derecha momento giro ciclista transitaba mi misma direccion es colisiona mi ocacionando danos su rodado su codo,COMPROMETIDA
aci,encontraba circulando calle italia momentos estar terminando detrasponer bocacalle interseccien rioja chica circulaba bicicleta estadaltima arteria colisiona frente bici parte delantera derecha mi intervino policia no fue atendida ambulancia ya encontraba sinlesiones,COMPROMETIDA
aci,cc esposa asegurado declara iba conduciendo calle freyre baja velocidacuando ciclista cruzo no pudo evitar colisiona cayo bicicleta asegurado tuvo voluntade llevarlo hospital tercero no quiso luego ambulancia fueron comisaria para realizar correspondiente denuncia ese momento tercero manifesto no tener dolores ni lesiones,COMPROMETIDA
aci,siendo alrededor hs dia enero estaba estacionado callesantiago ciudade san lorenzo es asi descender mismo abro parte delantera izquierda ese momento bicicleta venia circulando dicha arteria conducida sra villan sofia sni colisiona parte iba acompanante joven tomas paiva dos ocupantes bicicleta no resultaron lesiones graves,COMPROMETIDA
