cod_accidente,descripcion,responsabilidad
aci,encontraba estacionado pte peron pasando mendoza abrir parte para bajar bicicleta colisiona parte,COMPROMETIDA
aci,cc conductora indica tanto como ciclista circulaban igual sentido pasarla siente colisiona visualiza ciclista habia caido parte derecha su no intervino ambulancia ni policia no tenia casco ver sangraba cabeza asegurado lleva hospital roque saenz pena,COMPROMETIDA
aci,hermano titular declara venia circulando bajada boulevarque corta avenida baja ciclista incorporandose avenida asegurado no visualiza colisiona ciclista este sube capot manifesto colisiona intervino policia ambulancia ampliacion asegurado respecto mecanica reparte venia circulando avenida norte sur llegar interseccion rueda no puede evitar colisiona ciclista arriba en parte izquierda asegurado no puede precisar donde venia tercero porque nunca vio hasta colisiona ciclista tendria unos anos cae piso resulta colisiona perdida conocimiento parcial no tenia fracturas expuestas ni lesiones visibles es trasladado ambulancia hospital roque saenz pena d,COMPROMETIDA
aci,siendo alrededor hs dia febrero iba circulando calle orono ciudade san lorenzo direccien esteoeste es asi trasponer interseccien calle escalada interpone mi trayectoria bicicleta conducida sra barbona tamara florencia dni cual colisiona parte delantera ciclista iba circulando calle escalada misma resulto lesiones leves,COMPROMETIDA
aci,asegurado informa su hijo estaba conduciendo avenida san martin interseccion calle femino ciclista colisiona parte izquierda ciclista informa estaba distraido ya querian robar bicicleta no llevaba casco hubo intervencion policial medica trasladaron hospital carcarana tuvo raspon rodilla codo izquierda asegurado cuanto mecanica reparte veia conduciendo carcarana su avenida san martin este oeste estar trasponiendo interseccion calle semino su resulta colisiona parte izquierda ciclista circulaba esta ultima norte sur ciclista cae asfalto resulta colisiona leves raspaduras codo rodillas interseccion no hay semaforos segun declaro presentes ciclista cruzo interseccion rapido sin mirar porque venia huyendo intento robo su bicicleta d,CONCURRENTE
aci,pareja asegurado raul alberto reynoso iba conduciendo calle beruti sur norte sentido contrario venia ciclistacuando iba doblar lavenida ciclista cruza lavenida cae colisiona asegurado bajo rapidamente traslado hospital samco rufino asegurado informa ciclista tiene lesiones rodilla izquierda,COMPROMETIDA
aci,asegurado indica encontraba circulando calle boulevarlos granaderos dispone girar hacia derecha hacia calle virgen mercecon luz giro ciclista intenta pasar derecha aparentemente tercero no ve guino eimpacta asegurado parte delantera derecha ciclista cayo pero no tuvo lesiones gravenida levanto retiro sus propios medios no intervino ambulancia ni policia,COMPROMETIDA
aci,circulaba mi calle san martin llegar calle monasterio fui colisiona sorpresivamente delantera derecha ciclista circulaba sin casco monasterio cruzo sin frenar delantera colectivo estaba detenido lacalle san martin monasterio obstaculizandole vision si observar mi circulaba paralelo colectivo calle san martin,COMPROMETIDA
aci,asegurado informa su hijo venia conduciendo asegurado semaforo estaba verde para doblar giran hacia izquierda oronio mitade calle hay senda cual encontraba bicicleta habia senora unnino aproximadamente anos estan doblando esta bicicleta cruza asegurado colisiona misma lesionaron intervino policia asegurado traslado centro medico llamado roca saenz pena,COMPROMETIDA
aci,tuve siniestro camino bancalari yendo conducia velocidade km senor bicicleta cruzo rapidamente llame acudiendo asi policia ambulancia mientras tanto yo hablaba hombre encontraba consciente pediaque queria irse estaba bien pedi datos mientras hacia chistes segun dijo ambulancia despues encontraba completamente alcoholizado solo tenia herida cabeza para dos puntos iban trasladar hospital general pacheco ahi dirigi comisaria donde tomaron denuncia confirmaron senor estaba bien,COMPROMETIDA
aci,detengo avenida entre direccion nortesur abrir parte paradescender nina bicicleta colisiona filo parte cae cinta asfaltica voy asistirla viene policia ambulancia lugarla nina transitaba bicicleta trasera venia otr bicicleta su madrela trasladan ambulancia hospital para su evaluacion vez dan alta lapolicia permite retirar lugar,COMPROMETIDA
aci,dia abril alrededor hs iba circulando avenida casianos casa ciudade rosario es asi venia circulando dicha arteria mano izquierda encierra colisiona parte derecha ciclista mendieta nicolas maximiliano qe iba circulando par miaampliacion asegurado reparte circulaba calle casiano casas sur norte llegar altura iba izquierda encierra hace derecha sin advertir su parte iba bicicleta cual toca espejo retrovisor provocando su unico ocupante caiga piso tercero sufre colisiona rodilla codo muneca asegurado llamo policia ambulancia traslado tercero asegurado fue trasladado comisaria no hicieron ningun tipo analisis d,COMPROMETIDA
aci,yo circulaba calle agrelo esquina gurruchaga aparecio bicicleta mano izquierda yo ya estaba punto cruzar interseccion calles conductor bicicleta intento frenar rueda trasera giro yo intente esquivarlo perochoque rueda trasera bici baje para socorrer ciclista no sufrio ninguna herida ni colisiona solo rueda trasera bici estropeo tome datos ciclista quede contactarme,CONCURRENTE
aci,denuncia asegurado estaba estacionado abri parte izquierda venia bicicleta peche misma cayo,COMPROMETIDA
aci,circulaba avenida christophersen sur norte llegar intreseccion avenida mendiluce estaba terminando cruzar misma colisiona motocicleta circulaba alta velocidade este oeste parte derecha mi motocicleta no tenia frenos conductor circulaba sin casco,COMPROMETIDA
aci,estaba detenida semaforo arranca colisiona bicicleta no hubo lesionadosen momento hecho intervino movil control convivencia preguntaron si tenia lesiones pedian ambulancia muchacho nego porque dijo no tenia nada no dejaron ninguna constancia actuacien,COMPROMETIDA
aci,encontraba circulando calle doblar venia chico contra mano bicicleta colisiona espejo retrovisor mi,COMPROMETIDA
aci,asegurado encontraba ingresando estacionamiento calle indicada balizas puestas ciclista colisiona parte trasera izquierda persona cayo asistio motocicleta urgencias indico no era necesario ambulancia ya nopresentaba lesionesampliacion asegurado reparte circulaba calle salta llegar altura luz giro colocada dobla izquierda para ingresar su garaje dicho momento no advierte bici senda circulaba ciclista cual termina colisiona parte trasera izquierda asegurado ciclista iba solo dolia sus manos llamo ambulancia llegando lugar moto servicio urgencias quien determino no era necesaria ambulancia no hubo participacion policial lugarla asegurado iba sola no ha recibido citacion policial ni llamado abogado alguno hasta presente,COMPROMETIDA
aci,denuncia asegurado circulaba calle mariano garrido doblar derecha para ingresar callelavenida colisiona bicicleta venia parte izquierda como consecuencia elconductor misma cae sueloampliacion asegurado reparte venia circulando calle mariano garrido llegar interseccion realiza giro su derecha sin visualizar venia circulando ciclista sentido esa calle asegurado queria incorporarse reparte asegurado ademas tenia sol frente produciendose asi leve colisiona ciclista su parte izquierda delantera,COMPROMETIDA
aci,denuncia asegurado indica saliendo marcha trasera su garage sale su casa antes incorporarse calle es aparece ciclistaque parecer como habia muchos s circuclando calle no puede esquivarla e colisiona contra rueda auxilio camionetaasegurado ciclista iba sin casco cae dolia mano no hizo falta ambulancia hombre siguio su camino,COMPROMETIDA
aci,conductor indica circulaba norte sur doblar derecha menor anos venia misma direccionque asegurado vereda baja calle colisiona rueda delantera bicicleta rueda delantera ninovenia sin casco cae bici pero parecer no tenia lesiones procede ambulancia llevan nino hospital santa rosa decalamuchita conductor tambulancia para hacerle control ni conductor ni nino presentaba danos,SIN RESPONSABILIDAD
aci,esposa asegurado informa circulaba avenida dicha cual tenia paso pasar bicicleta delantera asegurado colisiona generando caiga bicicletaciclista informo no tenia ningun dano no hubo intervencion medica,CONCURRENTE
aci,denuncia asegurado indica venia circulando avenida nunez llega rotonda colisiona bicicleta venia circulando porla misma procedia salir colisiona parte trasera asegurado ciclista no cae mismo no llevaba casco levanto yse retira lugar circulando no hubo asistencia policial ni ambulancia,COMPROMETIDA
aci,dia miercoles dirigia destino cordoba gol trenmix desde centro ciudade jesus mariavenida circulando calle vicente agfcero siendo horas momento cruzar calle chile miro para dos izquierda derecha observo ninguno dos lados venia ningun cruzo sin inconvenientes dosbadenes cruce siguiendo calle vicente agfcero notese existir badenes iba muy baja velocidauna vez terminado pasarel segundo baden repentinamente bicicleta colisiona mi parte delantera derecha misma queda incrustada debajo delantera brian blanco quien manejaba bicicleta cae delantera este colisiona ocasina colisiona raspon manorodilla cabeza parte derecha desciendo brian ya habia levantado piso procedo llamar siendo hs alos pocos minutos arriban oficiales campos san,DISCUTIDA
aci,circulaba calle colon interseccion larrea entro colisiona unabicicleta,COMPROMETIDA
aci,esposo segurada indica circulaba calle abril doblar hacia izquierda para retomar aguero e colisiona suespejo retrovisor izquierda ciclista circulaba sentido contrario asegurado intervino ambulancia ni policia ciclista momento no acude ningun centro asistencial pero luego realiza placas lamuneca dolores,COMPROMETIDA
aci,asegurado declara venia circulando calle doctor rivas interseccion primero mayo asegurado colisiona aun ciclista venia esa misma calle colisiona produjo parte delantera tercero manifesto dolores nointervino policia ni ambulancia asegurado intercambulancia datos tercero,COMPROMETIDA
aci,dia junio siendo alrededor horas circulaba avenida san martin ciudade san lorenzo direccion surnorte previo interseccion calle eva peron esquivo unos jovenes venian circulando motocicleta no observo carril derecha venia circulando sr matias oscar sauvanet bicicleta cual colisiona espejo derecha este cae calzada sufriendo colisiona leves lugar hizo presente policia ambulancia ampliacion asegurado manifiesta formalizo productor san lorenzo entregando cap doc pero no recuerda datos solicitamos nos pase nuevamente cuanto mecanica reparte san lorenzo venia circulando su avenida san martin sur norte antes llegar interseccion eva peron realiza maniobra para esquivar moto no advierte ciclista circulaba su mismo sentido su derecha ciclista sauvanet matias oscar anos cae asfalto resulta corte rodilla traumatismo craneo sin perdida conocimiento lugar hace presente ambulancia traslada tercero movil policialen cria realizan analisis orina conductora va no ha recibido novedahasta fecha d,COMPROMETIDA
aci,estacionado e mano derecha calle cuanabro parte delantera izquierda mi no veo bicicleta circulaba misma colisiona abrir puertacayendo su ocupante suelo llamo ambulancia como no viene llevo ciclista alhospital queda observacion,COMPROMETIDA
aci,asegurado informa mientras encontraba circulando calle mencionada tiene sentido este oesta llegar lainterseccion calle rivadavenida tiene sentido norte sur ya cruzando interseccion es colisiona bicleta circulabapor calle rivadavenida contramano colisiona aprte delantera bicleta espejo retrovisor izquierda asegurado elciclista cayo bici producto colisiona no llego caer piso no manifesto lesiones no hubo presencia policial ni ambulancia dano rueda delantera bicileta asegurado acerco tercero hasta su domicilio,DISCUTIDA
aci,circulaba calle sentido esteoeste llegar interseccien calle freno yalcanzo rozar frente mi unidaa bicicleta circulaba esta ultima consentido surnorte,COMPROMETIDA
aci,denuncia asegurado circulaba manuel lopez querer doblar hacia cordillera falta iluminacion no ve cruza persona bicicleta,COMPROMETIDA
aci,circulaba olleros llegar fontella no alcanzo frenar tiempo colisiona unsenor circulaba fontella bicicleta,COMPROMETIDA
aci,conductora indica encontraba circulando calle mencionada encontraba colisiona avenida calle es colisiona parte bicicleta circulaba juan domingo peron bicicleta cae piso participo ambulancia policiaampliacion asegurado reparte circulaba calle pedro rios oeste este llegar interseccion calle presidente juan domingo peron trafico queda detenida medio interseccion bicicleta circulaba peron sur norte colisiona parte delantera derecha asegurado ciclista colisiona sus manos rodilla asegurado llamo policia ambulancia traslado tercero centro asistencial funesd,CONCURRENTE
aci,amigo asegurado habia estacionado asegurado procede abrir parte para bajarse mismo no visualiza venia ciclista calle mencionada cual colisiona parte asegurado ciclista cae bicicleta pero sin problemas levanta retira sus propios medios lugar no hubo participacion ambulancia ni policialampliacion asegurado reparte circulaba calle zeballos estaciona llegar altura entre calles san martin maipu va descender abre parte sin darse cuenta pasaba bicicleta ciclista iba solo colisiona contra parte cae piso no sufrio lesiones levanto rapidamente no quiso llame policia ni ambulancia intercambulancia datos cada uno retiro sus propios medios asegurado iba solo no ha recibido llamado abogado ni citacion policial hasta momentod,COMPROMETIDA
aci,asegurado indica encontraba circulando calle iriondo yendo hacia su trabajo cruza ciclista circulaba mosconi asegurado no ve llegar cruce colisiona parte delantera ciclista cae no llevaba casco sufrio corte cabeza parte derecha diversos raspones intervino ambulancia policia intervino comisaria nota pericia ampliacion asegurado respecto mecanica reparte venia circulando su avenida iriondo sur norte llegar interseccion calle mosconi no puede evitar colisiona ciclista circulaba esta ultima oeste este arribando en parte izquierda ciclista unos anos cae asfalto resulta colisiona corte cabeza no tiene perdida conocimiento es trasladado lugar ambulancia hospital gamend,COMPROMETIDA
aci,asegurado indica estaciono enfrente negocio para ir comprar querer bajarse ve espejo retrovisor visualiza unciclista cierra parte pero igualmente toca manubrio bicileta ciclista cayo principio no dolia nadapero luego paso policia justo ciclista paro llamaron ambulancia ahi indicaron tenia esguince dedo derecha ambulancia no traslado ningun centro sino unicamente puso venda,COMPROMETIDA
aci,conductor asegurado estaba saliendo lentamente estacion servicio chico andando bicicleta cruzay colisiona chico bicicleta no quiso ir medico pidio deje su casa pasaron datos,COMPROMETIDA
aci,denuncia asegurado circulaba calle echeverria girar hacia derecha para ingresar constitucion ciclista circulaba izquierda asegurado avenida frente e colisiona parte izquierda mismo ciclista cae bicicleta pero igualmente seretira lugar sus propios medios hubo asistencia policial ambulancia,COMPROMETIDA
aci,asegurado indica encontraba circulando circunvalacion acceso sur norte sur detiene mts antes avenida febrero dado su nieto tenia bajar necesidaestaciona balizas parte cordon asegurado baja su nieto viene grupo ciclistas quienes venian corriendo carrera mayoria abre pero uno colisiona contra parte trasera izquierda asegurado cayo ciclista tuvo lesiones leves llevaba casco intervino ambulancia policia comando radio electrico rosario fue atendido escena asistencia medica movil sies cargo dr canavenida asegurado reparte circulaba avenida circunvalacion sur norte unos mts antes llegar avenida febrero detiene banquina debido su nieto iba necesitaba orinar coloca balizas bajan internan unos mts ese momento aparece peloton ciclistas esquivan detenido menos uno colisiona parte trasera izquierda mismo cae piso ciclista iba bicicleta competicion sufre serie escoriaciones rodillas manos asegurado llamo policia ambulancia asistio tercero lugar asegurado fue comisaria donde dejo constancia hecho no realizaron ningun tipo analisisd,CONCURRENTE
aci,conductor indica encontraba detenido mano izquierda esperando doblar hacia izquierda habilitarse semaforo para pueda doblar bicicleta circulaba misma avenida pero sentido contrario cruza semaforo rojo asegurado no logra ver colisiona ciclista cae piso participo ambulancia policiaampliacion asegurado reparte circulaba localidade granadero baigorria sur norte avenida san martin llegar altura detiene semaforo carril izquierda esperando mismo habilite giro izquierda cree es calle chile semaforo habilita comienza doblar izquierda aparece san martin norte sur bicicleta no respeta semaforo asegurado no ve cual termina colisiona bicicleta iba mujer unos anos llamada sendra roxana noemi sufre serie colisiona asegurado llamo policia ambulancia esta ultima traslado tercera hospital eva peron asegurado fue trasladado comisaria no hicieron ningun tipo analisis d,CONCURRENTE
aci,voy saliendo mi domicilio marcha trasera dejo pasar s no ver nada mas avenida yun ciclista apura para pasar es tocado mi cae asfalto retira porsus propios medios luego presenta manifiesta esta dolorido hara atender,COMPROMETIDA
aci,circulaba chacabuco girar derecha para subir su casa colisiona ciclista circulaba misma direccion,COMPROMETIDA
aci,circulaba parravenida direccien avenida juan b justo mi parte izquierda baja laciclovia repentinamente chico bici colisiona rueda parte izquierda no secaye piso ni nada selo dolia tobillo,COMPROMETIDA
aci,asegurado indica circulaba calle pasteur interseccion primero mayo ciclista coliciona su ampliacion asegurado reparte circulaba calle pasteur sur norte estar llegando calle ro mayo ve bicicleta iba haciendo zigzag esta pasando siente leve colisiona parte derecha su mira espejo retrovisor ve ciclista estaba tambulancia pero no llega caer transito asegurado hace unos metros mas estaciona desciende espera ciclista este detiene mira fijo luego reinicia su marcha era muchacho unos anos tez triguena contextura media no posee ningun dato no hubo participacion policia ni ambulancia lugard,COMPROMETIDA
aci,denuncia asegurado circulaba calle jr jimenez cruzar general bustos colisiona parte derecha altura espejo retrovisor ciclista quevenia sin ningun tipo luz yo nunca vi no puede frenar debido lluvia recibio colisiona pecho procedimos llamar ala ambulancia medico nos indico no habia lesiones gravenida llevan dudas clinica reina fabiola oficial depolicia nos indica no hay lesiones no hace falta ir dependencia ni secuestrar,COMPROMETIDA
aci,voy circulando calle oesteeste estar cruzando interseccion avenida esta viene ciclista colisiona mi parte derecha mitadel cayo no quisoasistencia,COMPROMETIDA
aci,asegurado declara circulando calle mayo colisiona levemente ciclista iba conduciendo borsone ampliacion asegurado reparte circulaba localidade perez calle mayo este oeste llegar interseccion calle borzone no alcanza ver bicicleta venia misma norte sur hombre unos anos aproximadamente cual toca su vertice delantera derecha ciclista cae colisiona hombro cadera asegurado llama policia ambulancia hacen presentes tercero es trasladado sala primeros auxilios luego sanatorio delta d,COMPROMETIDA
aci,iba circulando calle edison repente aparece ciclista contra mano ampliacion asegurado respecto mecanica reparte venia villa gobernador galvez circulando su calle edison este oeste llegar interseccion avenida juan peron doble sentido circulacion para transito dispone girar hacia derecha para tomar esta ultima hacia norte asegurado mira hacia izquierda ve no venia ningun dispone avenida aparece desde derecha bicicleta no puede evitar colisiona asegurado nos dijo no llega ver nunca ciclista hasta colisiona no sabe si venia vereda o calle solo aparece desde derecha bicicleta iba hombre unos anos identifico como morato ariel cae asfalto pero no resulta lesiones visibles no hay intervencion policia ni ambulancia lugar intercambulancia datos bicicleta quedo danada tercero retiro acarreandolad,COMPROMETIDA
aci,circulaba chaco gire direcciben senillosa pocos metros esquina cruzbe bicicleta diagonal parabuscar bici senda cual dice toque cosa mi parecer no hiceme increpo insultos pateo parte trasera ocasionando dabos aprecian fotointervino policdda same tomando datos ambulancia revisando no tuviese heridas consecuencia caddda cual verifico same delantera cada uno retiro,COMPROMETIDA
aci,agaramonsaliendo mi domicilio ya habiendo llegado calle veo viene sentido contrario circulacion bicicletarealizando maniobra para evitar colisiona reversa rozo parte derecha trasera parey bicilceta meenviste colisiona parte delantera izquierda,COMPROMETIDA
aci,encontraba circulando baja velocidapor santa fe hacia oeste momentos bicicleta circulaba pje gualeguay ingresa contramano calle santa fe hacia este colisiona parte delantera derecha mi vehuculo cabe destacar ciclista era menor eday no resultcb lesionado no quiso ser atendido alegando encontraba bien retircb sus propios mediosampliacion asegurado circulaba calle santa fe este oeste llegar interseccion pasaje gualeguay aparece bicicleta circulaba esta trata ingresar santa fe pero contramano bicicleta colisiona contra parte delantera derecha altura rueda ciclista tendria unos anos cae piso pero no sufre lesiones si rueda bicicleta quedo torcida no quiso llame policia ni ambulancia luego rato retiro,COMPROMETIDA
aci,enuncia asegurado circulaba rotonda sedora bicicleta circulaba misma tambulancia parte interno larga colisiona doblar yo freno pero alcanzo tocar larueda traseraaclaro sedora ni caycb piso tanto no sufricb lesicbn alguna,COMPROMETIDA
aci,enuncia asegurado yo circulavenida calle asuncion llegar cruce juan larrea dispongo doblar izquierda momento cruzar calle colisiona bicicleta parte delantera altura optica delantera izquierda esta persona cae sentada lacalle yo detengo marcha no sufre dabos bici no sufre dabos conductor bicicleta mi tampoco levanta sus propios medios llamaa policia pregunta como sucedio sebor bicicleta insiste no paso nada solo tenga cuidado ofrece llamar ambulancia pero no hace falta retira policia sin tomar datos hombre retira andando su bicicleta,CONCURRENTE
aci,enuncia asegurado circulaba avenida tissera sentido centro mendiolaza llegando calle abelias coloco guibo para doblar izquierda ya entrando calle abelias colisiona frente mi vehddculo pasando capot rompiendo parabrisas cayendo alfalto,COMPROMETIDA
aci,enuncia asegurado unidaasegurado circulaba calle belgrano sur norte llegar lainterseccion calle santigo temple es colisiona su parte izquierda unabicicleta ocupante bordo circulaba esta ultima via oeste esteel colisiona inicial fue sector delantera izquierda pero tambulancia colisiona sector trasera mismo parte ya bicicleta ciclistarebotan pegan ahi luego primer colisiona ciclista cayo suelo presentando solo colisiona no quiso intervencion delservicio asistencia medica,SIN RESPONSABILIDAD
aci,ecosport circulando alberdi velocidareglamentaria lucesreglamentarias sentido rosariosan nicolus cruza repente bicicleta sin luz yciclista sin chaleco reflectivo ni casco ampliacion asegurado reparte circulaba calle alberdi sur norte llegar interseccion calle misiones aparece colisiona bicicleta no llevaba ningun tipo luz cual no sabe donde aparecio bicicleta iba mujer sufrio lesiones llamo policia ambulancia traslado tercera hospital samco donde manifestaron tenia fractura asegurado tambulancia fue trasladado primero hospital donde extrajeron sangre luego comisaria donde labraron actuaciones policiales,COMPROMETIDA
aci,asegurado declardf sacando su vehddculo garage marcha atr colisiona levemente ciclista cual no viampliacion asegurado reparte encontraba saliendo marcha tras garaje encuentra calle matheu pasa trasera bicicleta hombre unos anos no ve llega tocarla cual mismo cae sufre colisiona sus rodillas pero no quiso llame policia ni ambulancia asegurado quiso darle sus datos tomar ciclista pero este fue luego aparecio su casa pidio datos seguro asegurado no requirio datos tercerodtx no ha recibido citacion policial ni llamado abogado alguno hasta fecha no posee mas datos tercero no va reclamard,COMPROMETIDA
aci,esposa asegurado encontraba movimiento leve calle indicada poniendose posicion para estacionarcuando bicileta mete entre medio vehiculio asegurado otro estaba estacionado este ciclista cae otro raya asegurado esta persona lastimo dedo mano izquierda no concurrio policia ni ambulancia ampliacion asegurado reparte circulaba calle amenabar llegar altura avenida lentamente detiene doble fila para estacionar ese momento ciclista intenta pasar entre asegurado uno estacionado colisiona contra estacionado rebota manubrio raya parte ciclista hizo raspon dedo mano izquierda no quiso llame policia ni ambulancia intercambulancia datos cada uno retiro sus propios medios,CONCURRENTE
aci,circulaba norte sur calle french llegar berutti colisiona aun ciclista circulaba berutti cual tiene sentido este oeste,COMPROMETIDA
aci,agaramonal deterner marcha apagar calle intersecciones aldisponernos bajar es abrir parte tercero circulabaen su bicicleta llevo delantera,COMPROMETIDA
aci,asegurado circulaba solo calle llegar avenida doble mano boulevar mira antes cruzar primer arteria siente ruido ahi ve aparece mujer asoma frente deli aeg baja asiste tercera levanta su bicicleta no puedo precisar donde aparecio llamo viene policia ambulancia lugar trasladan hospital sin lesiones gravenida tercera acusaba dolores varios todo cuerpo pero entero no tenia nada fracturado,COMPROMETIDA
